subreddit,author,id,title,selftext,created_utc
Coffee,LavendarAmy,l4nmv7,After a week i finally figured out why my coffee suddenly started tasting so disgusting and sour,It was my milk. my milk was spoiled super hard. ;-;,1611580515
Coffee,halfwayman94,l4nibs,When will that glorious day come...,When u/kingseven and u/meileaf_don make a video comparing tea tasting with coffee cupping?,1611580043
Coffee,JonathanBennett65,l4mn9i,Coffee Invasion,,1611576597
Coffee,kailoz,l4lxww,Looking for Spanish speaking guests for a coffee podcast,"Hi :)

I am starting next month a podcast about coffee and I am looking for Spanish-speaking guests.

The idea is to talk about coffee for people who are noobs in the coffee world to get educated to specialty slash proper coffee.

If you know somebody who can be interested please let me know :)",1611573475
Coffee,AnsonLok,l4lk4w,Hario Switch vs Kalita Wave,"I currently have a Hario Switch. Would it be worth it to get a Kalita Wave?

I haven't found anyone comparing these two. Does anyone happen to have these two?

Have heard that Kalita Wave is a lot more forgiving, but to me Hario Switch is pretty forgiving already.",1611571861
Coffee,explanetoryape,l4lgvz,Good robusta coffee beans?,"I'm trying to bring my new flatmate into the world of coffee beyond his current go to of pre-ground Vittoria beans. He enjoys the milk coffees I make, but doesn't enjoy the filter coffees we make when using fancier beans. I'm thinking that he's probably gotten used to robusta flavours and probably the darker roast, so I'm trying to find a good fancy robusta bean that we can try. I did James Hoffman's world's largest coffee tasting where he had a great robusta, but I don't believe that square mile actually sells it?",1611571458
Coffee,overextraction,l4k383,Can immersion have the same strength as espresso?,"What brewing method has the higher possible strength: Immersion or percolation?

In another thread it was argued that because of the faster extraction speed of percolation, espresso can achieve a strength that immersion methods can't. 

I would argue that water has a max concentration of soluble material. Immersion (given enough time) will reach this concentration/strength. Percolation extracts faster, but at best it extracts until it is fully saturated (at the same strength that immersion reaches) and if not ideal, will leave the coffee bed undersaturated. This leads me to the conclusion that immersion and percolation can reach the same strength (all other variables being equal). I would even say that immersion will generally have more strength than percolation. 

If we were to use an espresso grind size and typical espresso ratio in an Aeropress, we should be able to get a strength similar to espresso.

Am I wrong? Does anybody here have a refractometer to verify this?",1611565504
Coffee,WebDevJourneyWDJ,l4iepq,Good Coffee Shop," Does any one know if there is a app that shows you some good coffee shops, even hole-in-the-wall coffee shops (that's not a Starbucks) that's around you?

Been trying to get into the coffee scene and honestly never really had a good cup of coffee. Would really love to know what good coffee is.",1611558527
Coffee,bloodredyouth,l4hzsg,Moka pot brewing weak,"Hello! I’ve been using a 6 cup moka pot to brew an espresso roast and the coffee is coming out weak. Ive been using the Hoffman method and I’ve been using a med- fine grind. Is my coffee grind not fine enough? When i make a latte, it just ends up tasting like a cafe AU lait.",1611556842
Coffee,tattarrattattat,l4hj4z,"Need help getting started/Calibrated (Niche Zero, Breville Precision)","I’m pretty new to coffee but it definitely seems like my corse grinds seem very fine and I’m not getting good results. Here’s the question- how do I know when I’m doing it right/when the grind is tuned in? 

I’m trying a Hoffman recipe on a Breville Percision Brewer / pour over v60 attachment with a Niche Zero grinder. My coffee right now is a pretty fresh medium roasted Peruvian blend. 

Basically my recipe is:
46 on the grinder
15g coffee for 250g water
45 sec bloom
208F (the hottest it can go)
(Pre-wetting the paper filter)",1611554940
Coffee,little_ramen,l4fwxn,"Looking to get my first espresso machine (under $1000), thinking about Gaggia Classic Pro or Breville infuser. I have barista experience.","I’m looking for a machine that can make abover average espresso (I know it won’t be super high quality like the machine I’m used to) and steam milk well for latte art. I’m not a barista anymore (covid) but I miss making my own lattes and cappuccinos. I’ve been trying to do a lot of research on machines but I’m just having a hard time deciding, I never know if reviews are paid for anymore. 

Also, if I did get the GC I would really want to add a PID. Not sure if that’s a good idea or not. And if it was difficult to add or not. Just hoping for some clarification, I suppose.",1611548863
Coffee,GuyThirteen,l4fmye,Constantly swirling a pourover,"We know from extraction theory that percolation brews (such as pourovers) can ultimately extract more than immersion brews because fresh water is constantly being added, and this better facilitates osmosis out of the beans. We also know that the difficulty with pourovers is ensuring even extraction.

So, why not just pour all of your water in one go, while constantly swirling your brew vessel, until you've hit your target weight? It would solve the evenness problem, but it would achieve more extraction than immersion brews because water is constantly being replaced. You'd achieve a complex pourover brew, but with no technical skill required. If you wanted to, you could change extraction speed by just changing pouring speed, and tweak the flavor that way.

I've tried this, and couldn't tell a difference between it and Hoffman's pourover method--but my technique for the latter wasn't perfect, and my pallete is untrained, so I can't make any conclusions. What do you think? And what problems are there with my theory?",1611547858
Coffee,OligarchLegend,l4fkkr,"So, what next?","Hi everyone,

This subreddit has helped me immensely to start off on my coffee journey, so posting here now to figure out what next.

I'm currently using a Moka Pot and a Timemore C2, and have really been enjoying some freshly roasted medium and dark beans in it. I like the Moka for the strong espresso-like coffee it brews and find it very yummy.

I don't how weird this sounds, but I tend to not enjoy regular coffee too much because it's just too much liquid for drinking coffee to me. Even regular americanos at that. I prefer smaller and stronger doses, hence the Moka. I know the logical next step would be espresso, but I live on a student budget. I've been eyeing the Flair but it's still some months/years away for me. So, what can I use to brew coffee next to explore the world more? Basically something that gives me nice bodied shots with all the good flavours of coffee.

Thanks in advance!",1611547633
Coffee,joshhamill,l4f1mq,Iced Coffee is better than Hot Coffee,,1611545788
Coffee,jooyun,l4epn3,what foods do you like to dip in your coffee?,"i love dipping biscotti into my morning cup, and i've also enjoyed dipping ladyfinger biscuits lately. they're not too sweet and soak the coffee flavor really well.

what other usual/unusual foods are great for dunking into coffee?",1611544644
Coffee,dirtdobber_205,l4dvks,Just an Espresso Machine At Work,,1611541886
Coffee,--solaris--,l4dm5c,Looking for Ethiopian Harar coffee,"Hello fellow coffee lovers! 

I’m looking for a good Ethiopian Harar whole bean to buy online. Let me know if there is a particular brand or local roaster that has a bean that you enjoy! Must be freshly roasted (obviously), which is why I’m always weary of buying from a new roaster without a recommendation. Thanks in advance!",1611541022
Coffee,basicmow33,l4d480,Any Hacks Out There To Lower Acid Reflux? Coffee Lover In Need Here!!....,,1611539394
Coffee,SleepyReepies,l4cl3r,"I need a manual grinder, 'upgrading' from Baratza Encore.","I just don't want to wake people up in the early mornings with my Encore so I'm looking for a decent manual grinder. I have an Aeropress and a V60, but I mainly use the V60. Any suggestions?",1611537614
Coffee,BenHarper20,l4c278,Shelf Life on Beans?,"tl;dr:  Once a bag is opened how long are beans good for?  From time of roasting in a sealed bag how long are beans good for?

Since getting my Baratza Grinder and revisiting my Aeropress after years and discovering this awesome reddit I've been obsessed with coffee at home.  As per recommendations in this thread I went down the rabbit hole of buying from awesome roasters all over the world.  They all showed up this weekend and I think I ordered a bit too much coffee lol.

Ideally I'd love to open these at the same time and compare different roasts and have something different everyday.  Some are samples so that's easy, but I also don't want to open one and let it sit if the beans are going to go bad?  So:

How long do beans stay good from the time they're roasted?

How long do beans stay good once they're open?

Bonus question, how do you guys typically seal your beans?  

Our local roaster has a bendable plastic type thing that seals it shut on the outside once you roll it down.  Beans from B&amp;W don't seem to have this so I just used the sticker to tape the top to the bag after I rolled it down.  Is this sufficient?  I know they make actual coffee containers to seal beans and suck out oxygen but they're expensive and I'd like to have a few going at once.  Thanks so much for the help as always!",1611535902
Coffee,FellowBarber_,l4azf3,Coffee freshness,"Wondering what people’s thoughts are on if coffee looses quality/freshness faster once opened? Or does the ageing process really begin after roasting? 

I’d like to have a couple of bags of coffee open at the same time, to not get bored of the same coffee

Thanks!",1611532424
Coffee,JFAT99,l4ataq,"Do combinations of espresso and filter coffee, or two filtering methods, exist?","I recently thought that it might be a good experiment to make a coffee drink based on the blending of two different methods. And it strikes me that there's no evidence of anything like it existing in the internet, which might be for two causes: it's horrible and an extremely bad idea, which someone tried and is ashamed to admit; or no one even thought about it.

What do you say?

I have thought of two possible combinations:

First, some kind of Americano. Espresso and, instead of water, a filtered coffee that maybe should be light and clean (Chemex perhaps), obviously bringing up some tastes the espresso might lack, thus making a complete pallette of flavours.

Second, the combination, now, of two filtered coffees by different methods. Again, obviously, the flavours should complement each other. This can be more experimental in textures, given that two immersion methods can bring up their characteristics (like the sediment and the bitterness), maybe playing among them, or contrasting them with the more sweet and lighter body of the drip methods. In these blends, proportions should play also a major role, I suppose.

And, in both cases, maybe one could also experiment with different beans for each method.

Anyway, let me know what you think.",1611531887
Coffee,Jonathanjacks12,l4aexz,Kalita trouble,"I have been brewing pour overs at home since around 2017 when i became pretty sick of espresso having worked as a barista for a year (when i was 15) and they quickly became my favourite brews. i’ve gone from a basic V60 to a Chemex and am now using a Kalita wave 155 with Hoffman’s V60 instruction. i have never had any trouble with the taste or extraction of my coffees until i bought a Wilfa Svart grinder. 
previously i had been hand grinding with a little rhino, with which the only notable issue was the effort required, so i decided to invest in something that would make life much easier. I have had this for a few weeks now and the first coffee i made with it was amazing, really sweet and complex. this has only gone downhill and now i am struggling to get any acidity and my coffee just tastes bitter. currently i have 3 different coffees on the go and they all seem like they are being poorly extracted.  i have tried to adjust the grind and if i go coarser it runs through far too quickly, and i don’t think taking it finer will help as it is getting bitter already (i am around the P on aeropress for those that have one(you’ll know what i mean)). this morning i hoovered out around the burrs and removed any coffee that was stuck around there, and this made no difference which made me write this asking for help...so if anyone has any suggestions as to what can be done i’d greatly appreciate it. 
cheers",1611530653
Coffee,davereeck,l4a7et,Free Brewista kettle flow limiter - just ask,"I bought a [kettle flow limiter](https://www.amazon.com/dp/B075J1Y2Q9?ref=ppx_pop_mob_ap_share) on the off-chance that it fit my bonavita kettle. It does not, unless you cram it in the spout end - with predictable and undesirable results.

Anybody want to goof around with it? Drop me an address and I'll happily mail it along.",1611530020
Coffee,kzeash,l4a5xm,Zero calorie creamer?,"I just recently quit smoking &amp; am trying to lose weight. I eat relatively healthy, however, I have discovered that the majority of my calorie intake is from coffee because I enjoy a lot of creamer. I switched to sugar free creamer, which is 15 calories per teaspoon but I’m still at a plateau. What can I use that is zero calories or less than 15 calories? 

I am debating on if I should just give up coffee all together since I only enjoy it with a ton of creamer, but that seems like a bummer! I did see the ‘Walden Farms’ creamer that is zero calories but there was mixed reviews on it. 

I would love to know if anyone has any other products in mind that I’m not aware of. TIA.",1611529892
Coffee,ty4723,l4a262,Mount Hagen VS Cafe Tastlé,I know instant coffee. I was just wondering which of these you thought was better for on the go and camping because overall people said there were pretty similar. These were chosen as most others are terribly burnt and acidic.,1611529567
Coffee,txscope,l49f7y,Whats is the ration for 1 cup on moka pot,How much coffee to get 1 cup of coffee on moka pot?,1611527605
Coffee,kwtb,l49c98,Espresso Machine Recs,"Hi
I’m shopping for a nice espresso machine

Ideally around $300-600 range 

While watching some James Hoffman review videos I was thinking the Sage Bambino Plus..

The only downside is that a built in grinder sounds really nice.

And I’m kind of a newbie so not looking for anything tooooo complicated.

Do you guys recommend rhe Sage?

And what’s your most reccomebded machine that has built in grinder?

Or should I get over that and just get a separate grinder?

Appreciate the help!!",1611527366
Coffee,KnowYourselvess,l492mz,Options for grinding coffee?,"Hello!

A few months ago I got myself an Aeropress and a manual coffee grinder (Hario MSG-2TB) and I couldn't be happier! I've been grinding myself two or three cups daily since.

The problem is my hands are starting to hurt. Like, a lot. I stopped making myself coffee for a few days and the pain subsided so I guess the constant manual grinding of coffee is making my hands hurt. 

I'm looking for automatic alternatives to grinding my coffee but most of the actual automatic coffee grinders are a little too price for me at the moment. 

So what cheaper options do I have?

I've been looking at these small food processors that grind things with blades instead of burs but I'm not sure if I'll lose quality by going for that.

Thanks!",1611526577
Coffee,txscope,l48ww8,Make coffee isnt hot,"I feel that my coffee is not hot enough , what are some ways to change that?",1611526101
Coffee,Wendy888Nyc,l48soz,Double walled glass mugs for coffee- yes or no?,"I think I recall James Hoffmann saying he doesn't like double walled glassware for coffee. Does anyone know why? I'd like to buy a double walled glass mug as a change from ceramic. (I brew into a cup and would like to see the brew) The ones I'm interested in are from Fellow, Bodem and Blue Bottle. (The BB one is beautiful) 

For those of you who've used these types of cups; do you recommend them for coffee?  Are there any issues with coffee temperature.  Would you say they're comparable to a good ceramic mug?

https://bluebottlecoffee.com/store/blue-bottle-x-bodum-doublewalled-mug?gclsrc=aw.ds&amp;&amp;gclid=Cj0KCQiA0rSABhDlARIsAJtjfCeHX1DZXt35Ky6oTiQ7OCCyQNwTV0xKF_dtijVXJZUDAJMKvAnzyWsaAtnUEALw_wcB&amp;gclsrc=aw.ds",1611525768
Coffee,daFuuzz,l48g4t,Does this seem right?,,1611524752
Coffee,baby_caree,l47mct,if this design on shirt Will you buy it?,"&amp;#x200B;

https://preview.redd.it/eppgljnmhcd61.png?width=5090&amp;format=png&amp;auto=webp&amp;s=c5c41f6b14e771f21e25c53299e8f6c391ce0e97",1611522367
Coffee,Memoruiz7,l47j5f,"After years of being a workhorse, my bodum grinder has finally perished.","After my bodum pour over coffee maker died, I upgraded to a technivorm mocha master. I want to upgrade my grinder. 

My question is, I would love to have a built in “scale doser”, but I am not sure what ti buy. 

The Breville Pro is $200 or should I buy something without a scale like the Bartza Encore for $139?

I mostly do pour overs and I use my Technivorm daily. It would be nice to skip the “weighing my beans step” every morning. I have no need (yet) for an espresso grind. 

Any input is highly appreciated, because as of today, I only have a hand grinder.",1611522135
Coffee,lIllIIlllIIIllllI,l47idp,"Knock Aergrind O-ring broke, no replacement. Anyone know the size of this thing?",,1611522080
Coffee,mattr0city,l474s8,Tips for managing pour over strength,"I use a v60 at home and a Wilfa Uniform grinder and if I use a 1/17g ratio at a grind setting of 28 (the largest suggested size for pour over for a Wilfa Uniform), I'm still finding that it is too strong when I drink the cup when compared to how pour over tastes at a coffee shop. I've also tried following the pour method that James Hoffman suggested. Is it just that I should increase water usage or maybe there are better ways to keep the extraction and maybe dampen the strength a bit? I feel like I am doing something wrong. Thanks for any tips!",1611521119
Coffee,menschmaschine5,l46u64,[MOD] The Official Deal Thread,"Welcome to the /r/Coffee deal and promotional thread! In this weekly thread, industry folk can post upcoming deals or other promotions their companies are holding, or promote new products to /r/Coffee subscribers! Regular users can also post deals they come across. Come check out some of the roasters and other coffee-related businesses that Redditors work for!

Note that this thread will be weekly at least for the duration of the COVID-19 outbreak, since many roasters are running more specials than usual to drum up business.

We encourage everyone to post deals here especially since many roasters are holding specials to drive business affected by the COVID-19 outbreak. However, note that there will be zero tolerance for shady behavior. If you're found to be acting dishonestly here, your posting will be removed and we will consider banning you on the spot. If you yourself are affiliated with a business, please be transparent about it.

There are a few rules for businesses posting promotional material:

- You need to be active in /r/Coffee in a non-self-promotional context to participate in this thread. If it seems you are only here to promote your business in this thread, your submissions will be removed. Build up some /r/Coffee karma first. The Official Noob-Tastic Question Fest weekly thread, posted every Friday, would be a good place to start, and check out what is on the Front Page and jump in on some discussions. Please maintain a high ratio of general /r/Coffee participation to posts in this thread.

- If you are posting in this thread representing a business, please make sure to request your industry flair from the mods before posting.

- Don't just drop a link, say something worthwhile! Start a discussion! Say something about your roasting process or the exciting new batch of beans you linked to!

- Promotions in this thread must be actual deals/specials or new products. Please don't promote the same online store with the same products week after week; there should be something interesting going on. Having generally “good prices” does not constitute a deal.

- No crowdfunding campaigns (Kickstarter, Indiegogo, etc). Do not promote a business or product that does not exist yet. Do not bait people to ask about your campaign. Do not use this thread to survey /r/Coffee members or gauge interest in a business idea you have.

- Please do not promote affiliate/referral programs here, and do not post referral links in this thread.

- This thread is not a place for private parties to sell gear. /r/coffeeswap is the place for private party gear transactions.

- Top-level comments in this thread must be listings of deals. Please do not comment asking for deals in your area or the like.

- More rules may be added as needed. If you're not sure whether or not whatever you're posting is acceptable, message the mods and ask! And please, ask for permission first rather than forgiveness later.",1611519891
Coffee,idrink2much_juice,l46nf3,High-quality decaf in Europe?,"Can anyone recommend a third-wave EU (excluding UK now) roaster that has a Swiss water process decaf?

I’ve just moved to Denmark from the states and it’s incredibly hard to find decaf here. I’ve found a couple roasters who offer it but it’s always around $20/8oz. I’m looking to stay around what I pay for good caffeinated coffee, $50/2lbs. 

Any input is appreciated. 

Thanks!",1611519462
Coffee,No-Signature8715,l46286,Any recommendations for a first time espresso machine buyer? $500-$2500 price range.,"I have been doing research and I keep seeing mixed reviews of “amazing” and “breaks after a few months”. Or issues with temp or grinder.

It’s hard to pick from them honestly. Would like to hear from people who have more experience.",1611517133
Coffee,eeneymeeneymeow,l45fzs,Suggestion for PA Roasters?,"I am looking for a roaster with less acidic undertones. I've tried square one and passenger coffee and didn't enjoy any of their roasts due to their coffee just being more acidic. I do love New Holland Co's blend but am looking to explore.

Any suggestions? I'm more of a medium/dark blend coffee lover and do enjoy blends as well as single-origins.",1611515058
Coffee,joeltheconner,l44rur,Green Bean Recommendations...,"Looking to roast some beans for a special event for my home town, and I am looking for some green beans that have notes of a purple fruit (purple is our school color). Was thinking about grape, fig, blackberry, plum, and raisins. But, open to anything else purple as well. Any recommendations would be great thank you!",1611512530
Coffee,Homegrounds,l44pxb,"La Marzocco Strada Review: Should You Get the AV, EE, or MP?",,1611512373
Coffee,Napalm1942,l44fvt,Larger Moka Pot = Watery Coffee?,"Hello All! I'm looking for some guidance on making lattes with a larger moka pot. I recently purchased a Bialetti Venus 10 cup moka pot. I was previously using a Bialetti Express 6 cup. Along with a Timemore C2 hand grinder at around 16-17 clicks.

I want to make 3 lattes with the 10 cup. Im following James Hoffmanns tips for using the moka pot. Which involves preheating the water and stopping the cooking process when the moka pot starts to gurgle. Which has lead to some good cups of coffee.

The issue I've encountered so far in multiple attempts is that the lattes made with the 10 cup seems to be less flavorful and kind of watery compared to the 6 cup.

Could anyone provide some advice/tips to help make the coffee less watery or is that just the nature of the beast with the larger moka pots? Any help would be appreciated.

I'm guessing I need to maybe make the grind more course or fine or stop the cooking process sooner?",1611511618
Coffee,BekoBekrija,l44b16,How do you start an online coffee business?,"So to be more precise, how do you start an online coffee business when there is only 1 local cafeteria that roast coffee, there is only 1 cafeteria that sells Specialty coffee, and the other coffee brands around are the obvious Lavazza, Bristot, Julius Meinl, the coffee brands that sell... well not so good coffee. 

Is there someone that has started an online coffee business from the comfort of their home without specialty cafeterias around them?

And one more thing... can you start a coffee dropshipping business from the Balkans. I'm based in North Macedonia.",1611511116
Coffee,IowaNew,l43fyp,Wandering Bear,Does anyone have any experience with the cold brew from this company? They advertise 2 weeks of coffee (~$1.87/drink) for $29 shipped to your door.,1611508454
