subreddit,author,id,title,selftext,created_utc
Coffee,Agentorange13813,l3jbje,Machine Died. Help!," 

Hello,

I'm relatively new to the coffee lifestyle and have run into a bit of an issue. My Keurig recently died and I am looking for some replacement options. Now I don't need anything too fancy, and I'd actually like to step away from using pods or k cups because I hate all the waste they produce. I'm the only coffee drinker in the household, so I don't need anything that can brew several cups at a time, although it's not awful if it includes a carafe. I've got pods left over, so if there is an option for pods that's cool, if not no biggie.

I need some suggestions from the coffee experts. I've done some research and feel like the Cuisinart SS10 and the Hamilton Beach Flex brew are kind of what I'm looking for. Anybody have experience with either of these or have something else to recommend?  Price point of around $100 US (a little more is fine) feels good.

Thanks in advance!",1611432428
Coffee,throwraThinking,l3j25s,"I need a pouring pitcher for latte art, does this look okay or is the spout too wide?",Not for fine designs. https://www.ikea.com/us/en/p/mattlig-milk-frothing-jug-stainless-steel-50149843/,1611431542
Coffee,kalub92,l3id5z,Figured I’d share my updated espresso bar in my home office.,,1611429508
Coffee,soidonno,l3i92i,Old school cast iron grinder,,1611429200
Coffee,brettjc04,l3i4nk,"Infused 16 hours and took 40 minutes to filter, but it is the best damn cold brew I’ve ever had.",,1611428708
