subreddit,author,id,title,selftext,created_utc
Coffee,dygital7,l42ycm,Help with Fellow EKG - and Buyer Beware in Hong Kong!,"I bought a Stagg EKG about 10 months ago in Hong Kong from Hazel and Hershey (https://www.hazelnhershey.com/)  and I've had some issues with the unit such as in the photo below. The display will show the lines and the unit will stop working requiring a restart. Sometimes the water will be boiling (water spurting out the top) and the temperature read out will still show 80 degrees celcius. Other times, the temperature read out while its boiling will go up and down by about 20 degrees, from 70 to 90. I had believed the unit to be defective so I contacted the retailer and they insisted that the unit was fine even though I told them about all my issues. Since I didn't appreciate that response, I contacted Fellow, who confirmed with me that my kettle was having issues, but since I wasn't located in the US, I would have to go through my retailer.

Well, Hazel and Hershey has basically ghosted me. I sent them multiple messages on instagram and they left me on read, and I also sent them emails which they have not responded to in the last few weeks. I am not sure what I can do to resolve my issue which is why I turn to Reddit. I guess I wanted to see if anyone could point me in some direction of a solution to the faulty kettle such as some other distributor that would honour the warranty or if someone has a contact at Fellow that would apply some pressure from the retailer point of view. Overall, I'm extremely disappointed with how Hazel and Hershey has dealt with the situation, and I would urge any readers to avoid purchasing coffee or other products from them. I had bought coffee from them on a weekly basis since they were my favourite roaster in Hong Kong, but it is evident that they don't care about their customers.

For any future potential Fellow customers, make sure you know who you're getting the warranty from, so as to not end up in a situation like me where the retailer ghosts you after you've spent $200 USD, and the manufacturer cannot assist.

https://imgur.com/a/UqQFW4j",1611506941
Coffee,Red-329,l42mag,Tried my new old syphon this morning!,,1611505947
Coffee,Forgot_the_Jacobian,l41x55,Pour overs: How to compensate with other parameters to deal with over extraction from too finely grounded beans?,"Grinder problems here, so I ordered a batch of coffee from a roaster with their 'pour over' grind. first bag was excellent, but the second time I ordered- the brew is much longer, which I presume is due to a finer grinds, and is more bitter than I would like. Im curious what other parameters I can adjust (e.g. speed of pour) to adjust to this?",1611503754
Coffee,shmoidel,l41swd,Leveling up my coffee game!,"About a month ago I got myself set up with a V60, burr grinder, scale, and gooseneck kettle with temp  control, and I’ve been honing my skills every day. About a week in I started following James Hoffman’s recipe and the results have just gotten better and better. 

For beans I was using Whole Foods Vienna roast, which by the time I dialed in I was very happy with and making delicious coffee. I signed up for Atlas Coffee Club and just made a cup with their Burundi beans (medium roast) and holy shit this is the best cup I’ve ever made. I haven’t even adjusted the grind size yet, I think I could probably go a little finer. But still, I’m floored by 1) how rewarding this has been 2) how unique these flavors can be. Looking forward to trying a local roaster once these beans run out!",1611503364
Coffee,Kinglens311,l41caw,"New grinder, need some guidance",,1611501880
Coffee,daniel-k-meme,l41c07,A short anecdote,"So I recently bought a blend from a pretty big local roaster and had been making pourovers in my v60 for my friend and I at work. I consider myself a pretty proficient hobbyist; I've got about 5 or 6 years under me doing pourovers. I spent several cups trying to get it dialed in and, while it was good, it wasn't really anything special to me. I don't usually get blends, so I didn't really know what to expect. It kind of just tasted like generic coffee. I had some other bags from the same roaster I liked much better, so I just decided to grind up quite a bit of that blend and throw it in our $10 walmart autodrip machine - just eyeballing the water level. To my complete surprise, the resulting pot of coffee was absolutely amazing and nothing like how my v60 tasted. Very fruity, chocolatey finish, pretty much perfect in every way. This was by far the best pot of coffee I've ever made in an autodrip machine, let alone the cheapest autodrip machine my friend and I could find (we bought it so we'd have a large volume of coffee to take on jobs with us, not for the quality of said coffee).

So long story short, I'm now working on reevaluating my technique. I think slower pouring is a good place to start to maybe kind of mimic the relatively slow drip of the machine.

Anyway, not here for advice necessarily, just wanted to share a story I found interesting and funny. Happy Sunday.",1611501853
Coffee,meneerjelle,l415ge,Grind times of the 1zpresso JX Pro?,"I've been grinding my coffee on a fairly old, large, Macap MXT for some years now. It still produces a nice grind consistency, but I'm looking for something with a smaller footprint and want to make it easier to switch between different brew methods. 

I'm going back and fourth between a second hand Vario (which I'll upgrade with steel burrs) and a new 1zpresso JX Pro.

For the last year I've rarely touched my Gaggia classic and have been drinking from my Bialetti/V60 exclusively, but I would like to keep the ability to dial in for espresso as an option.

I was wondering what your grind times with the 1zpresso are. How long does it take to grind about 15-18 grams for pour over? I heard it takes some people ~20 seconds, others are talking 60 seconds and up. Is it really a pain to grind for espresso on a daily basis? I brew about 4 times a day on average. Thanks in advance",1611501274
Coffee,thrasher6143,l414s9,"New grinder, need some guidance","Been making coffee for a couple years, have a hario hand grinder and I overtime I felt like I was under extracting. Now I have a encore bararza that I got for Christmas. It's very nice but it grinds my coffee so much more fine than I am used to and my coffee has been pretty bitter way darker than before. I've made 4 cups using the grinder the last three grinder settings being 15, 20 and then 28. 
The 28 is the best so far but still just a little over bitter. 

Any way I use a gooseneck kettle, bodum pour over with a paper filter in the wire screen. Coffee beans all are rated above 85 some in the low 90s. 

I just want to taste some of those finer notes that people talk about.",1611501213
Coffee,LeviAsHimself,l40t0q,My brand new Keurig tastes salty no matter what.,"My coffee maker recently died and since I'm the only one in my house who drinks coffee I decided to just buy a keurig. My issue is ever since I got it anything I run through it comes out tasting like I dumped a pound of salt into it, even if I just run water through.
I've tried looking online but can't find any information on this issue so any advice would be appreciated.",1611500114
Coffee,cubanese_dreamboat,l40mif,She’s off center but so whimsical 🤩,,1611499221
Coffee,menschmaschine5,l3xfd4,[MOD] The Daily Question Thread," 

Welcome to the daily [/r/Coffee](https://www.reddit.com/r/Coffee) question thread!

There are no stupid questions here, ask a question and get an answer! We all have to start somewhere and sometimes it is hard to figure out just what you are doing right or doing wrong. Luckily, the [/r/Coffee](https://www.reddit.com/r/Coffee) community loves to help out.

Do you have a question about how to use a specific piece of gear? Want to know how much coffee you should use or how you should grind it? Not sure about how much water you should use or how hot it should be? Wondering about your coffee's shelf life?

Don't forget to use the resources in our [wiki](http://www.reddit.com/r/Coffee/wiki)! We have some great starter guides on our [wiki ""Guides"" page](https://www.reddit.com/r/Coffee/wiki/guides) and [here is the wiki ""Gear By Price"" page](http://www.reddit.com/r/Coffee/wiki/gear#wiki_coffee_gear_suggestions) if you'd like to see coffee gear that [/r/Coffee](https://www.reddit.com/r/Coffee) members recommend.

As always, be nice!",1611486015
Coffee,Vela102,l3wvgt,Xeoleo ghost burr for gaggia classic?,"I'm looking for cheap, pretty good grinder for my gaggia classic. Found a deal for second-hand Xeoleo ghost burr(70$). Is it a good deal and grinder to go for? Anything better in similar price range?",1611483249
Coffee,IdutMain,l3vo3d,Never been a fan of coffee but want recommendations for noobie,"Most coffee I've tried ive never really liked, but wondering yalls recommendation for someone who's barely had any before",1611476932
Coffee,jcdoughnutsx,l3vnc8,Kasuya Method Question,Hi! Quick basic question. Should I stop my timer at every 45s whenever I pour?,1611476826
Coffee,4chamber,l3viut,Manual coffee grinder choking Delonghi Dedica,"I recently bought a manual burr grinder (1Zpresso JX pro) which I'm trying to use with my Delonghi Dedica espresso machine. I've found burr adjustments for espresso online but they keep choking the machine. I tried going reasonably coarse for espresso this morning, still choked. Water does pull through normally and I never had an issue when I used an electric mill, although the espresso sucked. Could there be issues other than grain size? I'm still using the pressurised baskets, is that likely to be causing problems? I've tried barely tampering as well, still just totally chokes up.",1611476173
Coffee,SOCIALLYSQUACKWARD,l3vg6t,What's the best material of shirt to wear while drinking coffee?,"I was thinking it was cotton, but some of us seem to be polyester snobs. I think it goes deeper than that. Like the type of cotton will depend largely on specifically which hill the sheep grew up on, and also might have to do with the pitch of the shepherd's voice. If the shepherd has a more shrill, high-pitched voice, it is more likely to produce a more coarse kind of cotton. I personally prefer cotton as soft as it gets, with coffee as black as midnight on a moonless night, drank on an empty stomach so I can feel the caffeine take over my bloodstream.  

What say you, fellow baristas?",1611475805
Coffee,zero-point_nrg,l3v8oh,Best bean for espresso?,"I got a Breville Barista Express a couple months ago and have tried a huge range of beans from very light to dark roast. I have tried several labeled “espresso” roast and found all but one to be darker/more bitter than I like. Medium roast beans from a local shop sourced in Colombia have been my best result so far. By best result, I mean good balance of flavors—sweet, caramel, a little bitter, tad fruity, but not overpowering. 

What have you all found makes the best espresso? 

Light roast tastes a little too sour to me in espresso (have tried fine and coarser grind) but I prefer light roast in a pour over.",1611474790
Coffee,jambaj0e,l3ujqp,Anyone tried installing the 55mm burr in a Eureka Mignon grinder that normally uses 50mm?,"I'm curious, but has anyone tried using the 55mm burr from the higher end Eureka Mignon in one of the lower end Mignon that uses the 50mm burr grinder?

[Spare 55mm Eureka Mignon burr grinder](https://www.seattlecoffeegear.com/eureka-mignon-55mm-steel-burrs)",1611471446
Coffee,araayyao,l3tzdr,coffee machine bitch,,1611468871
Coffee,drowsydoggo,l3tuxr,HELP! What's wrong with my Delter Coffee Press?,,1611468359
Coffee,zazjaz,l3ti6v,Coffee with CBD A Wining Combination !!!,,1611466860
Coffee,shoobox_,l3tfzo,"Based my design off a vintage coffee poster from the 1920’s. What are your thoughts, could you see this hanging on the wall of your local coffee shop?",,1611466583
Coffee,Dun_cheetol,l3tezu,What are the qualities of a 'good' coffee?,"Hey, there! I am pretty new in the world of coffee and I have been wondering, how is 'good' coffee supposed to be like? As of the moment, the only criteria I follow to decide whether a variant of coffee is good or not is taste. I bet there's more and I am curious to know what those aspects are!",1611466462
Coffee,zazjaz,l3t8x8,"We know the benefits of coffee and of CBD, get the best of both worlds in one !!!","COFFEE HAS BEEN SHOWN to improve your focus, concentration and mental acuity while reducing fatigue and even pain.

CAFFEINE PUMPS YOU UP and CBD generally helps you to unwind delivering the perfect biophysical experience.

New product ~ Try 10xPure now.

tessa234.myctfo.com/goldcoffee",1611465740
Coffee,tmoney031155,l3sacb,Haría V60 vs Kalita Wave,[removed],1611461938
Coffee,Chi_CoffeeDogLover,l3s59e,Third Wave Water,Smagged some Third Wave Water tablets and just picked up some distilled water to make it. Can I still boil this water? Is it ok if I leave it in my kettle for hours? Is it ok if I leave it in my drip coffee machine overnight? (I usually just prep my coffee machine with water and grind the coffee the morning I brew it),1611461390
Coffee,loodog555,l3s1ya,Made a video where I try out this AeroPress filter in the Moka pot thing.,,1611461043
Coffee,PrestigiousDisplay76,l3rqmh,"Unpopular opinion, Putting skim milk in coffee IS A SIN, change my mind",,1611459851
Coffee,robarian1,l3rpve,Watching a coffee documentary with my son. He likes to help me make coffee in the morning.,,1611459774
Coffee,tm1287,l3ra2c,Rate my setup - Dorm room edition,,1611458153
Coffee,Chrismeyers2k1,l3r4ke,Why do Americans drink coffee black?,"Is it some kind of self torture? :-D Just strange to me, I mean yeah it occurs to us that it can be done but really why do it? I personally think it's the way you make coffee there. You make it black and watery and then if you add milk, you just pour it in or at the most fancy you foam it in afterwards. Both of these are just wrong. In our culture, you start by boiling milk, you make a really f'in strong coffee concentrate, and then add that to the boiling milk. Then you aerate and mix it by using 2 containers and swapping it back and forth between them. And ir actually tastes good this way and strong, amazing that. But even the poorest people drink better coffee than the best in America I have noticed.",1611457606
Coffee,dankNamtab,l3qh1u,How to nail the water temperature using a normal kettle or no kettle?,Is there any way I can get the water temperature right without a kettle that indicates the temperature of the water or without a kettle altogether?,1611455254
Coffee,the_normal_deviant,l3qe8g,Coffee Alternative Products,"Yes, it may seem sacrilegious, but I'm wondering who has tried ""coffee alternatives"" and whether they've found a way to enjoy them and what techniques work best. I was recently gifted a malt-based coffee alternative, but have never used such a product. Has anyone tried these out? Is there a best practice for brewing?",1611454971
Coffee,No-Cancel6798u,l3q51h,A coffee adventure in Flint," I decided to visit the local grocery store north of downtown looking to buy a bag of coffee. I parked my car in the open lot where a homeless man immediately blocked off my car and came over to beg for money. Initially, I wasn’t afraid so I ignored him until he started tapping on my window. Going through every worst case scenario in my head I decided against trying to pull out of the lot in case he was armed for whatever reason. I calmly rolled down my window slightly and gave him all the money I had which was roughly $2 in change. At this point, the man walked to the passenger side door and began yanking the handle muttering something about how I needed to take him to the atm and give him a lot of money. Still being afraid he was armed I said that I had to get coffee from the store and couldn’t take him to the atm. To this he said that he would escort me to the store. Inside the store he began screaming “my nephew needs coffee...y’all got coffee??” Repeatedly until the owner showed up. Since he was not wearing a mask, he was promptly kicked out. he turned to me and said he would wait for me outside. I asked the store owner if she minded that I camp out inside until the man left. She was fine with that idea but recommended that she could escort me out and tell the man to leave the property. I agreed and got to my car but the man still followed so the store owner told him to leave. To this the man looked at me and laughed saying, “you should’ve told me, y’all are white suprematists” and then went on his way screaming that we were a bunch of racists. This was definitely the most interesting shopping experience I’ve ever had.

Moral of the story, fresh roasted coffee isn’t cheap",1611454054
Coffee,wwm824,l3pidk,Best way to brew dark roast?,"I unknowingly bought a medium-dark roast Peruvian coffee bean and made a pour over, 1:17 ratio, at 205F and produced a 2:45 brew time, with it still being bitter.  Then I realized it was a dark roast.  Any tips on the best way to brew a dark roast coffee/best technique?",1611451845
Coffee,Echo1xx,l3owge,Are the effects of Caffeine stronger when taken black? (not asking about taste),"Does adding extra water, such as in an americano, or adding milk, in say a latte make the caffeine less effective?  


I've tried a single shot espresso with nothing added in two times now when drowsy at work and both times I felt not just less tired, but slightly more jubilant. It felt like a stronger effect in contrast to the times i've tried americano's, matcha tea latte's, and regular latte's.  


Could there be any science to this? I know most caffeine will already have had water run through it at some point to create it inside a coffee pot or espresso machine. But could continuing to add in more water, milk, creamer, flavor etcc, dilute the effects even more?",1611449737
Coffee,polar775,l3oq3j,Bodum Bistro Burr grinder,"Hey r/Coffee

I picked up one of these recently to up my coffee game a bit [https://www.bodum.com/ca/en/10903-01us-3-bistro](https://www.bodum.com/ca/en/10903-01us-3-bistro)

I just unboxed it and noticed there is a lot of play in the hopper and upper burr. the hopper rattles and shakes. I grind on the more course settings for a french press but the grind sizes are all over the place. Now I know this is an entry level grinder, I didnt expect the best build quality and so, but based on other reviews i've seen, no one mentions these problems. 

See pictures and a video below for what I mean. I know there are a couple people here with this grinder. Is something wrong with my unit? I plan to contact bodum directly (i bought it direct from them) but I hear their customer service is pretty awful, so before I go down that road of frustration I just want to know if I actually have a case here. 

Thanks!

[https://photos.app.goo.gl/A3b7jFSNTwxMsApN7](https://photos.app.goo.gl/A3b7jFSNTwxMsApN7)",1611449129
Coffee,melonboi7,l3oczz,Espresso macchiato milk foam,What containers should you use to make espresso macchiato milk foam? And what are some methods to make it all foam?,1611447900
Coffee,UsernameTaken101102,l3nx9o,"[ASK] Can you use coffee grounds in pods? I don't drink coffee myself and bought some coffee grounds for a friend as a present, but their machine only uses pods - will he still be able to use it?",,1611446491
Coffee,xtrasimplicity,l3nm29,Finally tried “fruity” coffee - and I love it!,"TL;DR: Recently tried single-origin, fruity beans from Nicaragua as my normal beans weren’t in stock. I love the flavour, and am keen to try other amazing options out there. Any suggestions? I’m located in Australia.

Hi all,

I bought a Delonghi super automatic coffee machine at the start of covid to get my daily coffee fix whilst working from home, and have been purchasing Jamaica Blue’s (a cafe franchise here in Australia) “signature-blend” beans ever since.

I liked the flavour of these beans, but they were out of stock when I went to buy more beans yesterday, so I ended up picking up a pack of their seasonal, limited edition single origin (titled El peñón) beans from Nicaragua, which have pineapple, cocoa and blueberry undertones.

I’ve had a few cups of this new coffee and now realise I really like these “fruity” coffees, and would love to try some different options in the coming weeks, once I finish this bag.

Do you have any recommendations of fruity (whether aromatic, or taste, or both), or other amazing coffees that I should try? I feel like I’ve been missing out on a lot of great coffees out there by repeatedly purchasing the same Jamaica Blue beans.

As I’m located in Australia, it’d be great to either pick them up in store or buy online from somewhere that delivers to Australia and doesn’t cost an arm and a leg.

Thanks heaps!",1611445504
Coffee,gocayuts7,l3n8ho,Is having a variable temperature electric kettle essential?,I’m looking to get into different ways of brewing coffee. I plan on buying an Aeropress first. Will having a kettle where you can set the temperature help make better coffee? Or will a more standard kettle be fine (just boils the water)? There just seems to be quite a price difference.,1611444280
Coffee,WALPUNK2910,l3mhym,Coffee Ice Cubes. Anybody else gave an issue with the cubes sticking to the tray?,"I recently tried that oft-suggested solution to watered down iced coffee: coffee ice cubes. As they melt, more coffee!
However... mine always stick. And digging them loose leaves my fingers a coffee-stained mess. Is my coffee just too oily? Is there anything I can do to avoid this nightmare? I've heard people suggest running cold water on the bottom of the tray to loosen stuck cubes.",1611442056
Coffee,ewgilmore,l3mf5l,Yemenia Came in Today!,,1611441833
Coffee,MoleicesterCity,l3mbtx,Hario Switch vs Clever Dripper - which one?,"Since Hoffman's video on the benefit of immersion brewing I've been thinking of getting and immersion dripper. Can anyone advise between the Clever and Hario options? 
Both got good reviews from JH so am split between the 2.",1611441615
Coffee,Browneyedgal_,l3lwua,Coffee lovers,"Hi! Does anyone have any coffee recommendations? I’m new to coffee and I would like to try any coffee recommendations of light, medium, or dark roast from a local supermarket or coffee shop in LA area",1611440017
Coffee,makestocksgreatagain,l3lohz,Filtering Pourover Coffee Twice,"Hi All,

Was recently at a local coffee shop and found their pourover method interesting. Basically, they filter their pourover coffee twice through the dripper. Letting it filter once and then again, pouring the coffee through the filter a second time. 

My theory on this is the method is for the masses and more error-proof. Obviously, it takes time and technique to properly pour filter coffee and not over/under extract the coffee. And by filtering twice, essentially that “error-proofs” the coffee flavors. The overly bitterness or acidity gets filtered out the second time. The trade off here is that the coffee does not have any prominent flavors thus resulting in a more light tasting coffee. Which I feel like is for the masses and generally people prefer lighter coffee. It also seems less time consuming as the barista doesn’t have to wait and pour. 

Thoughts? Is there some kind of science behind this?",1611439331
Coffee,gingernuts13,l3linl,Coke Blak Recipe below,"So I got a Flair espresso maker and have been having fun with it. Something I remember from years ago I nearly forgot about is Coke Blak: Coke with coffee in it. 

The recipe I see being repeated as the copycat recipe is below, but needless to say I am so glad I've found another use for the espresso I can make now and the drink is also really good. I bought 2 liter bottles and halved the recipe from below by weighing out everything so it fits in a regular pint glass 

12oz Coke 
12oz cream soda 
2tbsp espresso 
1 packet NutraSweet (I used stevia)",1611438852
Coffee,bfkill,l3krch,sage/breville barista express grinder question: can I use it for french press too?,"I'd like to use the machine's grinder also for french press, but with both the internal and external setting of the grinder on the coarsest I think it might be still to fine..

my previous grinder is a blade one, and I was hoping to start using it as a spice grinder and grind my coffee on the conical burr grinder of the barista express instead.

ideally I would like to find an internal setting that would allow me to use the finer numbers of the external setting for espresso and the coarsest numbers for french press.

is this at all possible? anyone else doing something similar?",1611436592
Coffee,mriv1,l3keqv,Instagram followers,"Please consider following my Instagram @bamboozledbarista. Not trying to spam, just seeing if anyone would be interested. It’s a page about coffee and I post daily 😊",1611435597
Coffee,jordan_03011,l3k85g,Bean grinder recommendations?,"Hi guys! I’m a relatively new coffee person here. I’ve been a long-time customer of dunkin and Starbucks, but I want to branch out now and start making my own coffee. I’m looking for a bean grinder so that I can really do it myself, but I’m not quite sure what kind to get. Ideally, it would be under (or near) $20 and on Amazon. Thanks!",1611435056
