subreddit,author,id,title,selftext,created_utc
tea,hannah_kk,ly3byp,"This is a kind of oolong tea called ""Rou Gui""",,1614916310
tea,LuckiestPierre69,ly2q03,What’s the best way to clean the small slots in the diffuser?,,1614914227
tea,Icy_Seaworthiness176,lxz2rk,Some rose milk tea at a local tea place,,1614902452
tea,MemeMaven,lxyj07,How do you brew boricha?,"I've been winging it so far but I feel that I've also been wasting some of it.
I think you are supposed to brew it in boiling water on a stove, but I have been steeping it in 100°C water in a bankoyaki kyūsu.

What parameters do you use in regards to:

* Grams of boricha
* Mililiters of water
* Brewing duration
* Water temperature (celcius)

Thanks! 🐙",1614900765
tea,kevcorms,lxyhy8,My first order finally arrived !,,1614900676
tea,[deleted],lxy3we,The misty rain which making a hot pot of tea. . . . #cha #chadao #heartsutra #fan #animalface #teaaddict #photography #gongfutea #enjoymoment #lifequotes #instadaily #happytime #chinesestyle #teaculture #lovetea #blogger #classic,[deleted],1614899518
tea,Usualus,lxy3ob,Have any of you nerds roasted your rolled oolongs at home before?,"I see one blog post on the google about this, but wanted to check with your deep collective bundle of experience and expertise regarding roasting your oolongs - specifically jade rolled oolongs - in the comfort of your own home.  I'd even wager I'm willing to go further and fire or charcoal roast them.  What say ye?",1614899499
tea,AAAAGentleman,lxx92a,What are the best teas for hard water?,"Living in the Eastern region of England, the water that we get is extremely hard and prone to build up with limescale - what are the best teas for such hard water?",1614897046
tea,[deleted],lxubrx,"Weird shape when I burned my hand by putting ""debatably""too much tea(black) to my cup.",[deleted],1614889585
tea,superzebra109,lxtfzo,H&amp;S Irish Breakfast Tea help?,"Hi, I'm kinda new to this group and to tea. I've been lurking here for a bit and decided to order some Harney &amp; Sons Tea. It came today and I'm trying the Irish Breakfast Tea (loose leaf)... I don't know if I'm making it wrong or if I just don't really care for it. Up til now I've mostly only had Bigelow Green Teas and Chamomile Tea. 

The Irish Breakfast Tea can says 1 tsp per 8oz. My mug is around 15oz so I did 2 tsp. I'm used to strong black coffee so I tried it first with nothing added and wasn't sure if I liked it. It says it goes well with milk and sugar. I can't have dairy so I used some coconut milk creamer. Still wasn't too good so I added coconut sugar (cuz I try to limit sugar) and that was a mistake. So then I googled Irish Breakfast Tea. Read about traditionally the milk was put in the cup first (about 1/3 of the cup) and that it's better that way. Made another cup with the coconut milk creamer in the cup first. No sugar this time. And I still don't care for it.

Any suggestions, or should I just say I don't like this tea? I'm willing to keep trying it in different ways, just not sure what else to try.",1614887342
tea,pin_920,lxt3wc,Chaga Tea Suggestions,Does anyone know of a good Chaga powder or product for mornings? Looking to replace coffee/black tea.,1614886472
tea,redspextr,lxt1uk,A nice little tea lunch!,,1614886319
tea,leadchipmunk,lxt0o1,"Today's tea, W2T's Prosbloom mini. First and second rinse down.",,1614886234
tea,kontorasuto,lxsva7,Coffee person wanting to get into tea!,"Hi! I'm an avid specialty coffee drinker. My girlfriend sometimes enjoys tea during the day but I've never found it to my taste.

However I'm really looking to expand my horizons and would like to get into making proper tea. I'm in a very zen mind set and making my morning coffee is like meditation, I was hoping discovering the tea side of this feeling.
Any youtube channels, posts I should look into?",1614885846
tea,EnosGraves,lxsnba,Fair Trade loose leaf for personal blend,"I am considering taking the dive and blending my own tea. Can anyone recommend a place to purchase fair trade loose leaf tea?

Specifically I am looking for Keemun (black) and Gundpowder (green) to come to USA.

Thank you.

EDIT: This is for my personal use. I am looking for a pound or less.",1614885289
tea,MachoXYZ,lxqydr,Tea time 🙏 (Sencha Orange from White Lotus Tea Shop),,1614880963
tea,the_hunger_gainz,lxptf7,Wuyi Rock Tea,I lived in Yunnan Beijing and Fujian for 20 plus years ... I am back in Canada and trying to find a good source for Wuyi Shan tea. Most of the ones I bought from in China do not or are not allowed to ship to Canada. I have tried several and they are all low grade or average.  Any help would be great. Friends have been sending small amounts from China no problem but this gets expensive.,1614878295
tea,nforte4,lxol32,Bi Luo Chun,,1614875263
tea,Adventurous_Matter_3,lxohyi,Having a hybrid gongfu/western style tea party today. Which oolong do you suggest to serve to someone who has never tried it before? Thanks for any suggestions!,,1614875070
tea,throawayboi,lxoesy,Is there such thing as a coffee tea with high amounts of caffeine but all the benefits of tea?,,1614874880
tea,amh_library,lxnmw3,Saratoga Tea &amp; Honey: Virtual Intro To Tea Classes!,,1614873179
tea,Curiousfellawithepee,lxni5f,Don’t regret anythibg.,,1614872878
tea,Abkenn,lxn90n,Fujian Zhangping Oolong Cake,"*I've never had a tea cake before. The Pu'erh I've tried has always been already broken as a sample. So I don't have a knife/pick for cakes (my pu'erh/knife order has been returned to China and now they will send it again... it could take months).*

*So I've never broken a cake before. I didn't know how to do it. Saw a video and the guy splits the cake in half but into 2 chips. I tried to replicate it and with oolong is probably way easier as it's not hard to break apart.*

[Looks like a tea bag! A special and huge tea bag!](https://preview.redd.it/3vxxhygv21l61.jpg?width=4032&amp;format=pjpg&amp;auto=webp&amp;s=fb3b624a9b8475a3b34908f1f6ca98998e9a000c)

[What a cutie! It is 9.5g. The smell from the dry leaves is a surprise! It's so strong?! I'm sad to break this apart ;\(](https://preview.redd.it/x07159wl31l61.jpg?width=3337&amp;format=pjpg&amp;auto=webp&amp;s=556880320b2e549a21184ee8abc6f030810fe114)

[The left one looks bigger but for some reason it's smaller with 0.2g! I threw away less than 0.2g of dust\/small leaf particles](https://preview.redd.it/tksg8wim31l61.jpg?width=4032&amp;format=pjpg&amp;auto=webp&amp;s=239d5396e0949efb9e18a3d51374c271ec1436b9)

[The end result! Infusion number 3! ](https://preview.redd.it/l3lbqqkn31l61.jpg?width=3307&amp;format=pjpg&amp;auto=webp&amp;s=7b47a0abc70ee0dd43423276da8753b92a8ae5e9)

The experience was awesome! The tea is... very good but I've had way better oolongs. But I'm buying this again for sure! The good thing is that the tea is very flavourful - it's not a fragrant water like the Taiwanese oolongs I praise so much. The dry leaves had an amazing fragrance. The wet leaves were even more fragrant (duh), but... I brewed this for 30s - 30s - 40s and I can't smell almost anything in the liqueur. Ok a little exaggerated, I can, but it's a little underwhelming after smeling the leaves. It's very floral and it reminds me of Ya Shi Dancong but without the dry mouthfeel. I'm oversteeping it a little - did 90 seconds for the 6th steep and I love it. I'm a fan of very watery and weak oolongs, so I can say that this oolong is very smooth even oversteeped! There is some good punch that I can't call bitter or astringent (probably some super low level of bitterness/astringency/acidity combined into an amazing mouthfeel). I recommend this for sure!

&amp;#x200B;

...

The tea is: [https://what-cha.com/products/china-fujian-zhangping-premium-oolong-tea-cake?variant=37606911377576](https://what-cha.com/products/china-fujian-zhangping-premium-oolong-tea-cake?variant=37606911377576)

Cultivar: Shui Xian",1614872232
tea,Grumpylumberjack,lxmx5v,"Tiktok has its faults, but this seems like the right way to enjoy tea.",,1614871369
tea,Tall_Butterscotch_33,lxmqrf,Earl grey latte I made I wanted coffee but restrained myself I'm happy I did.,,1614870908
tea,unauth401orized,lxm0nd,Looking for a tea,"When I was a child, my granny was travelling to China a lot. She was bringing tea from China.I'm looking for it. It was some herbal tea.It had a visual like a little green seed. All i had to do was to throw this little seed in boiled water and it was somehow ""opened"". Idk how to say in english,it's bulbs were opened,very longs one. Does anyone know,what it was?",1614868975
tea,AlternativeFeeling77,lxlyri,T2 Tea Bags - Do They Always Rip Through?,"First post here on this subreddit.

I live in the US and some years ago  received a T2 loose leaf tea sampler from Australian relatives and loved the teas.

Fast forward to now - we have a T2 tea shop in our area and I purchased a 50 pk bag of Melbourne Breakfast in tea bags. It was 50 percent off due to what I thought was an expiry date issue, but when I use these tea bags, they always rip open when the tag is being separated from the paper teabag, no matter how careful I am. I look at the tea bags and they are actually so thin, I think there are holes elsewhere in the bag, notwithstanding.

This is okay for personal use, as I put it in a strainer (and I add some extra Madagascar Vanilla loose leaf T2 as well!), but wondering if anyone know if the poor quality tea bag is a consistent issue with this brand? If it is, I wouldn't want to give boxed tea in bags as a gift, for example, or even pay full price for it for my own use.",1614868824
tea,Elvthee,lxlmp6,Cold brew jasmine pearl tea is so refreshing! I'm gonna try kukicha next I think,,1614867852
tea,AutoModerator,lxix3m,"What's in your cup? Daily discussion, questions and stories - March 04, 2021","What are you drinking today?  What questions have been on your mind?  Any stories to share?  And don't worry, no one will make fun of you for what you drink or the questions you ask. 

You can also talk about anything else on your mind, from your specific routine while making tea, or how you've been on an oolong kick lately. Feel free to link to pictures in here, as well.  You can even talk about non-tea related topics; maybe you want advice on a guy/gal, or just to talk about life in general.",1614859213
tea,Bamboo_Box,lxirq7,Do you think tea should tell you if the content of lead is within your countries safe range?,"Should tea companies tell you if they are within the range of your countries safe level? Or should they just fall into the level of safety that the manufacturer is located in?

[View Poll](https://www.reddit.com/poll/lxirq7)",1614858618
tea,ForFrodo1,lxhx89,No idea where the begin as a rank amateur,I’ve swapped to teas lately as they feel way better then coffee for all the reasons I’m sure you know. Now I used to grind beans and make decent coffee and I’d like to go the same route and step up my tea game but I have no idea where to begin. I’ve mainly been drinking Ceylon loose leaf but apart from that it’s all shit in tea bags like Assam and Lipton’s. I’d like some recommendations of online stores in Australia and what to try out as a beginner. Mainly pretty strong and caffeinated teas as I find most bags pretty weak tasting. Cheers.,1614855281
tea,vefat,lxh41c,my gongfu setup,,1614851661
tea,ProbablyNotPoisonous,lxgitk,Yet another oolong question from a beginner,"I have a small assortment of oolong teas from Song Tea and Dachi Tea. I have been brewing gongfu style and have been underwhelmed, so I decided recently to go through them again brewing according to the package directions (shocking, I know), which mostly means lower leaf-to-water ratios and longer steep times than with gongfu. I'm not drinking them in any particular order, just deciding based on my mood.

For water, I'm using bottled ""National Artesian Water"" brand bottled water. Claims to have a 7.8 pH, for whatever that's worth. Tastes a hell of a lot better than filtered tap water, anyway.

Brewing vessel is a small double-walled glass mug with a lid.

The first tea I tried this with was [Dachi Verdant Valley](https://dachitea.co/product/verdant-valley/), which is a Taiwanese high mountain oolong. Package instructions: 5g tea, 150 ml water, 194 F (rounded to 190 on my kettle), 1-2 minutes. I was blown away by the result!

* Smells *exactly* like blooming lilacs, especially on the first couple of steeps

* Mild bitterness and intense sugary-sweet aftertaste on the first steep

* Subsequent steeps: bitterness disappears; tea now has a fresh, green taste with, indeed, cantaloupe-like aromatics. Finish is less intense, but still quite sweet and pleasant.

* Not the creamiest texture; but still noticably more so than plain water.

* Petered out after 5 or 6 infusions; I wasn't actually counting.

Tonight I tried [2018 Meizhan Yancha](https://songtea.com/products/meizhan-yancha) from Song Tea. Package instructions: 5g tea, 150 ml water, 205 F, 1 min 30 seconds. My kettle has settings for 200 and ""boil,"" but nothing between. I started at 200, but then increased to ""boil, but pour into another cup for a few moments,"" and then just straight boiling water, because - I got very little flavor from this tea other than faint minerals. Increasing the temperature yielded a very faint fruity aroma, but nothing I would call ""dark"" or ""intense."" Also not much ""thickness"" to the mouthfeel, which seems weird because Song Tea specifically calls that out in their description.

So what gives?

Theories:

* Maybe the yancha is just old? I've read it doesn't keep well (but then, I've also read it does). I store my tea in its original, opaque, airtight packaging; but it gets hot here in summer, so heat might be an issue.

* Maybe the water isn't hot enough, despite what my kettle claims?

* Maybe the tea is relatively lower-quality to begin with, and Song Tea is overselling it in the description? Certainly it's not very expensive for a yancha.

* Maybe I'm just inexperienced and expecting too much/comparing it unfairly to the (imho) very sweet and beginner-friendly Dachi high mountain oolong? I don't know *much,* but I know oolong is a massive category and high mountain oolongs are very different from rock oolongs.

Any thoughts? (Big thank you to the wonderful posters here who put up with this kind of thing :D )",1614848954
tea,spiced_shrub,lxeutv,Questions about hot milk with tea.,"Do people heat up the milk before they add it to the tea? I'm not talking about a chai latte where the tea is brewed with the milk, but an English-style tea where the milk is separate but then later mixed in. I see people poured it cold from the carton, but is warm/hot milk not a popular option or something?",1614841290
tea,hellaruminative,lxckig,Homemade Chai blend?,"I've been wanting to make my own chai blend but am coming up on an issue. I definitely want to try the stove top, traditional method but I'd also like to have a loose leaf blend I could throw into a strainer in the morning if I don't have the time or energy to make it the traditional way. But I haven't found a recipe that has a good starting place for this, just stove top and concentrates.
Any recommendation for ratios and tips on what to grind and what to leave whole?",1614832020
tea,pin_920,lxccy3,Chaga tea?,[removed],1614831235
tea,ns930,lxabo7,Twinings bagged vs loose,"Hi all. I'm considering getting some loose Twinings tea, but I wanted to try the bagged first before I buy loose. Is the flavor the same? 

I decided to ask here because the only other time I considered doing this with a company, Bigelow, there were reviews stating that the flavor in the loose wasn't the same as the bagged, which was disappointing.",1614824325
tea,MooseGooseMeeseGeese,lx9yyd,Looking for black teas for somebody new to drinking tea!(need to reduce iron in meals),I’m looking to find either a black tea or another type of tea to start with. I have thalassemia and I just learned drinking tea can help reduce iron during meals.,1614823160
tea,iris-my-case,lx9wqa,Tea vs Coffee,,1614822938
tea,somerandomteaguy,lx9wli,Honey fragrant danchong I’ve been saving up. First two brews are mine you can have the next one,,1614822925
tea,UsernamesAreHardOk,lx8h7v,Infuser from Harney and Sons Tea Chest,,1614817801
tea,tyarah184,lx7stx,Does Yunnan Sourcing stock Gunpowder/Zhu Cha?,"Hello r/tea! I began my venture into loose leaf with Adagio's sampler packs and in particular loved the Chinese green tea that was offered, particularly the smoky Gunpowder. Seeing the praise for shops like Yunnan Sourcing and how recommended they were as quality suppliers for non-blend tea, I wanted to repurchase from them this time. However, even when searching with the Chinese name, I can't seem to find any gunpowder green tea on both the .com and .us websites. 

Am I searching incorrectly, or is gunpowder so uncommon that it isn't sold online much (but somehow is on an American-based tea warehouse like Adagio)? And if it isn't offered on Yunnan Sourcing after all, what are your recommended alternatives for a Chinese green tea with smoky/earthy flavors? (I also really enjoyed [Sleeping Dragon](https://www.adagio.com/green/sleeping_dragon.html) from the sampler pack, for context.)

I appreciate it!",1614815702
tea,TheColorOfDeadMen,lx7hrb,What a hairy morning,,1614814742
tea,RubysBoy,lx767r,Tea Time,,1614813755
tea,Selderij,lx71fg,I thrifted most of the things on this tea table. What secondhand things do you incorporate in your tea setup?,,1614813354
tea,MoriMaTea,lx6rhv,"If the Buddha is not in the temple, where is the Buddha?",,1614812548
tea,benjeye,lx5cp9,"My fiancee, who's new to reddit, told me to post a picture of our tea chest",,1614808412
tea,malibe2266,lx52r1,T2 samples came on (nice and overpriced),,1614807590
tea,GoosePants72,lx4qvz,Has anyone ever ordered tea from amazon.ca? (Canada),"I’m looking to get some Chinese longjing tea, not sure where to get it though (in Canada) there is a company on amazon.ca called “Tealyra”. Anyone ever order from them before?",1614806658
tea,Dizzy_Corner5356,lx4qlr,How to make perfect cup of tea,,1614806635
tea,ThrainnTheRed,lx4400,Well that's one drunken purchase I don't regret.,,1614804929
tea,Vader3014,lx2wtc,This mint lavender tea is so good!,,1614801626
tea,HumongousParticle13,lx2obw,My husband’s tea cupboard is bursting (along with some Nespresso capsules along for the ride) at the seams. He told me he’s low on Williamson’s Earl Grey and needs more- are you kidding me?,,1614800985
tea,shameless_idealist,lx2h28,looking for a good manual grinder to grind tea leaves into a fine power,i am looking into grinding up my tea leaves instead of just composting them after i use them. want to grind them into a powder like matcha,1614800434
tea,blahs44,lx27ol,How do I find a loose leaf tea I like?,"I've been drinking (bagged) tea for a long time and I love it, I normally drink stuff like Earl Grey, English Breakfast, Irish Breakfast, Lady Grey etc. Nothing special.

Recently I thought I would get into good quality loose leaf tea so I ordered a bunch of samples (around 10) to see. I drank a cup of all of them and disliked them all, actually more than that, hated them all. The smell and taste was terrible. I brewed them according to the instructions provided (temperature, time). And ordered them from one of the top sites on the recommended sites on this sub.

Any recommendations? Kind of lost here.",1614799769
tea,Quinn-The-Great,lx16zp,Does anyone remember teavana? I used to go there all the time and I even bought golden dragon tea. Now let me tell you. IT WAS AMAZING!!!!,,1614797146
tea,jooblin,lx12ul,Goodwill find -- is this safe to drink from??,,1614796857
tea,prejay,lx0o3k,Really good quality of flavoured and non flavour teas by Twining in a wooden box,,1614795788
tea,josqvin,lx087f,Chinese Black Tea Question: Souchong vs Congou,"Souchong (xiao zhong, meaning ""small type"") refers specifically to a small leaf varietal tea plant found in the Wuyi area and its surroundings. The first black teas were made from this plant in that area and are often found with the moniker ""lapsang"" (zhen shan, meaning ""true mountain"") to specify the Wuyi origin. (Note that a genuine lapsang souchong will not always be smoked.) The most famous souchong tea now is probably Jin Jun Mei. 

Congou (gong fu, meaning ""with skill"") refers to black teas also made in the same area, e.g. Bai lin gongfu or tan yang gong fu, which are both Fujian origin teas (collectively known as ""minhong gongfu""). However teas from other provinces frequently have the ""gongfu"" or congou name attached, i.e. Keemun gongfu (from Anhui) and Ninghong gongfu (from Jianxi, which borders on Wuyi). These two other can be explained as an extension of the Fujian gongfu black tea tradition, I would think. However, I have also seen teas from yunnan adopt the moniker--Dianhong gongfu. 

It would seem that congou or gongfu style black tea making represents some kind of refinement or advancement of the original souchong black tea production style. This would also explain the name. However, I would be grateful if someone could provide additional information as to the origins and relationship between these two types of black tea. I would specifically like to know if there are any general differences in production method.",1614794692
tea,curious_josh_,lwywds,Green tea Patina on my tea ball! (Bonus cat),,1614791336
tea,Handyandy58,lwyhfe,10 Myths About Yixing Teapots,,1614790340
tea,reroutin,lwyca7,Tenju - translate to “tea from heaven”,,1614789972
tea,fortunate_mangoo,lwyalq,Finally my order arrived,,1614789852
tea,Icy_Seaworthiness176,lwxhtk,When I pour too much water I get a vacuum effect but do people do this intentionally?,,1614787845
tea,edencheetos,lwwuhm,Floral Earl Grey blend,,1614786228
tea,Teejay_1,lwwskz,Does anyone else wash their tea? I always wash mine with cold water before I brew.,,1614786098
tea,CouldBeBetterForever,lwwbwv,Brewing tea (and beer) today - Golden Yunnan from Arbor Teas,,1614784883
tea,Roncibaldo,lwt49c,It's tea time another time!,,1614775789
tea,AutoModerator,lws8oo,"What's in your cup? Daily discussion, questions and stories - March 03, 2021","What are you drinking today?  What questions have been on your mind?  Any stories to share?  And don't worry, no one will make fun of you for what you drink or the questions you ask. 

You can also talk about anything else on your mind, from your specific routine while making tea, or how you've been on an oolong kick lately. Feel free to link to pictures in here, as well.  You can even talk about non-tea related topics; maybe you want advice on a guy/gal, or just to talk about life in general.",1614772820
tea,lepralego,lwpi44,"Hi my fellow tea fans, I would like to share with you something different. This is Hill Garden Tea Room, a tea room made out of Lego! This is a Lego Ideas project and it needs 10,000 supports to have the option to become an official Lego set. Link in comments to support, it's free! Thank you.",,1614762329
tea,krizo96,lwns4c,Green tea quality assessment,"I have a variety of Sencha green teas at various price points, some are Japanese and some Chinese.
I was wondering if anyone well versed in green teas would be so kind as to asses their quality for me so I know what to buy and look for in the future. I would send them 5g or 10g samples at my own cost of course and would expect a general review of 4 samples I would send in return.",1614755322
tea,user987632,lwkhkw,Looking to find a good sheng/raw,,1614743517
tea,HumongousParticle13,lwkdmd,Things I learned about tea vessels when I married my husband.,,1614743157
tea,Tao-Jones,lwjsh4,Hojicha recommendations?,"Hello all,

I recently rediscovered hojicha-I had completely forgotten how comforting and delicious it is. I had been drinking Yamamotoyama bags, due to their reasonably high quality, local availability, and low cost. However, they appear to have rebranded and more than doubled their prices, and no longer seem worth the money. I was wondering if anyone had a favorite, relatively inexpensive hojicha-either bagged or loose. I use bags at work extensively, but the only other option seems to be Ito-En (thoughts, btw?). Anyway, thanks in advance!",1614741199
tea,MoriMaTea,lwjjvr,"The brilliant and crystal light iced craftworks, elegant, cold.",,1614740444
tea,chaqintaza,lwip6h,Recommend a domestic sheng cake (or two) &lt;$80,"Hi,

Someone's getting me a tea gift. I'd like to get one or two nice raw cakes for $80 or less (less is also fine) available domestically.

I'm open to older cakes although I love young sheng. Something fairly bold (or very bold) with complex and challenging notes and strong cha qi would be perfect.

Been looking at [yunnansourcing.us](https://yunnansourcing.us), [liquidproust.com](https://liquidproust.com), and [crimsonlotusteas.com](https://crimsonlotusteas.com) (seattle inventory) but open to anything. Thanks!",1614737642
tea,JRR_Tolkitten,lwifws,Any teas that don't taste like tea?,"I know, probably controversial here. But I've found I don't love the earthiness flavor typical in most teas.

I need a good jolt of caffeine in the afternoon to get through the workday, and I love the convenience of making a cup of tea (easier than a single cup of coffee). I'm trying to avoid high sugar found in soda, so tea has been my go-to.

I discovered and LOVED Harney &amp; Sons Hot Cinnamon Spice tea. Tons of flavor, but not a tea flavor (probably masked by cinnamon and cloves). Any other teas like this that have a strong flavor that isn't heavily tea-flavored? I've got a sweet tooth, so teas that are naturally on the sweeter end or can stand up to a little sweetener would be great.",1614736826
tea,PorkCuepine,lwi72m,Do I need to get a new whisk if so what is a cheap 80 prong whisk?,,1614736027
