subreddit,author,id,title,selftext,created_utc
tea,PorkCuepine,lwhwa6,Do I need to get a new whisk?,,1614735046
tea,qwertyqyle,lwhq5c,"[PSA] US Tea Drinkers, Order Your Overseas Teas Soon! (non-US tea drinkers should also take note)","Happy March everyone! This is the last month US tea drinkers will be able to order their tea from overseas at the current delivery rates. Starting April 1st, the US will be the first country to have its own international postal group and the rates are going to increase significantly. For many sites, this means higher shipping fees, and for others, the price of their tea will be increased across the board.

This change came after the US decided to withdrawal itself from the Universal Postal Union for unfair advantages for countries like China that could send a package from across the world for cheaper than the national interstate postage rate.

The UPU and the USA came to an agreement for the US to remain under the condition that it could charge a flat rate to all countries wishing to ship into the US market.

Other countries have also expressed interest in incorporating this into their own countries. So you should keep an eye on the news from your own countries as well. 

Lastly, I think this will affect Chinese teas the most as they are going to see the biggest changes in cost. Companies there will have to decide if they want to raise their prices by a lot, or offer shipping at much higher rates than before. Unless the government subsidizes the changes. 

The increase for Japanese teas should only be about $4-5 per package. So if you are a Mr. Moneybags it might not be a big deal. But if your just buying a little 50g sample, your now gonna need an extra $11.50 for shipping instead of $8.",1614734477
tea,jessmcl14,lwhp1s,Consider joining r/teatrades! 🍵,"Hi all! If you're interested in trading, sharing, selling tea, or participating in Traveling Tea Boxes u/fooob, u/kevinharding, u/chaserino and myself have 
created a new subreddit: r/teatrades. We will be regularly monitoring the sub along with awarding flair. Our goal is to create a community of tea lovers who can trade and sell their tea and teaware! 

Please consider joining r/teatrades and feel free to DM any of the mods with any questions or subreddit feedback! Happy Steeping! 🍵",1614734376
tea,redspextr,lwfccw,2018 Golden bud Yunnan Sourcing shou puerh,,1614727096
tea,immortanjose,lwf5p6,Was given this as a gift.,,1614726550
tea,fluffypupz,lwejjc,When I drink bubble tea (black tea) I dont get jittery. But when I brew orange pekoe tea or any other black tea I get jittery. Why?,"I usually drink black tea bubble tea with no tapioca with 30% sugar and feel fine, a bit energized. When I brew red rose or tetley orange pekoe tea I drink much less but feel jittery. Why is this?",1614724798
tea,HumongousParticle13,lwe4jm,My European husband chooses from his selection of expensive teas to brew each morning as I know nothing; heck it takes me 10 minutes to select the cup and saucer everyday.,,1614723604
tea,LocksmithCurrent8866,lwchzd,tea business partner,[removed],1614719113
tea,judetr99,lwbsv2,Tea time,,1614717182
tea,The____Wizrd,lwbs6t,How well done do you like your tea?,,1614717128
tea,ghostinthetoast,lwbqz1,Drumroll please!,,1614717039
tea,patman004,lwa86t,My morning Matcha Tea,,1614712917
tea,malory1012,lw8ych,Lemon and Ginger Tea,,1614709655
tea,meikevandespijkers,lw8rcv,Does anyone know what kind of tea this is? Please let me know,,1614709172
tea,_k1tt3y,lw7jem,Has anyone tried Pennyroyal Tea?,"Nirvana and also some folk reading has gotten me curious. I’ve read a lot of women stating they use it to regulate their periods which is great! But also I heard that the oil is toxic. 

I bought a pound of dried pennyroyal (“cut and sifted”) meant to be used for tea. Was wondering if anyone has had any bad side effects like vomiting? I’ve tried all sorts of tea but the controversy is making me uncertain. I get mixed information about this plant in books, articles ect. Everything is different. Hmmm.",1614706097
tea,rologies,lw73ul,"A local tea shop couldn't keep their storefront during Covid so they started an online one, just got my first delivery",,1614705056
tea,mrmage8,lw665x,I’ve been into reading books about tea and this one was a curious one. The Classic of Tea by Lu Yu gives some insights of the preparation and production of tea in the 8th century. I think to most unfamiliar concept I found is to “pound” tea when making the drink. (1974 1st Ed. Pub. Ecco),,1614702856
tea,rologies,lw61gy,"I have a house now, anyone have success growing tea in central VA?","It's in Midlothian, VA, I know it's not a native plant here but it is possible to grow. I have a lot of indoor plants (apartment life) and do well with them but could use some tips on growing stuff outdoors, everything I'm finding online is regarding the camellia flowers.

Also, the spot I plan to grow it in... uh... was *frequently* used as a dog bathroom. Should I upheave all the soil or can I just give it a few months or so? Is there a better spot to ask this in?",1614702549
tea,nforte4,lw5wba,4 seasons of spring from Drink Tea Co. Kyusu pots are traditionally for Japanese green teas but I’ve seasoned this one for any tea more on the green side.,,1614702184
tea,BunkyBunk-,lu7cj0,Tea Taste,"So i boiled my water for the first time, i used heated water for my tea for the longest time and it tasted like flavored water. I hate to say it but when i boiled my water with the tea it still tastes like flavored hot water. I would like some tips to make my tea tastes the best as possible. I know that tea is just flavored hot water, but i'd like more to be honest. Any tips? I also want to get an electric kettle.",1614489378
tea,[deleted],lu7c73,Yaupon: The rebirth of America's forgotten tea,[deleted],1614489357
tea,andylyleryan,lu6uz8,I got a new tea infuser today and it looks siiiiiiiiiick! I'm so excited! 👌,,1614488342
