subreddit,author,id,title,selftext,created_utc
tea,healthylifestyel,kfes4o,The 8 Best TEAS for an Upset Stomach Natural Ways to Treat,,1608268314
tea,DeltaWolf_04,kfelre,Anybody here ever tried pine needle tea?,,1608267653
tea,Azuriahm,kfefut,"For you tea experts, what vendor has artisan/farm direct Japanese teas?","I was looking at yunomi.life (used to have a different url besides .life I think) but I am not sure about them, and wanted to hear about others before I spend a bunch of money on something that is not that great.",1608267034
tea,mgc213717,kfe8sl,Stainless steel electric kettle made in the US/Europe,"Never knew how hard it would be to find a good SS electric kettle not made in China. Anyone here have any recommendations?

For health reasons I would like to boil my water in high quality stainless steel with no plastic components that touch the heat. I’ve looked and looked and found nothing. Anyone here have a good rec?",1608266260
tea,curiousandstressed,kfbcx5,English to Chinese Tea Dictionary,Does anyone have resources for learning chinese words/phrases for/relating to tea for english speakers? found a list on teasenz but am hoping to find more.,1608255779
tea,Alaplayapapaya,kfakdb,Any Tea/Tisane recommendations for New Moms?,"Looking to find some good teas to gift to a new mom, or particular ingredients that I should be on the lookout for or should be avoiding in a tea/Tisane. Thank you for your help!",1608252956
tea,lainie_bo,kfa9ei,Where do you order your tea from? Brewing tips?,"Hi everyone! I’m a huge tea drinker. I like most types of teas (green, black, oolong, herbal, you name it), and I’ve been making my own tea a lot since I’ve had my own apartment. I was just wondering which websites/stores you all order your teas from because I would love to branch out. Also, I have a standard Breville electric tea kettle, but I don’t think I know how to brew my tea right so I can get the full flavor out of it. How do you all brew your tea? Any recommendations would be great!",1608251932
tea,Angeltea,kfa664,Someone wonder what the tea garden looks like in winter？ Are the tea trees withered? Here I just show how Zhejiang tea garden looks like.,,1608251622
tea,Macro_Nerd,kf9mnt,Are there any quality tea master or tea sommelier courses?,"To preface, I understand that years or experience are more invaluable, but I'm in a unique situation. I'm 18 and have been enjoying tea for the past few months. I've done my best to engross myself in the culture and with a wide variety of teas, and my family has been very supportive. I mentioned that there exists the International Tea Masters Association and they offer course training and that maybe one day I could give it a shot, and as a Christmas present my parents offered to pay the $1450 course fee to have me trained as a tea master or tea sommelier, as it's my last year before college and they have no clue what else to get me. I don't wanna just waste their money, so been looking into it and it looks like the courses vary greatly in quality. Can anyone offer any insight into courses that will actually teach me and help me become better at drinking and brewing tea? I know that spending years developing my palate and finding quality tea is infinitely more valuable, but I'd like to use this opportunity to the fullest to help me on my tea journey as much as possible.",1608249803
tea,MissCrick3ts,kf8vpl,Loose leaf green tea help!,"Still experimenting with my tea. I got a nice loose-leaf green tea but I have only made it once without it turning into a bitter mess. I tried letting the water cool before I steeped, in case I was burning the tea. I tried steeping for less time, in case that was the culpret.

 Idk what I am doing wrong. I read the sidebar and the non-judemental guide. Should I try steeping for even less time? I'm at a loss. Thanks!",1608247319
tea,-snachy-,kf7s2x,Sencha recommendation and where to buy,"I love sencha, but I'm not super knowledgeable (yet) about the different kinds.  I've recently been drinking [this one](https://www.uptontea.com/japanese-green-tea/japanese-loose-leaf-green-tea/p/V00201/#V00201) from Upton tea.  It's solid.  But I've had others in the past that I've enjoyed that are more vegetal or grassy.  I'd like to find some with more of those qualities.  Anything you'd recommend?  And also where to buy (i'm in the US)?

Thanks in advance!",1608243833
tea,MeowFrank,kf65bt,A liquorice-free alternative for a Pukka tea?,"Hey! I got the Pukka Tea Advents Calendar for my birthday at the end of November and have been looking forward to today's tea ""Manuka Honey, Vanilla and Charmomile"" all month.

However, I think it contains liquorice (not sure whether that's the name of the ingredient in English, ""Süßholz"" in German).

I'm sceptical about the tea now, as there was a sweetness I didn't like in previous Pukka teas that had liquorice. As I also greatly dislike liquorice as in: the candy, I suspect that's what I disliked about them. Can any of you recommend a tea with honey, vanilla and chamomile flavours and without liquorice?",1608238807
tea,beeduthekillernerd,kf619q,Brewing purple tea,"Hey guys, just got my sample of  

2015 dehong ye sheng cha -wild tree purple tea cake from yunnan sourcing . did 11g for 200ml of water at as close to 208f as i could get in a japanese green tea pot for 10-15-20sec steeps. it was pretty smoky in flavor but other than that i couldnt pick up much else. as i got into my 3-4th steep smokiness was still there but started to get more and more bitter in the back of the mouth, got to the point of being undrinkable. I did leave them to sit for a couple mins before drinking . not sure if i have too much leaf, too long brew time, too hot of water, or leaving them to sit for too long. but if anyone has some experience with ""purple tea"" and could give some suggestions it would be much appreciated!",1608238456
tea,mdavis085,kf5q2e,Does anyone know what kind of tea this is?,,1608237524
tea,diffitt,kf5b0l,The beauty of unfolding tea is mesmerizing! 2019 Sheng Dragon Ball puer,,1608236262
tea,myhawk89,kf4nq6,"Day 17. Wild apple &amp; cinnamon. Cinnamon, licorice and ginger root. Orange peel, chamomile, wild apple cardamom and clove.",,1608234349
tea,BumIsFit,kf4gk9,Looking for good tea websites!,"Hi everyone! I'm a tea drinker and i love to have an evening cup while reading a good book, but after joining this site I've wanted to buy some new teas to try out. Do you guys have any tips where I can buy good tea shipping to countries in europe? (I live in Sweden)

Thank you all for making me want to spend a little bit more money on better quality tea 😂",1608233765
tea,curiousandstressed,kf4366,Teasenz,Has anyone bought from teasenz? Do you like their tea? How is the price for value? Thanks!,1608232699
tea,Binary_011100,kf41ke,Does anyone know this Tea kettle or the designer?,,1608232569
tea,sjs_sjs,kf2kx3,Babelcarp: a Chinese Tea Lexicon,,1608228274
tea,draconiferous,kf21s0,"Tea party for me, myself and I",,1608226740
tea,sussko,kf1urn,Tea time in the second lockdown of Germany,,1608226152
tea,Vertex008,keyyac,Received this tea calendar from a dear friend. The different varieties are so delicious!,,1608217209
tea,nolcoy,keygip,Tea beginner,"Hello to all the nice people on r/tea. Relativly new to the tea scene and I had a few questions wondering if you all can help me. 
I have been making tea for a few months (really only brewing water and adding a tea bag) I am an alcoholic sober for almost 5 months and I have found tea is a nice way to avoid drinking. Recently I have wanted do do more than put water into a pot and use a pre made tea bag. I however have really no idea how to do that or what to use so I'm coming here for help (: any suggestions on tools needed i.e. specific tea bags, infusers or kettles you all like over others? Any information will be of value technique info tools anything that you guys think of i will appreciate thank you guys in advance I appreciate it.",1608215488
tea,ImmaAlwaysRocking,kexv40,Tea and tea cups UwU,,1608213324
tea,tajarhina,kexok9,"A quirk of nature: Mentha citrata, a mint variety that also smells like bergamot!",,1608212639
tea,kittylazermewmew,kexnaj,Starbucks disappoints again.,"My local Starbucks brews the WORST chai I’ve ever had. They serve it to you with tea bags still in, even in the drive thru, so by the time I get to somewhere where I can remove the bags it’s bitter and disgusting. Ugh. I just want a convenient place to get hot tea in the mornings.",1608212508
tea,BigHeadFullofTea,kexjs6,"Winter is coming, and the hojicha vibes are here",,1608212134
tea,C-ElizP,kexj7k,New To Tea...and I have a weird question,[removed],1608212070
tea,guindoz,kex7xl,Tea addiction (humour video),,1608210856
tea,chlibby_6267,kewyvf,Yorkshire,"I was looking at teas that are popular in England (as they are known for loving their tea) and came across Yorkshire brand. Is this a good tea? If so, which kind should I order?",1608209845
tea,AutoModerator,kew6na,"What's in your cup? Daily discussion, questions and stories - December 17, 2020","What are you drinking today?  What questions have been on your mind?  Any stories to share?  And don't worry, no one will make fun of you for what you drink or the questions you ask. 

You can also talk about anything else on your mind, from your specific routine while making tea, or how you've been on an oolong kick lately. Feel free to link to pictures in here, as well.  You can even talk about non-tea related topics; maybe you want advice on a guy/gal, or just to talk about life in general.",1608206442
tea,StevoTheMonkey,kew6gv,Boba_Irl,,1608206424
tea,Macro_Nerd,kevd22,Why does my green tea not taste as good as when I first started brewing it?,"Over the summer I started getting more into tea. I bought 100g of a South Indian White Havukal from TeaGschwendner, and it was absolutely divine. I had drunken mostly black coffee and some english breakfasts I had no clue how to make, and my first real cup of a more delicate tea was just great. Months later, this tea now tastes just more uniform and doesn't evoke the same emotions within me. I've stopped drinking coffee altogether and I've noticed I can taste much more in my other teas, but this one just feels flat now. Even if I prepare it in the exact same way (which isn't how I prefer it anymore) it just isn't the same. Could it be that maybe it's because I'm closer to the bottom of the bag and there are more stems and twigs? Or just that my palate has refined some and this isn't nearly as nuanced as I originally thought? It's still good, and when I eyeball the amount of leaves (usually adding a bit more than recommended) it has a lot more of a richer quality and is much smoother, I just can't get it as good as how it once was. Is this normal? I don't have a lot of teas so could it just be overconsumption of this one tea?",1608202483
tea,hesamzy,kevaqm,tea adiect,,1608202160
tea,cheesemagic,keunix,"Are there any folk tales, mythological stories or parables all about the origin of tea in various cultures?",I am curious to hear the mythology around tea. Are there any books out there for this kind of stuff?,1608199003
tea,gyoroon,keu99k,Best way of making milk tea and tea latte?,"I recently purchased a milk frother and I was wondering if  there are any tips on how to manage milk with black teas and matcha, I really love the taste of almond milk and I'm open to suggestions! I'm quite new to the world of tea brewing",1608197059
tea,jjomanhan,keu2n2,Teabag ART🍵Upcycling,,1608196099
tea,redspextr,ketuhe,Some milk oolong to get me through that long night,,1608194910
tea,steakoutwhoa,kes5my,Tea for a non tea drinker?,"hi, I'm looking for recommendations for beginner teas. I'm very picky about what I eat/drink and am put off from things quite easily, but I'd like to give this a try. However, I don't know where to begin. What do you think would be a good choice here? Please feel free to ask anything. Thanks.",1608186816
tea,babutas,kerbnj,Why Turkish people love tea so much?,"China is the biggest producer in the world but when it comes to drinking, Republic of Turkiye is the titan with no rival. Why do they love tea this much and why not any other drink? Fellow Turks, let us tea lovers know!

https://en.m.wikipedia.org/wiki/List_of_countries_by_tea_consumption_per_capita",1608183266
tea,secretagentcoco,ker3ry,Looking for a gift idea for my mom but I don’t know the first thing about tea,"Hey there! Lately my mom has gotten into making/drinking home brewed iced tea. She brews it in a big pot (throwing a couple tea bags in there) on the stove and later transfers it into a pitcher for the fridge. I considered getting her a stovetop tea kettle or teapot or maybe an electric kettle but I’m not sure what would be the best for her purposes, or if there’s something out there that would be better suited. I think she’s partial to tea bags vs loose leaf if that makes a difference. But she also might prefer the tea bags because she hasn’t tried loose leaf. Anyone have any suggestions? Any help is greatly appreciated!",1608182403
tea,myhawk89,keotcx,"Licorice and cinnamon. Organic coco, cinnamon, and licorice.",,1608174068
tea,shadow_wulf82,ken45s,For Teas Sake - La Vie En Rose,"I saw a similar post about this tea brand earlier, but Im looking for this specific flavor, because there's a lot of sentimental value of it to me since I bought it back in college. 

I ask if anyone knows where I can buy a tin of it, because I feel my family may have thrown it away in the process. And I need this one to help with my anxiety and stress.

Im frantically searching everywhere",1608168675
tea,foxyfit,ken3ic,Where to find a similar tea to Teavana's discontinued Jasmine Green Tea balls?,Just discovered this sub and hoping for someone to help me find a dupe for this tea. It was my most favorite tea before all the Teavana stores closed down. Is there anyone out there who remembers these delightful balls and how tasty they were? I would love some suggestions for a similar flavor.,1608168615
tea,nightstar312,kemx1s,What kind of tea is this? This is my favorite tea I have ever come across but I’m almost out and only have these leafs left. Any idea what it might be or some kinds that might be similar?,,1608168021
tea,SveNnerino,kemin1,Looking for help regarding a food and tea pairing.,"I'm wondering if some of you wonderful people can help me pair tea with food?

The dish in question is deboned chicken wings with a sweet and spicy apple coleslaw, I've experimented with a smoky Lapsang Souchong with Rosebuds and some Alishan Cream but I feel that it lacks something to go well with the acid of the coleslaw. Fairly new to combining Tea and food so any help would be greatly appreciated!",1608166711
tea,Jhume1976,kem4k4,Charles and Company,[removed],1608165387
tea,preposterousrhinocer,keljzc,Just casually waiting a month for my second cup to steep,,1608163530
tea,awesomedeluxe,kekjvr,Tall Tea Infuser?,"Hi /r/tea 

I have a weird conundrum.  I like to make a lot of tea at once in big, 2 liter glasses.  But after about two years of use, they've all started breaking.  

Having had enough shattered glass, I decided I'd ignore the claims of heat-resistance on amazon on just buy a bloody Erlenmeyer flask from Corning-PYREX.  So now I have this amazing, quality piece of glass.  It's about ten inches tall with a 2.5 inch mouth at the top.

But no tea infuser fits these weird dimensions.  A search for ""tall tea infuser"" doesn't give me much.  Does anyone know of a product that would work here?",1608160407
tea,velvetvan,kek463,Where’s your favorite Lapsang Souchong from?,"I’m brand new to tea - literally started drinking it this week - but I’ve already found that I LOVE lapsang souchong thanks to a Twinnings sampler pack. 

I bought a few more sample sized loose leaf blends from my local tea shop-  Chinese Gunpowder, Russian Caravan, etc. to try the smokiness, and I’m very excited about tying them all when they come in next week. 

However, I’m curious about where people usually buy this smoky blend from the most. I’m also wondering if anyone has any suggestions for tea similar to this! 

Thank you!",1608159155
tea,jiffypadres,kejyai,Need a High Quality Jasmine Silver Needle recommendation?,Buying a gift for my dad. He likes jasmine silver needle with huge jasmine scent. Looking for the highest quality since it’s a gift. Any recommendations?,1608158673
tea,Gia-Bia,kehy6q,Tea taste better in pretty antique cups! White tea with roses. Delicious combo 😋,,1608152701
tea,ccfinetea,kegtpu,Brewing Dong Ding Oolong with Tea Sweets Air-Shipped from Friends,,1608149383
tea,Illithilitch,kegflh,New tea! Gonna try gong fu,[removed],1608148253
tea,historically_nerdy_,keg5un,"Trying to take a little break before the kids wake up. It's not much, but on a cold winter day it'll have to do. Rose Red Black Tea.",,1608147474
tea,xijalu,kefz6y,"To you, what tea fits what mood?","For example, green tea is for when I'm doing something creative and want positive energy, while black tea is more when I'm focused and determined whether for work or otherwise.
I'm curious what everyone's personal feelings are",1608146926
tea,Tight-Adhesiveness-4,kefba3,Matcha tea this morning,,1608144960
tea,Lesbianshirtssss,kedskl,O poder do chá de sumiço Ebook por Emanuel Hallef,,1608140446
tea,IOughtToBeThrownAway,kedr4x,"My kid wanted to roast some hot dogs, thought I'd use the opportunity to brew some tea. The string burned away and lots of ash ended up in the drink. Still fun though!",,1608140329
tea,mentel42,kebk0z,Hilarious yet true,,1608133611
tea,IonTheBall2,keamc0,"I enjoy seeing the brewing transformation of loose leaf tea (Darjeeling, Harney &amp; Sons)",,1608130477
tea,PhotoslotTV,ke99ly,"The English tea grower Jonathon Jones from Tregothnan estate, Cornwall, ...",,1608125689
tea,scienceNotAuthority,ke93vr,(Herbal) tea in water wouldn't extract any oil/non polar compounds. Is this well known? Do people use oils to extract these?,"I did search both google and this subreddit and didn't find anything. Links also appreciated.

I have heard of people adding milk to tea, but milk is still primarily water and I believe it's added after steeping.

So I imagine that while the aromas are mostly extracted from hot water, I imagine some nonpolar substances are being left in a tea bag. 

Some questions-

&gt;Is this well known in the tea world?

&gt;Is this intended?

&gt;Are there any solutions, either a nonpolar solvent or invention to extract these?

Thank you",1608125043
tea,AutoModerator,ke7xru,"What's in your cup? Daily discussion, questions and stories - December 16, 2020","What are you drinking today?  What questions have been on your mind?  Any stories to share?  And don't worry, no one will make fun of you for what you drink or the questions you ask. 

You can also talk about anything else on your mind, from your specific routine while making tea, or how you've been on an oolong kick lately. Feel free to link to pictures in here, as well.  You can even talk about non-tea related topics; maybe you want advice on a guy/gal, or just to talk about life in general.",1608120033
tea,langeschlange,ke7dh5,Can’t wait to use these lavender bags for a London Fog!,,1608117221
tea,ColourpopSkating,ke4sy3,Thoughts on this tea?,,1608104007
tea,themightyigneal,ke2w8t,Iced butterfly pea tea,,1608095421
tea,myhawk89,ke2ddv,"Day 15. Revitalize. Cinnamon, cardamom and ginger.",,1608093316
tea,buntcuster88,ke1t7y,Looking for help finding quality loose leaf herbal teas or any quality loose leaf teas that are low/no caffeine,Been looking at white2tea but it’s hard to understand and they don’t have much herbals as far I can tell.,1608091110
tea,Rumplestilskin_9,kdzxwx,Help me out fellow tea-timers !! And also help me identify it. I don't have the packaging as it is not mine and the owner doesn't remember.,,1608084342
tea,cletusjones9281,kdzkif,Can anyone direct me toward a company with free or fairly cheap tea samples?,Any flavor will do I just like to try new things but I love hibiscus tea.,1608083029
tea,CaptainJules11,kdz8lq,Custom tea blend,"For Christmas this year I’m giving the tea lover in my life a customer tea blend. Theyre not big on caffeine &amp; they love lavender. I’m trying to make them a customer chamomile, lemon, &amp; lavender tea blend. I’m not too sure on the ratios. Any suggestions?",1608081855
tea,curiousandstressed,kdz4hk,Help with Dancongs,"I'm having a hard time with dancongs. It seems that when I brew them, I'm always hit with a horrible bitterness and then I have to spend half the time I'm drinking figuring out how to steep the tea in a better way. How do you like to steep dancongs? For reference I use a 150ml gaiwan and 5g of tea.",1608081458
tea,under-the-green,kdyn0o,Does tea normally smell 'savory'?,"I just tried some Bana Tea company green tea, with a gaiwan, and this is my very first taste and smell of tea that isn't a cheap flavored bag tea or herbal tea (I love herbal tea and didn't know it wasn't even considered tea! apparently it all comes from the same plant. my mom made a lot of sun 'tea' we usually had iced with all kinds of things that grew around) and I was surprised to find it didn't taste 'green' or plant like, a little too smoky. what would you recommend for a true green tea taste in your opinion that can be brewed everyday?",1608079756
tea,arlynn_paganwitch,kdycr5,Caffeine content in teaspoon dry vs oz brewed,[removed],1608078767
tea,NarhwalBlast667,kdxxwh,Thank you to the people who helped me with gaiwan advice; I've never enjoyed tea this much before,"&amp;#x200B;

[A nice cup of pu'er tea. This is my third infusion and the flavor changes are out of this world. I can't believe there was such a huge world of tea experience right at my fingertips. ](https://preview.redd.it/hcjgjoesxf561.jpg?width=800&amp;format=pjpg&amp;auto=webp&amp;s=33b8842c865c2f93b93be8d576e1a5bb6b910b5e)",1608077323
tea,Pjones2127,kdxl9e,"I want to buy a tea of the month subscription for my Son, but there are so many to choose from. Looking for a recommendation.",,1608076159
tea,MileHighScrub,kdx9uk,What’s the secret to making the perfect pot of jasmine tea?,,1608075112
tea,teawithglasses,kdx9cf,Help Shopping for Loose Leaf Teas as Christmas Gifts Online!,[removed],1608075068
tea,brilliantbharat,kdwq5h,International Tea Day,,1608073328
tea,-forbooks,kdwiiq,Oteas,Just picked up the strawberries and cream one! Never tried this brand before and this is different than what I would normally buy but I’m looking forward to it! Anybody else like this brand have favorite flavors??,1608072667
tea,No1uNo799,kdwh9f,I too am a man of culture 😤🧐,,1608072551
tea,Chemical-Row4420,kdvnpc,My parents went on vacation and sent these back to me. I thought the names were hilarious!,,1608069880
tea,Chemical-Row4420,kdvi2y,"Alright, so my parents went away on vacation and brought these back. I found the names of these tea blends hilarious!",,1608069420
tea,a82i53icu37t2,kdvg3k,How often can you reuse tea bags to drink?,,1608069244
tea,legal-stud,kdv1qp,It’s matcha time!,,1608068009
tea,mildlymoth,kdujxt,"Bf wanted to get into tea and his present finally came in! Nothing crazy, just samplers to see what he likes first.",,1608066474
tea,MasksOfEuclid,kds9k3,Loose leaf travel set!,[removed],1608059743
tea,MidnightMascara,kdrwi7,If I leave a hot tea overnight in the fridge will it still be safe to drink tomorrow?,It’s a green tea with the bags still in it,1608058689
tea,snow-ghosts,kdru21,Teapot recommendations?,"My current teapot just isn't working for me- the lid falls off all too easily when poured and the spout is terribly shaped, making pouring difficult. What I want is simple: a teapot that pours well and looks decent. Does anyone have recommendations or ones to avoid? Bonus points if it had a filter basket.",1608058490
tea,Dtknightt,kdrogi,My wabi-sabi tea set,,1608058033
tea,ThisGuyHasABigChode,kdrg89,"Enjoying my first ever cup of Paris Tea by Harney &amp; Sons, based on recommendations from this very subreddit.",,1608057374
tea,josqvin,kdr38k,Other websites that sell artisanal or craft productions like White2Tea?,[removed],1608056339
tea,Nimitz1985,kdqr4w,Diving deep into this rabbit hole.,"I placed some orders on White2Tea and Teavivre to taste a variety of tea. I hope I've got most of my bases covered now it's the waiting game lol. Oh, I'll post links to the  Sample sets from Teavivre if you're interested in what comes in them. (I hope I used the right flair sorry it wasn't)  


[5 featured Min Yue Featured oolong teas](https://www.teavivre.com/min-yue-featured-sample-pack.html)  


[Featured Taiwan Oolong tea pack](https://www.teavivre.com/taiwan-oolong-tea-pack.html)",1608055341
tea,theartistlydia,kdowjy,Delicious cup of warm herbal tea and lumpy cookies... perfect for a snow day !,,1608049812
