subreddit,author,id,title,selftext,created_utc
tea,RChickenMan,kdoleo,"To the best of my knowledge, tobacco is not, nor has ever been, used as a tea. Why?","I'm definitely not here to debate personal feelings towards tobacco.  But here me out:

Tea, or ""infusions"" in general, have been a thing for literally thousands of years.  More plants than I can count (in addition to tea itself) are used as an infusion throughout all kinds of different cultures.

Similarly, tobacco has been used for at least hundreds (maybe thousands?) of years by many different cultures, in many different forms--pipes, cigars, nasal snuff, Swedish snus, American dip, etc.

How have the two never crossed?  We've been infusing all kinds of plants into hot water for thousands of years, and using tobacco in many different formats for almost as long.  Is there something inherent to tobacco which would make it unsuitable as an infusion?  Obviously just steeping some pipe tobacco or snus or whatever in hot water would be disgusting, but then again smoking snus or putting cigarette tobacco in your mouth would be equally gross--point being, tobacco is cultivated and cured for specific purposes.  Why not as a tea?",1608048846
tea,Squishy-Cthulhu,kdo582,"A early christmas present to myself. From Whittard of Chelsea, bought in the black Friday sales.",,1608047431
tea,ThomasFromOhio,kdny01,Tea Descriptions on Vendor Sites,"I wish that more vendors would list details about the tea in the description on their site. Sure a catchy name, nice artwork for packaging, personal taste notes are nice, but more information on where the tea was grown, picking time, etc would be nice as well. Maybe this information isn't as important with other teas as I primarily drink puer. Trying to narrow down what I like about certain shous so I can focus on buying teas with those qualities, but when some of the teas don't have information on them, it's hard to determine what that teas has in common with a tea I like.",1608046778
tea,akraft96,kdnk23,"Please, someone, help me find a loose leaf tea comparable to this delicious, but wasteful, tea.",,1608045508
