subreddit,author,id,title,selftext,created_utc
tea,gaypenispooper,lo1rbd,Good fruit tea brands Australia?,"I bought some loose leaf fruity teas from T2 and they taste a bit bitter, good flavour but I need to drink so much water after for the bitterness. Just wondering what are some other better brands for that stuff?",1613805111
tea,armandoL27,lo18iq,Recommend me a nice teapot,,1613802995
tea,armandoL27,lo13s0,Why is this teapot so difficult?,,1613802481
tea,evans_bill,lo0u8a,Morning Puerh,,1613801422
tea,yrhumblenarrator,lnz69e,Why can't I make tea taste good?,"Hi guys, so first of all, let me tell you that I am completely new to brewing tea, but, nevertheless, i wanted to try it out!

So i figured i'd try to brew this Sencha green tea I had at home (it's loose leaf and it had like rose buds and strawberry) and it looked very nice so I was pretty excited.

The first time I brew it, it was very weak and it tasted kind of weird (I think I used too much water and i shouldn't have used tap water).

So second brewing, I used more tea and after I seeped it, it smelled heavenly. I was so happy!  But, unsurprisingly, the tea was soooo bitter. I legit couldnt drink it. I used way too much tea and I think the water was too hot. I also think I let it steep for too long.

So, third time's the charm, right? Nope. I used 2 grams of tea (one teaspoon) for 6 oz of water. Water was at 170F. I let it steep for around 2 minutes. And i was so sure it was going to taste good but, sadly, it was even worse than the first time. It literally tasted like water so i just squeezed some drops of lemon into it and now I have a weird hot lemonade.

&amp;#x200B;

Am i doing something wrong? Could it be the tea? I really just wanted some nice tea. Please help.",1613795348
tea,chedddar,lnyvpp,My Mom finally got her glass teapot she’s been itchin for,,1613794319
tea,Wrexhavoc,lnys2w,Everything is just prettier in glass. Drinking my lung ching tea. Happy Friday!,,1613793974
tea,Wrexhavoc,lnyqlu,Everything is just prettier in glass. Drinking some lung chin tea.,,1613793846
tea,Fresh_Jury_2091,lnyc66,"""What tea would you like?"" ""The lapsang souchong."" ""Oh. Have you had that before?"" ""Yes, I have."" ""Then you know why I asked.""",,1613792514
tea,Privatestoriesalt,lnxyl7,Are enamel teakettles safe?,I bought a pioneer woman enamel coated steel tea kettle and left it in storage until I finally brought it out for tea. I looked up heating enamel and some people are saying it can leach lead into the water. Now I'm a bit concerned.,1613791248
tea,klvklv,lnxrdn,Globe Amaranth Oolong Iced Tea Experiment (Successful),,1613790583
tea,Splatypussy,lnx7ue,Check out my new cat kyusu! How freakin cute are these cats?,,1613788806
tea,klvklv,lnx67z,Globe Amaranth Oolong Iced Tea Adventure,,1613788655
tea,jentanner35,lnv2bg,Was lucky enough to bring my tea set to the park today. This is True Blueberry tea by Celestial Seasonings.,,1613782024
tea,Catnapper_Sakura,lnubdn,"What kind of teapot brews the best loose leaf tea, and where can you buy them?","I've heard that the pour quality of a teapot can greatly affect the flavour of tea, and since my teapot recently broke I would really like to get one, but I have no idea where to look. I would really appreciate some suggestions, preferably for places that will ship to the UK",1613779807
tea,RadagastWiz,lntwys,Which tea goes best with each variety of Girl Scout cookie?,,1613778673
tea,blackninjakitty,lnrxw0,Enjoying my first cup of tea with my new ~aesthetic~ teapot,,1613773139
tea,testicularmullet,lnpmlo,Jasmine pearls for this cold morning.,,1613766399
tea,DoingItJust,lno61p,First order from YS!,,1613762651
tea,__lily__moon,lno5tj,Honey and Tea,,1613762635
tea,Historical-Look-6181,lnnf07,How much tea do you drink per day?,I must be in around 4 cups (two twice) and my friends tell me it's a lot. I'm sure many of you are drinking far more than that😝,1613760787
tea,BlindFearNo,lnmgi5,Do insulated flasks for hot drinks exist?,"I am in remote wildernesses nearly all of the time, and love carrying a tea with me. There isn't really a good solution to carry one on your body.  
Have you ever found an insulated flask???   
Granted, to stay pocket-sized and insulated it wouldn't hold much, but where i live and work a little bit of warmth would be great.  


Currently use a variety of methods to have warm tea with me, but they are all cumbersome.  
I'd love an insulated flask (double wall?)??? Do they exist???????  


Is there no market for the thermos/cooler companies to make one????  


I'm gonna be really embarrassed if these are sold all over the place...",1613758335
tea,toma_blu,lnmage,Had to pull out the pretty teapot,,1613757882
tea,Carmindor64,lnlf8y,Ember Mug?,"Hello! I have been thinking of buying the Ember temp-controlled mug, and I just wanted to get a second opinion on it. Also, ask if anyone has one, and if so, what they think of it. Thanks, and have a good day!",1613755671
tea,relatableloli,lnkxtm,"I bought loose leaf assam tea, but it leaves like an oily residue. Previously I used bagged assam, and that never occurred. I'm wondering if it's the brand of tea or something else.",,1613754493
tea,relatableloli,lnkv18,Tea Residue,"I recently bought loose leaf assam tea, but when I brew it, it leaves an oily residue
 Previously I was using loose leaf and did not have this problem. I'm wondering if it is the brand of tea or something else.",1613754302
tea,Fleetus,lnk7j1,Teapot Recommendations?,"Hello everyone,

My last ceramic teapot shattered in an unfortunate accident yesterday and, although I love sleek, classic designs, I am looking for something new and maybe with an interesting twist. I personally am not well versed in the different types of materials you use for different tea leafs, but I drink lots of loose leaf black teas if that helps.

If anyone has any recommendations for anything that might be a good replacement or something new, I would love to hear it.",1613752747
tea,boopdasnoottoot,lnk3xw,Stopped for some mugicha after some snow shoeing,,1613752515
tea,puppyeyesbabe,lnjqj9,First tea of the day ☺️,,1613751594
tea,dptt,lngx10,Enjoyed this super soft and fluffy silver needle yesterday.,,1613744296
tea,AutoModerator,lne7u1,"What's in your cup? Daily discussion, questions and stories - February 19, 2021","What are you drinking today?  What questions have been on your mind?  Any stories to share?  And don't worry, no one will make fun of you for what you drink or the questions you ask. 

You can also talk about anything else on your mind, from your specific routine while making tea, or how you've been on an oolong kick lately. Feel free to link to pictures in here, as well.  You can even talk about non-tea related topics; maybe you want advice on a guy/gal, or just to talk about life in general.",1613736011
tea,AustinW90,lnd6ug,13 studies - Orally-consumed green tea prevents photoaging and skin cancer,,1613732243
tea,Lumienee,lncjs6,Trying to capture the beauty of tea in motion while enjoying some tamaryokucha during my afternoon tea break,,1613729770
tea,celiadeng94,lnc9w3,Rose tea,,1613728777
tea,quarantsixetdeux,ln9jgj,"After burning a night with yerbamate, I am starting my day with some hot chai. Good Morning!",,1613718229
tea,SlySychoGamer,ln8hzp,Advice on flavoring green tea?,"I like the basic gunpowder green tea. I add honey and that is it.

It is....fine. However what else can I add to my gallon brews to flavor it up in a healthy way?

I was thinking citrus? If so what? I tried lemon juice, but was thinking more mango. Do they make mango/orange ""juice"" like the lemon and lime bottles? 

If anyone knows combinations I am willing to try as well.",1613714628
tea,AmeliaSwannn,ln694p,Click the link and get your $200 gift card Your link:,,1613707599
tea,UmbraVGG,ln67m2,Beautiful pixel work,,1613707475
tea,lolsquid101,ln5ux3,Brewing my first Da Hong Pao in this gorgeous new Yixing pot (feat. my cluttered desk),,1613706445
tea,n0tag00dtime,ln5dh2,"ok, what's the deal with cast iron pots/kettles? enameled &amp; raw",[removed],1613704955
tea,jshariar,ln54hm,Recommend a recipe for English breakfast,"I just bought Harney and songs English breakfast loose tea. It's not as strong as I would like.

Please recommend a brew method.",1613704180
tea,Ready-Internet-7183,ln47je,paul.mccartney@applemusic.com please call me when you get a chance URGENT and Roger even know what you think of the Russian federation of puppets and morons that have been blackmailing billionaires corporations and foundations worldwide want you to be on antipsychotics that have been stealing irs,[removed],1613701447
tea,teruma,ln42oq,I was invited from another sub to share my nice teapot here.,,1613701041
tea,karukukimoto,ln40gj,Tea Bags in Gallon Bottle,"Hello, I was wondering would it be okay to leave some tea bags in my old water jug for tea? I would take them out but they don't have any strings on them. Also, would it be fine if the water was old? Or does it steep faster/better in hot water",1613700844
tea,iamtanji,ln3mtq,"My Tea for the day, a lemon butterfly pea tea.",,1613699739
tea,beachape,ln30ya,Staple Repair Advice,"Just broke my favorite yixing teapot. I must be clumsy, because it seems I break at least one piece of nice teaware per year.  Not the first yixing that I’ve broken. This one is in 3 big pieces and three small pieces. I don’t want to use glue/epoxy, because I’d like to potentially use the pot. Worst case, it remains broken. Some specific questions:

1) what to use as staples? Would sterling silver wire work?
2) any recommendations for diamond bits?
3) the small pieces are going to be hard to staple. Is it possible to melt silver wire into the cracks, or will it just fall out?

Thanks!",1613697926
tea,barefoot_teen,ln2ysd,I tend to disagree,,1613697754
tea,Dynkies,ln2uth,Hot tea bomb with Hibiscus,,1613697431
tea,ToasterStrudel91,ln23e3,New to tea. Help wanted,"Hello teasters! I'm new to tea as an afternoon treat since I started working from home. I find I like black teas... Earl Grey in particular. Where do you guys buy teas (I live in Knoxville, TN) and what other black teas should I try? Engage!",1613695189
tea,throwawaycbt69420,ln1xdn,Does tea aging lead to more or less L-theanine?,"I've found that when I bought some black tea leaves in bulk before, I didn't have time to drink all of it before it's aromatic appeal dissipated. But when I made the tea (loose leaf, like always and made very strong like always) I found it was less stimulating and much more relaxing and enjoyable compared to fresher tea. I usually drink green tea for this reason but I don't have any on hand atm and considering the pandemic I only go to the store about once every two weeks so I don't have any, but I do have a lot of old (about a year) black tea in a ziplock bag still in their packaging. I checked for mold so no worries there but I'm just wondering if when tea ages it increases it's L-theanine content or decreases it's caffeine content or if theres something else going on leading to it being more relaxing. Thanks for any replies!",1613694724
tea,BlankVerse,ln1k2i,Cold Brew Tea brew time?,"I generally like my regular tea cold, and my herb teas hot. 

So I purchased some Lipton (yeah, I know) Cold Brew and Iced Tea bags. The instructions for the Iced Tea were pretty much what you'd expect. 

1. 4 cups of boiling water over 2 large tea bags 
2. brew for 3-5 minutes, then remove bags
3. sweeten to taste
4. Stir in 6 cups of ice cubes

Makes 2 quarts of very Liptony ice tea.

Now the instructions fir the cold brew confused me. I'd already read a bunch of posts here and on the internet about cold brewing tea. And they all say for cold brew use 1.5-2x the amount of tea leaves you'd use for hot tea, and steep for anywhere from 4-24 hours depending upon the tea.

First off the Lipton Cold Brew actually has less tea than the Iced Tea version (6.2g vs 7.1g).

Then the instructions say:

1) Pour 2 cups water over 2 tea bags

Cold water? Luke warm tap water?

2) Brew 3 minutes, stir, remove tea bags

3) Sweaten to taste, add ice.

Just 3 minutes!?

I tried that and although it was stronger than I expected, it was still fairly weak tea in my opinion.

So I thought what if I left the bags in longer. After 2 hours the tea was just about right. After 4 hours it was starting to taste a little bitter, but I continued. After 6 hours it was fairly bitter and strong, so I took out the bags. I now had cold tea that required lots of honey to sweeten. ;)

What is everyone else's experience with brewing cold brew tea and particularly Lipton Cold Brew?

----

What about other teas, especially herb teas. 

Just for fun I decided to make cold herb tea using the Iced Tea method above, using 2 quarts hot water over 8 random herb tea bags since 2 qt=8 cups. and then cooling. That turned out pretty strong and dominated by the ginger tea I included (but I did not mind that since I enjoy ginger tea). I liked the end result. It was tasty. Next time I might try 8 bags in 3 quarts to make it less strong. And maybe even actually cold brew in the refrigerator.

Any suggestions?",1613693688
tea,Jenna4242,ln19z0,Favorite Chinese tea?,"I've been searching for some good Chinese tea, and I would like to know some of your favorites!",1613692911
tea,LeafyGreen_Tea,ln05hr,New Tea Tote from LeafyGreen Tea,,1613689816
tea,dtcardillo99,lmzu21,Barley Tea + Green/Black/Other?,"Has anyone tried mixing barley tea with any other kinds of tea? Does it steep well together or would it not work that well? Just curious what this subreddit would think, I don't know anything about tea honestly.",1613688987
tea,brettjc04,lmzpgg,First ever black tea latte. Chocolate cookie black tea w/ an almond milk foam,,1613688646
tea,yoyoncha,lmznec,Mark Mohler collection with purple tea.,,1613688498
tea,Helpful_Signal2457,lmzm10,Hot tea and meditation.,,1613688395
tea,Bernard_Hunor_Deak,lmxm2k,Spread of the word 'tea',,1613683281
tea,TianQingNi,lmxiod,teapots of TianQing clay that change color,,1613683046
tea,gxace,lmx8fc,"Really want a dedicated tea table with an integral drain system, but a hose and a bucket will do for now.",,1613682337
tea,tajarhina,lmvltj,“That bitter tisane that you sip through a ‘bombilla’.”,,1613678121
tea,monmouthaviation,lmuh46,A nice cup of coffee SIKE it’s a cup of almond milk chai for this snowy New Jersey day.,,1613675287
tea,taptapswitch,lmu0fb,Which one is the Kyocera homemade matcha?,,1613674149
tea,TraditionalWatch74,lmtzfy,Is it blasphemy put put tea in a coffee seasoned mug?,[removed],1613674081
tea,Lorenzotea,lmstym,Tea samples,[removed],1613671260
tea,kevcorms,lmruns,"Tea of the day is Champagne Wishes. Black tea, white wine grapes, marigold, tea blossoms. Time to enjoy a snow day ...",,1613668696
tea,nerdychick22,lmrgqx,Hot tap water or cold tap water to fill the kettle?,"We make a lot of tea at our house, and my SO and I have a disagreement about what temp of water to fill the kettle with. I argue for hot water as the kettle boils faster when preheated and uses less energy. He argues cold because hot can cause more dissolved carcinogens in the water from the pipes. What are your opinions? Sources or schollarly studies? Can either wayvaffect the taste of tea made with it?",1613667750
tea,chippedreed,lmrb21,Anyone ever order tea from nuts.com? How is it?,"I’ve recently started frequenting this website and I saw that they sell a variety of tea. It’s in bulk though, so can anyone here vouch for the quality? Is their tea good?",1613667410
tea,SidneyBidney77,lmqrjs,Any suggestions of brands to buy loose leaf tea?,"I use to buy Teavana’s loose leaf tea, and Ive come to the end of all of containers. I don’t would like to purchase loose leaf tea again (located in the US). Does anyone have any suggestions?",1613666042
tea,Qu3st1499,lmpbzg,Finally a decent green tea plus stupid question,"I finally managed to get a decent green tea thanks to the subreddit. I’m still working on the brewing time, but so far the tea doesn’t taste like water in which you had boiled vegetables.


P.s. can I brew again tea Leafs in different days?",1613662303
tea,surveysender3000,lmoyz7,Tea survey,[removed],1613661340
tea,deepinsideyourgf,lmojjn,Glass or mug (Idk if you say mug to where you drink tea but whatever) ?,"I love to drink my tea from glass because I love the color but it has one problem. The glass gets just too hot so I either have to lift it using my finger to grab the top or use a place of cloth. 
How do you drink your tea? And any recommendation for my glass problem ?",1613660186
tea,HassanMoRiT,lmo3ai,Break time at work.,,1613658872
tea,SIstatk,lmnlgu,Tea pet care,"Hi guys, 
I just got my first tea pet today and I was wondering if I need to be doing some ""before first use"" maintenance?
Do I need to wash it or boil it like a clay pot or something?
Don't know exactly the type of clay it's made of, but it's one of the tea meowsters from bitterleaf teas if this helps.
Thanks in advance!",1613657426
tea,emma_chan,lmmtbg,Super duper excited about my first Harney &amp; Sons purchase!! 😍,,1613655017
tea,CezarZbughin,lmkyc3,Help. My electric kettle started to give a slight limestone taste to the water.,"I think I ve seen this topic a lot on the subreddit. i've seen the vinegar boiling thing. I personally  use lemon juice and it helps with the visible stones. Didnt seem to help with the taste tho.

But the question is: is there anything else you can boil the water in. I mean it sure is, but what do you use. And what gives the best results.",1613648721
tea,celiadeng94,lmjigo,Peach Oolong Tea,,1613643250
tea,sparkletod,lmjbp0,Trying out a new gaiwan I just got from a local shop,,1613642490
tea,IuminomenaI,lmj924,boyfriend sent me some loose leaf tea for my birthday,,1613642245
tea,applefritterkitter,lmffp5,Oolong Tea Doesn't Taste Like Anything,,1613628366
tea,forageforcoffee,lmd8xj,"A cup of bluebell tea, granola, turkish delight, and an orange to round out tea time today",,1613621048
tea,BioStore,lmd6zw,Herbal medicine,"Indigenous people worldwide, revere much of the natural world as sacred. And rely on its elements to ease many **health problemes**. For much of humankind, especially in the groves of africa, possessing plant knowledge, or having access to a person who did, made the difference between life and death. In fact, the majority of the world still relies on traditional medicine, and even in industrialized countries, folk remedies are still used to treat illness everyday.

It's not a surprise then, in these modern times with the growing options of **medical technology,** that there’s a rising movement to restore ancient plant-based healing practices. Having access to modern healthcare is not easy, costs are skyrocketing and the quality of medical care is degrading in developed countries, let alone the tird world, leading a large population to seek alternatives outside of the mainstream medical system. Herbal medicine might be a more accessible solution.

There are many different systems of traditional medicine, and the philosophy and practices of each are influenced by the prevailing conditions, and geographic area within which it first evolved. The commun property of all the systems is there emphasis on the equilibrium of the mind, body, and the environment. Generally, the focus is on the overall condition of the individual, rather than on the particular ailment or disease from which the patient is suffering, and the use of herbs is a core part of treatment.

Traditional Chinese medicine is an important example of how ancient knowledge is applied in a holistic approach. Treatments are based on a large view of the patient, expressed in terms of the balance of yin and yang. Yin represents the earth, cold, and femininity, whereas yang represents the sky, heat, and masculinity. The actions of yin and yang influence the interactions of the five elements composing the universe: metal, wood, water, fire, and earth. The practitioners seek to control the yin and yang levels and the energy through the body by making recourse to herbal remedies.

In modern days, the usage of **natural products** other than vitamins and minerals are the most commonly used alternative medicines, because they are widely perceived as natural, safe, more affordable, closely corresponding to the patient’s ideology and allaying concerns about the adverse effects of chemical (synthetic) medicines. They also satisfy a desire for more personalized health care. Furthermore herbal therapy increases when conventional medicine is ineffective in the treatment of disease, such as in advanced cancer and in the face of new infectious diseases.",1613620877
tea,lordlebu,lmcxny,Darjeeling Tea 🍵 and the ambiance that makes it 🏞️,,1613620029
tea,texasisjustok,lmcvbh,Help IDing new Kyusu,,1613619816
tea,imy2015,lmc6yr,Tea time during work!,,1613617631
tea,boywithhat,lmc103,Best tea shops/houses in Seattle,I'm going to Seattle on my honeymoon in July and I was wondering if you guys had some recommendations for tea shops and houses in the city,1613617126
tea,rougethebatt,lmamh0,Any recommendations for a non-stainless steel thermos? With infuser is ideal,"I'm looking everywhere for a travel thermos that isn't stainless steel since I hate how steel feels against my lips.

Infuser isn't a deal breaker though. 

Thanks so much!!",1613612714
tea,BunkyBunk-,lmaa2c,More Flavors,[removed],1613611660
tea,Anathy,lm9sgw,Nutty Flavors,"I use tea bags, i haven't brewed a proper cup of tea in a long while, i don't think i actually have ever had a proper cup of tea... well if you call tea bags proper then i have... i just would like some suggestions on some teas i should have. I currently use black tea, and it always has a nutty flavor when i add milk, I'd like to try other teas with milk that don't have a nutty flavor. I do like the nutty flavor though, I'd just wanna try something different... any recommendations for tea bags and loose leaf?",1613610175
tea,MagnificentCranberry,lm9kl8,Has anyone tried the spring 2018 longjing from Tea Drunk recently?,"I've never tried longJing myself, but wanted to use it as a gift. But I've heard that aged greens taste very bland, so would this be a bad idea to gift? But the spring 2019 is $69 for 4g, vs. the 2018 which is ""only"" $17 for 4g.",1613609536
tea,madmix27,lm6yai,Is gong fu brewing common in China?,"Hey, so the other day I have read an article somewhere on the web and the author wrote that gong fu brewing is not really something common in China. Is that just misinformation? I am asking because I thought that most people in China drink their tea from little Chinese cups with gaiwans or little teapots on the side.",1613602083
tea,__lily__moon,lm5zrv,Spot of Tea (animation),,1613599425
tea,Teasturbed,lm5jmi,"Close-up of linden flowers floatin on my linden-ginger tea, poured in a sake cup.",,1613598220
tea,jyang0529,lm37yj,🍵 Thank you so matcha!,,1613592089
tea,Astrosilvan,lm33kd,Been sipping Big Gulp-sized tea to stay warm these past 2 days with no power,,1613591767
tea,Dangerous-Habit1886,lm2wf9,Growing your own tea leaves?,How difficult would this be? Could I do this indoors with grow lights? I'm also thinking about building a greenhouse outdoors so that I can grow during the summer. Thanks in advance!,1613591199
tea,faoction,lm1kx4,The process of making iced tea,,1613587688
tea,reroutin,lm17ce,Random &amp; may be a silly question: can you use steeped tea leaves as plant fertilizers? Or probably best to chuck them out?,,1613586673
tea,senorpancake1,llono0,Boring Tea Drinker Here - what should I try?,"I'm a die-hard, lifelong, black tea with a scoop of sugar kinda gal. I drink at least 1 cup a day, make that iced in the summer. 

But I feel like I'm not a true tea person because I straight up only drink black tea. I do really enjoy Hibiscus on the occasion, I love how fruity and sweet it is. 

I find I like the strength of black tea, earl grey just doesnt cut it. Green is hit or miss. Am I too picky?

Hit me with those suggestions you lovely tea people ☕",1613546150
tea,Kinglens311,llnvjo,Suggestions,,1613543074
