subreddit,author,id,title,selftext,created_utc
Coffee,TheFaceofDave,l53cby,Replacement burr for Miele CVA 4075 Superautomatic?,"My parents just moved to a new house with a built in Miele CVA 4075. It’s in decent shape, functions properly, but it’s definitely seen a lot of use as it’s likely from 2006. I see you can get many replacement parts online but I haven’t seen anyone that carries any sort of replacement burr. Anyone here have any experience with that?

I know these machines don’t make the greatest cup of coffee but I suspect a new burr would be a significant improvement given the age. Even the top of the burr looks very dull and it’s been impossible to dial in anything without significant bitterness. Though, to be fair, I’m used to very acidic light roasts in a pour over with a Comandante C40.

Any help or advice would be much appreciated!",1611625850
Coffee,PancakeJack455,l531f0,"Freezer-cleaning, but for coffee?","When I say freezer-cleaning, I mean taking any old stuff in your freezer and hodgepodging it into a meal. Does anyone else do that with coffee?

I had a bit of light roast and a bit of dark roast left, so I just smashed them together and called it the ‘Equinox roast’. Strong as the hulk, but it was pretty good!",1611624886
Coffee,kizbok,l52cew,how does a coffee machine cleaning light work?,What is the mechanism by which the light is turned on? What is being detected that triggers a 'clean me' signal?,1611622691
Coffee,a10whiskey,l528bf,V60 Grind Issues,"Hello World!
     I have recently acquired a V60 2 cup brewer. I have had hit or miss brews with the brewer. Now I know that it's entirely user error because I know it can make great coffee. My problem is that I can't seem to nail a great grind size for it.

When I see a tutorial video on YouTube, someone like James Hoffmann who I know, knows what he's doing. His grind size is larger than mine. I know that because I can see larger pieces that look far coarser than my much fluffier looking grind.

I know that the brew should be somewhere around 3:30-4:00 mins for a brew. The best I seem to be able to do is just over 3mins long. And I'm grinding rather fine, I'm trying to pour as gently as possible but still providing enough water to sufficiently keep water in the brewer, covering the coffee. The brews are usually just over 3 mins and are almost always underextrcted and weak.

I aim for a 20g to 280ml brew. Though I've try anywhere from 18-22g to try and change the extraction ratio. But it still seems to have little effect.

What are your recommendations and thoughts on how I can improve my brews? Any recommendation is appreciated, I'm by no means set in my ways of using the brewer.

Thank you!",1611622322
Coffee,catcatcatok,l51trn,Gaggia Classic uneven extraction...always on the same side?,"I’m always looking to improve my espresso shots, but after months of having my Gaggia Classic I still haven’t had that perfect god shot...they taste decent but I noticed almost 100% of the time, the coffee extracts unevenly to the left side of the puck, sometimes with channeling. At this point I have a distribution technique down where I kind of shake/tap the portafilter to settle the grounds evenly, use a distribution tool, and then tamp. So I’m wondering if there’s an issue with the machine’s water flow that causes it to drip from the left of the puck...

Already did the OPV mod to 10 bars of pressure. Any input is appreciated!",1611621036
Coffee,zerowingangel,l50ni9,S&amp;W Culled Cold Brew,Just ordered some of the [Culled CB off of S&amp;W](https://swroasting.com/culled-brew.html) after reading some good things about it here. They say it's pre-ground for optimal cold brew size - but the grind size seems super fine! Basically cafe bustello fine-level. I always thought for best cold brew extraction you want much coarser grinds - so just wanted to ask to see if anyone had a reasoning for this.,1611617511
Coffee,jambaj0e,l50ndz,The heck? My Eureka Mignon Filtro is missing the anti clump,"So I recently bought the Mignon Filtro from Clive Coffee and today is the first day of cleaning. To my horror, when I open the chute, I discovered that it's missing that anti-clump piece at the top of the chute!

I emailed them, but what are my options here?

https://i.imgur.com/KN2YMAp.jpg

https://i.imgur.com/uigCIeB.jpg",1611617500
Coffee,intouchanalytics101,l50lqb,Why would drawdown times on decaf be higher?,"I usually make one caffeinated and decaf cup per day with a V60, and I've noticed that the decaf cup takes significantly longer to brew despite being the same grind size. Any idea what would cause this? Should I keep grinding coarser until the drawdown time is similar to the caffeinated brew?

In case it matters, the decaf is almost always Swiss Water Processed.",1611617363
Coffee,valsidalv,l507wp,First burr grinder: Baratza or Breville?,"I brew coffee every morning using a moka pot and my blade grinder. I recently began following James Hoffmann's [tips](https://www.youtube.com/watch?v=3y7d-5KWHCU) for getting better-tasting coffee using a blade grinder, and the results are astounding. So, now it's time to step up to a proper burr grinder. I will continue to use my moka pot and may end up buying an entry-level espresso machine later on.

I wanted to keep the costs low but things snowballed and I eventually settled on parting with $360 CAD for a Baratza Sette 30. A quick search on camelcamelcamel reveals that the price of this grinder remains quite steady, so I don't expect a sale on it anytime soon.

Just as I was about to buy it, I saw an ad for the Breville Smart Grinder Pro, now discounted to $240 CAD. I'm familiar with the Breville from reviews I've watched and considered it as well, but I preferred the look and performance of the Sette 30. However, now that there is a significant price difference between the two grinders I am wondering if the Breville is simply a better buy? What would you choose?",1611616216
Coffee,atoponce,l506kx,How late in the day would you recommend a teenager have coffee?,"I'm 43 and typically have my last cup around 15:00-16:00. Not because caffeine makes me jittery or keeps me up at night, as I could have a cup just before going to bed at 22:00, and sleep like a baby. Instead, it's mostly due to cost as well as ritual, which involves moving into tea for the evening.

My wife took our 13yo daughter went to Starbucks, and my wife asked how late in the day would be ""safe"" or ""wise"" for a teenager to have coffee. Honestly, I don't know. I'm interested in your opinions, and any reading you could provide that would help.

Thanks!",1611616111
Coffee,mattdean93,l505xq,Fellow Move and V60,"In case anyone was curious about this, the lip opening on the Fellow move is too small to fit a V60. Actually, it is the same size as my V60 so it can’t rest inside the lip.

 I googled everywhere before ordering and found nothing regarding this other than its measurements (wasn’t clear if that was from the inside or outside of the lip). I thought it would BARELY fit since it says it fits majority of standard droppers, but alas it does not fit. Maybe this is Fellows way to get you to buy their pour over unit that fits, but I found this to be very frustrating",1611616062
Coffee,matildathedestroyer,l4zs7l,Kinu M47 Simplicity grind adjustment,"I received my Kinu m47 simplicity a few days ago and had a question about grinding adjustment. I've found that the adjustment wheel is very hard to turn in some positions. More specifically, after loosing the locking screw, it takes quite a bit of effort to get the adjustment wheel to turn, and then after a bit it gets easier, and then after more rotation it gets much harder again. Has anyone had this problem, and are there any solutions? Or perhaps advice if I'm doing something wrong?

Thanks in advance.",1611614974
Coffee,TheFlaskjar,l4yohe,Niche Zero and Barista Express Shot Quality Potential,"Hi Guys, I was just wondering about the potential for good espresso using a Barista Express and the Niche.

I got the Barista Express about 2 years ago to save money on coffee shop flat whites (it backfired 😂), but soon side stepped milk drinks and have been making filter coffee with a commandante for about 18 months. I use chemically ideal water, know about extraction principles, buy nice high-grown beans and like to nerd out on the pour-overs.

However, I’ve just got a Niche Zero this week, and now I’ve got a perfectly good, stepless espresso grinder, I’ve been thinking about getting into speciality espresso for the first time.

I just wondered from anyone who has the Barista Express but upgraded their grinder, whether you’re able to get shots comparable to something like the Breville/Sage Dual Boiler or Lelit Bianca (or something else $1000-2000) after a bit of preheating and grouphead flushing? Or would I be best off spending some more money on a better machine?

Thanks in advance.",1611611859
Coffee,P4ULUS,l4xqxw,Moccamaster vs Drip: My Experience,"Background:

I’ve been preparing single cup pour over coffee for years as I prefer the pure taste of pour over to machine brewing methods. Recently, I splurged on a Moccamaster as I thought a machine would save time in preparing coffee each morning for my partner and I as stirring and pouring the drip is time consuming. We consume about three 6-8 ounce cups total between us each day.

Moccamaster Review:

This is a nice coffee maker. Don't get me wrong. Moccamaster makes good coffee and produces said coffee quite quickly once loaded up so make no mistake about that. However, I will be returning my Moccamaster and reverting back to pour over methods. Here's why:

1) Cheap plastic parts and design shortcomings. As others have mentioned, many of the Technivorm pieces are flimsy plastic afterthoughts that don't give using this machine a high-end feel. The funnel cover and hot water dripper can be easily knocked out of place and the pot itself scrapes the heating plate when put beneath the dripper. It gets annoying needing to be so careful to collect the parts properly and not break or displace anything. 
2) Water basin is not removable. As far as cleaning goes, it's not straightforward as the water basin is screwed in. I understand the thinking here - it's only purified water that goes in there so why clean it? Would be better if this was removable.
3) Inefficiency. Probably the biggest issue for us. With the Moccamaster versus a pourover, I found we needed 7-8 double tablespoon scoops (~16 tablespoons) for 2-3 cups of coffee vs 12 tablespoons using a Chemex pour over for the same number of cups. I was using way more coffee with the moccamaster compared with pourover methods as the drip method is simply not as efficient. This issue is not unique to the moccamaster but there are likely smarter machines at saturating the grounds. 
4) The two-setting hot plate functionality is problematic because it's always on when the coffee maker is on meaning the coffee is constantly heating up in the pot while the funnel is still dripping. When making a bigger pot (8+ cups), the coffee ends up tasting overheated.
5) No timer. A $300 coffee makers should have a timer or at least more features than simply dripping hot water over coffee beans. 

Results:
For me, the best solution I’ve found is a Chemex. A large pour over apparatus provides some added efficiency versus a single cup pour over while retaining the same great taste and overall process control. We bought a Chemex and will continue with pour over.

Interested to hear others thoughts and experiences with expensive coffee machines vs pour over. For us, we simply didn’t find the time savings that we’d hoped for. Thanks!",1611609298
Coffee,llama_AKA_BadLlama,l4xffj,Looking for a FeldGrind,"Im looking for a quality hand grinder, and it seems like the knock feldgrinder is the one I want. Seems to be out of stock everywhere.  Does anyone know of a place to get them, or even have one secondhand?",1611608450
Coffee,Cobboolio,l4x3r0,Budget hand grinder recommendations? (In the UK),"Hi all,

I've recently been given an aeropress and have been thinking it would be nice to to get a grinder and start occasionally buying beans. Just wondering if there are any reccomendations for cheaper hand grinders? 

I've seen the Timemore C2 recommended which is around £70, is there anything cheaper that is also decent? Maybe more like £30-40? And if so is there much difference between the quality?

I have about 2 cups of coffee a day, and would probably buy beans as a treat maybe once a month, depending how quickly I get through them. At the moment I just buy ground coffee from the supermarket.

Thanks for the help :)",1611607544
Coffee,OnlineDrunkard,l4wxu2,Just getting into the coffee game..,"Have a few questions..

1. Is the V60 a good choice? I see a lot of people using it on here. Is there a better one $50 or below?

2. Where to get good coffee. What websites do you recommend buying from and what brands would you recommend for a beginner??

3. What temperature should the water be at when using something like the V60?

Any other advice you’re willing to give would be great...",1611607105
Coffee,wallaceandbarnes,l4wcia,First time trying an iced V60 recipe! Anyone else have their iced pour over recipes they wana share?,,1611605482
Coffee,TerminallyAle,l4w33m,Stagg pour over,"For about the past year I have switched away from pour overs such as V60 and Kalita Wave to the Clever Dripper. The Clever gives me consistently good cups, but it can lack some of the brightness from the V60. I've never had a bad cup from the Clever and I've had quite a few from the V60.  I've also had some of the best cups from the V60. 

[u/nadavdvd](https://www.reddit.com/user/nadavdvd/) made a post the other day about the Stagg X and that got me curious to look into it. It looks like a hybrid immersion/percolation, similar to the Clever. 

So, I guess what I would like to know is, anyone who has used both (clever and X) how do they compare? Will I get the brightness similar to a V60 and the consistency of the Clever?

Also, the difference between the X and the XF? I would lean towards the X, but it seems to be sold out or way over priced.",1611604811
Coffee,Wendy888Nyc,l4v8pa,"Does doing a pourover into a mug stop air flow from escaping, therefore affecting the drawdown?","So I didn't make this up; it was included in a recent brewing video from a reputable source. But I'm skeptical- is a carafe or a mug with a lip needed to optimize a pourover? Can brewing into a regular mug really stop airflow and affect drawdown?

I know people have reasons for brewing into a carafe- multiple servings, temperature considerations, anesthetic, etc. I brew for one and like brewing into my mug. I mix with a spoon as soon as the brew is finished, so no issue with that. I can also swirl a mug if I want to. (I've just ordered a glass mug so I can see the process better). Nothing about using a mug bothers me. I don't want to purchase a new carafe to clean after every brew, if it's not going to improve my pourover 

Is this real or made up science? Like has anyone done a taste test or can really tell me that brewing into a carafe will produce a different/better brew than brewing into a mug without a lip and no airflow?",1611602557
Coffee,iam_thesauce,l4v66x,Best gas station coffee ?,"What is the best gas station coffee in north carolina ? 

We all know wawa is the best but that's not an option..",1611602365
Coffee,WebDevJourneyWDJ,l4v37d,Coffee Shops For Enthusiasts," 

Hey guys I realized that there really isn't a app for finding coffee shops near you. So what I want to do it create an app for coffee enthusiasts and also that's user based.

If you think this is a good idea I would love to hear some features that you think this app should have.",1611602136
Coffee,andytriesnewthings,l4uzya,Huge coffee drinker here,Lately I've been getting nauseous when drinking coffee even after I eat what could this be?,1611601888
Coffee,WebDevJourneyWDJ,l4uykw,Coffee Shop App For Enthusiasts,"Hey guys I realized that there really isn't a app for finding coffee shops near you. So what I want to do it create an app for coffee enthusiasts and also that's user based.  


If you think this is a good idea I would love to hear some features that you think this app should have.",1611601790
Coffee,AMD_PoolShark28,l4ttto,"DIY unbleached aeropress filters from Melitta drip coffee basket filters at fraction of price, super ez",,1611598782
Coffee,luanytunes,l4truw,New York Food &amp; Coffee Tour 2021 | Westchester County Travel Vlog,,1611598636
Coffee,GitarooJack,l4tigy,My switch is bigger than yours,Probably my most mad-scientist feat yet: Switch with the 02 swapped out with an 03 and using Chemex filters. Gets the job done. :D,1611597958
Coffee,AMD_PoolShark28,l4tdlg,DIY unbleached aeropress filters from Melitta drip coffee basket filters at fraction of price,,1611597616
Coffee,Razmxd,l4t0k7,Timemore C2 grinder defective -Burr stuck togather,[removed],1611596630
Coffee,NoLongerNorwaysTroll,l4spel,Why drink coffee and/or energy drinks when generic store-brand caffeine pills give you comparable amounts of caffeine for far less money?,"Why drink coffee and/or energy drinks when generic store-brand caffeine pills give you comparable amounts of caffeine for far less money? 

A 200mg caffeine pill is like 1 or 2 cups of coffee. 

A cup of coffee is $2, give or take. 

A generic Kroger-branded caffeine pill is 6.25 cents each (or a pack of 40 for $2.50 after tax.) 

I take 2 caffeine pills at a time to get me going for the whole day, which is 12.5 cents worth of pills, for 2-4 cups of coffee worth of caffeine. 

So while you get the same amount of caffeine with $4-8 worth of coffee, I get that level of caffeine for 32-64x less than that cost. (4/.125=32, 8/.125=64)

So why drink coffee or energy drinks, when you can get charged up the same way with generic energy pills for a far lower cost?",1611595806
Coffee,n8buckeye08,l4se1z,Two questions on brewing for guests,"I'm a coffee snob and have an aeropress, hario v60, 24 oz french press, and a electric burr grinder.  This is great for my own personal use but not great for the following situations:
1. Houseguests - I have to give a full demo and people are usually intimidated by the process and time involved.
2. Entertaining - when we have friends over, it's a big ordeal to brew enough coffee for everyone

Any suggestions for brewing method/equipment that takes up little space (can be stored easily), is easy to use, and produces a decent enough cup?",1611594948
Coffee,markamgine,l4rpee,Starting a Community Database of Grinder particle size distributions,"Today I just received my second manual grinder, a LingLong Ace R1 and wanted to do a comparison against my existing grinder, a Timemore C2, as the Ace R1 was reputed to produce fewer fines. Conveniently, Jonathan Gagné has created an app that allows you to analyze your grind distribution and quality, which I used to produce the graph provided.

https://i.imgur.com/yqROQVR.png

While I think this is an awesome tool, the real value would be in gathering and aggregating as much of this sort of data together. In this particular example, the Ace R1 performed better, but is that true if I do the same tomorrow? What if I used a different type of bean? If we are able to share as a community grind distributions from all of our own grinders and compare them to each other, then we would be able to use the data to answer some often asked questions such as:

* Is grinder X comparable or better than grinder Y?
* Is it true that beans from origin A produce more fines than those from origin B?
* What effect does the roast level, days past roast, etc. have on the grind quality?

Of course, this doesn't directly answer the most important question of how does a grinder upgrade affect taste, but hopefully such an open database would at least be a useful reference for coffee newbies looking for a good grinder as well as experts and dataholics who want to better understand how different grinders affect the coffee that we make.

I hope a good number of you would be willing to participate and share your own data - the only things you need are:

* a grinder
* coffee beans (only need to use at most a few beans per type)
* a camera (8+ megapixels)
* a PC or Mac to run the analysis software
* a bit of your time and effort

In the spirit of open source, I created a github repo for hosting this data here. If you are tech-savvy and/or coffee-saavy and want to help with this project, feel free to message me about becoming a co-administrator of this project.

The link to the project is https://github.com/Coffee-Grind-Distribution/coffee-grind-distribution

Thank you for your support!",1611593101
Coffee,pysl,l4rltt,How to de-gas my coffee beans without any sort of one way valve?,So there was this new coffee shop that opened in my area recently and I saw today that they recently started roasting their own beans. I went in to buy some today and told me that they don't have any bags and they gave me my coffee in a couple of their drink containers. They also told me since it was roasted yesterday that I need to let it de-gas for a little bit before using it. I did some research online and everyone's talking about buying a special container and whatnot but in my current position what's the best way to de-gas? Just let it sit in these cups for a day or two? Will the coffee get stale? Thanks!,1611592838
Coffee,SheldonvilleRoasters,l4rdjh,Tackling decaffeination at the source -- using GMO's instead of chemical agents to preserve coffee's flavor,,1611592205
Coffee,markamgine,l4r8ri,Community Database of Grinder particle size distributions,"Today I just received my second manual grinder, a LingLong Ace R1 and wanted to do a comparison against my existing grinder, a Timemore C2, as the Ace R1 was reputed to produce fewer fines. Conveniently, Jonathan Gagné has created an app that allows you to analyze your grind distribution and quality, which I used to produce the graph provided.

https://i.imgur.com/yqROQVR.png

While I think this is an awesome tool, the real value would be in gathering and aggregating as much of this sort of data together. In this particular example, the Ace R1 performed better, but is that true if I do the same tomorrow? What if I used a different type of bean? If we are able to share as a community grind distributions from all of our own grinders and compare them to each other, then we would be able to use the data to answer some often asked questions such as:

* Is grinder X comparable or better than grinder Y?
* Is it true that beans from origin A produce more fines than those from origin B?
* What effect does the roast level, days past roast, etc. have on the grind quality?

Of course, this doesn't directly answer the most important question of how does a grinder upgrade affect taste, but hopefully such an open database would at least be a useful reference for coffee newbies looking for a good grinder as well as experts and dataholics who want to better understand how different grinders affect the coffee that we make.

I hope a good number of you would be willing to participate and share your own data - the only things you need are:

* a grinder
* coffee beans (only need to use at most a few beans per type)
* a camera (8+ megapixels)
* a PC or Mac to run the analysis software
a*  bit of your time and effort

In the spirit of open source, I created a github repo for hosting this data here. If you are tech-savvy and/or coffee-saavy and want to help with this project, feel free to message me about becoming a co-administrator of this project.

The link to the project is https://github.com/Coffee-Grind-Distribution/coffee-grind-distribution

Thank you for your support!",1611591840
Coffee,bunceandbean,l4r4zw,How does Keurig coffee compare to pour-over coffee?,"While I've been a barista for a long time now, I still have not had the money to get good equipment to make quality coffee at home. I have been relying on my Keurig to get me through my addiction. Would be getting a cheap pour-over coffee maker combined with a kettle be worth it for an increase in quality?",1611591556
Coffee,Fluffyman9,l4r2o7,Baratza Virtuoso+ vs Eureka Mignon Brew Pro,"I need the grinder strictly for drip coffee (Moccamaster).

I'm torn between the two. The Eureka is quieter by a good margin (important to me) and I like the design more.

But is there any difference in the grind between the two? Almost double the price is hard to justify if they grind the same.

And even if the Eureka grinds better, will it be noticable in the cup?",1611591375
Coffee,AkinSever,l4r2gf,Taking samples for TDS measurment,So i brewed an Aeropress and stirred my cup. Took two samples from top and bottom of the cup. Top one says my extraction yield is %20 but bottom one says it’s %24. Which one should i trust and what is the ideal way to take samples.,1611591359
Coffee,Chi_CoffeeDogLover,l4q4af,Kalita Stainless Steel Wave,"I've been using the Kalita Stainless Steel Wave Dripper for about a year. I have a metal filter I use/reuse with it. I make two or three cups of coffee with it before I dispose of the coffee grounds.

I recently purchased and started using Third Wave Water for the first time. I have enjoyed it. 

When using Third Wave Water with the Kalita I can only get 1 cup of coffee before the water stops dripping through. I am for sure using the exact same grind size. What's the deal? What do I need to adjust? Grind size? Only 1-cup? Not metal filter?",1611588658
Coffee,filipovicphilipp,l4ppnm,The coffe is drinking temperature for those who ask,,1611587459
