subreddit,author,id,title,selftext,created_utc
Coffee,roasterbob,l6iksf,Coffees subscription plan management,[removed],1611792854
Coffee,CorrectMySwedish,l6hngz,Coffee reset and decaffeinated coffee,[removed],1611790211
Coffee,MickeyTheKid,l6h1wg,Failed Bunn gasket - help me find it to order it please!,,1611788648
Coffee,Alex_Sethness,l6f718,Good decaf recommendations?,[removed],1611783868
Coffee,Miserable_Pin3022,l6f0s5,Coffee Lover?,,1611783442
Coffee,Icarus3000,l6eunk,"Saeco Royal - Difference between ""Coffee"" ""American Coffee"" and ""Long Coffee"" ?",[removed],1611783064
Coffee,bush_animal,l6ercq,Coffee jobs in San Francisco?,"Hey all, recently moved to Mission District in SF and am looking for a part-time job in coffee service (brewing or roasting). I know it's a long shot, but if anyone lives here and has any tips or leads they'd be willing to share, I would be so grateful. I checked out the Fellow shop on Valencia to ask for local leads, but it looks like they recently shut down for an extended period of time. Not sure where else to look! Thanks!",1611782806
Coffee,thenewfrontiersman88,l6ekhr,Can I get recommendations on dark roast beans for my lady friend?,[removed],1611782147
Coffee,bentaylor29,l6eizu,Help with a V60,[removed],1611781998
Coffee,MOOPY1973,l6dvhs,Loving the smell of freshly ground coffee,"This feels like an obvious realization, but I got a grinder for the first time for Christmas and I’ve realized how much of the delicious smell I’ve associated with coffee shops comes from them grinding rather than brewing coffee. Of course freshly brewed coffee also smells great, but some of my favorite parts of the day now are grinding coffee for the morning and afternoon cups. Thanks to everyone here for the posts that convinced me to finally get a grinder and bring this wonderful smell into my life.",1611780016
Coffee,markvanlan,l6dmg8,How much is my Drift magazine collection worth?,[removed],1611779296
Coffee,[deleted],l6dikz,How much is my Drift collection worth?,[deleted],1611778997
Coffee,[deleted],l6ciat,Moccamaster sale prices,,1611776363
Coffee,jamieandrew,l6cbv9,grind size for drip coffee and grams to ml of water ratio?,[removed],1611775649
Coffee,StBernardusAbt12,l6bonf,Modding Mazzer Super Jolly for Pour Over,"Upside of one of my local coffee spots closing down is that they're liquidating their equipment. $100 Mazzer Super Jolly. Less than I paid for my current grinder, the Baratza Encore. Biggest downside I can see is that the Super Jolly really is geared towards espresso.

In our house we brew mostly Pour Over, with the occasional Aeropress and French press. Are there any mods for the Super Jolly that could make it more suitable for what we brew? I already know that I'm going to want to mod it to be doser-less.",1611773568
Coffee,andrei-dreamwhale,l6b601,"Specialty Coffee scene in Lisbon &amp; Porto, Portugal","Hey guys,

Based on brief browsing I've noticed that the subject had been popping up, but never properly developed, so I thought it's worth giving it a shot again.

Despite strong scepticism, specialty coffee scene that was believed to be obsolete, has not only survived but kept evolving and growing stronger. Although it still is a miserably small share of the market in comparison with local commercial leather-n-coal robusta dealers, some things started happening: 2 Aeropress Competitions, a Coffee Festival where specialty roasters were given a ground next to big players, chain specialty coffeeshops, an actual stable coffee community, and 2 completely different coffee capitals - turf-obsessed Lisbon and welcoming laid-back Porto.

To kickstart the thread I'll just go with my Lisbon favorites:

* [Roastberry Coffee Lab](https://roastberry.pt/en/product-category/shop/cafe/) \- reliable roasting consistency, Q-grader on board, great bean selection, got their CoE El Salvador - was a tropical banger, also had another gem from El Salvador - natural SL28.
* Olisipo - know them personally, a sweet team of two. Great roast, good converstions, impressive selection.
* Wow Coffee Roasters - a tad cringy name hides awfully good bean selection.
* Brava, Sgt Martinho, Academia de Cafe, Fabrica, etc.

And those would be just the roasting companies - there are dozens of new specialty/3rd wave coffeeshops that have opened over last 3 years representing either the local or european roasters.

Things are happening and it would be cool to see what you guys think. Cheers!",1611772148
Coffee,hlvd,l6amd2,Full Bodied Coffee Aeropress?,"I love the full bodied coffee made through a French Press but can’t seem to replicate that using an Aeropress?

Whenever I try the Aeropress the coffee always tastes too refined(like tea) rather than the full bodied fuller tasting coffee from a French Press.

I’ve tried the standard and inverted method but it just doesn’t taste as good?

I’m prepared to accept it’s my taste in coffee that’s unrefined and not the fault of the Aeropress, any suggestions?",1611770763
Coffee,Eggmcmuffin098,l6adl9,Does anyone else have “puffy” k cups? I haven’t noticed it before and I’m wondering if they’re still safe to consume!,,1611770202
Coffee,RagequitterForHire,l6a8f6,Green Coffee brews,Thoughts on green coffee and related brews?,1611769845
Coffee,ttyy2000,l69jps,"If you had any amount of money to spend on a bar(commercial), what would be the one you would buy and why? This is mine.",,1611768174
Coffee,darkerdays1,l68v8j,Question - coffee makers,"I apologize If this post is an allowed but I thought I’d come to the experts.  

While I am not as much of a coffee enthusiast as you guys are, I thought maybe you guys can suggest a coffee pot for my needs. 

I’m looking for a coffee pot that has an actual pot but also has a single serving cup dispenser and also has the ability to make cappuccinos and espressos.  Preferably not with a K cup or any kind of packaging that I have to purchase from the manufacturer.  Programmable would be preferred.

I keep finding ones that has all but one of the features I’m looking for.  We drink about a cup of coffee a day each but the trips to Starbucks and Dunkin are getting too expensive so I’m hoping to replace the trips with my own maker.",1611766559
Coffee,jeremy1187,l68sls,Coffee bag weight/amount discrepancy? I always buy 12oz bags of whole bean and most of the time the weight is labeled 12oz/340g. This recent bag I bought is labeled 12oz/240g. 12oz to grams is 340.194 but when I weighed the bag it came out to 354.0 I assume the bag doesn't weigh 14 grams.,,1611766381
Coffee,ssam_c_u_later,l68kka,Flair royal vs comandante c40,"Hello everyone,
I just got a flair classic manual espresso maker, but my coffee grinder doesn’t grind fine enough for good espresso shots. Just very sour shots. I’m debating wether i should get the comandante or flair’s grinder. Does anyone have experience grinding for espresso with either? Both? Any information will he helpful thank you! 

(Current grinder is an oxo barista brain I got as a birthday gift)",1611765809
Coffee,stusef,l68292,Issues at Bodum?,"Hey guys, I'm new here. My fiance and I recently purchased an $80 Bodum coffee grinder that didn't work at all, out of the box. We tried contacting Bodum over a dozen times to troubleshoot or get a refund, and they've been ignoring us. Is Bodum known for poor customer service, or is this a recent development? Has anyone had luck resolving issues with Bodum products through their customer service department?",1611764559
Coffee,AdventureCity,l67gk3,Thoughts on Spong for drip coffee,"Hello :)

I recently got an awesome deal on a MoccaMaster and I’m looking for a coffee grinder to pair it with (preferably manual)

I came across a Spong and did some reading, but the literature says it grinds “way too fine” for drip coffee.

Does that mean I shouldn’t buy the Spong?",1611763030
Coffee,MarisaMerriweather,l67d1u,Different ways to brew coffee and the various tools to brew it,"Coffee is a widely known beverage around that gives comfort to millions of people around the globe. There are many ways to prepare coffee, but the basic gist is that it is prepared by brewing coffee beans. Today we will talk about the different ways to brew coffee and the various tools to brew it.


1) Brewing Through Steeping


2) Soft Brew


3) French Press


4) Brewing Through Pressure


5) Moka Pot


6) Espresso Machine


7) Aeropress


8) Brewing Through Dripping and Filters


For more detail you can read [this article](https://www.ihighfive.com/lifestyle/8-ways-to-brew-coffee/) 


Did you brew any of them before and what was your experience?",1611762765
Coffee,hunnangelx3,l67611,Steam wand splash guard?,Hey y’all! I bought the Breville Bambino Plus a while back and noticed (as reviews have correctly pointed out) that the steam wand can get quite messy. Is there a splash guard or something similar that would minimize the splashing (especially when the wand is self-rinsing after frothing) or is it a lost cause and just a reality I’ll have to deal with? Any suggestions welcome. Thanks!,1611762262
Coffee,Homegrounds,l66mfa,How to Make Iced Coffee with Keurig,,1611760766
Coffee,sunsetkiwi1,l66heh,NEED LATTE ADVICE ASAP!,"It’s my first time getting a latte today, I have a free reward from wawa. I’m excited but it has to be good. So here’s some of my questions for you coffee fanatics. 

Would you recommend getting it hot or iced?
I’m not a fan of whole milk, is skim milk okay?
Does it taste good without any flavor syrups?

THANK YOU IN ADVANCE!",1611760387
Coffee,hhgla777,l6648v,Wife and I like different coffee,"I was hoping y’all could help me out in this situation.

tl;dr // wife and I have different coffee preferences, but only drink about a cup or two each. Best solution to make both in the morning? Equipment list at bottom. 

My wife is very new to coffee and is hesitant to venture out from Starbucks Veranda Blend. I’m super excited that she is getting interested in it! I really don’t have a roast preference, but I know enough about coffee to know that pre ground Starbucks coffee doesn’t really compare to specialty whole beans, which is what I normally get. She only drinks one cup, and I typically brew 4 cups in a bonavita brewer. 

What would be the best way to make coffee for both of us in the morning to have the kind we prefer? I added a list of the equipment I have for options. 

Equipment I have:
- Chemex, 3 and 6 cup
- French press, 3 and 8 cup
- Bonavita 8 cup one touch coffee maker
- Moka Pot (that I’m not very experienced with)
- Chemex Chettle 
- OXO grinder with scale
- Hario scale

Thanks in advance!",1611759397
Coffee,johnzrxx,l5hhp8,Are we expected to get sediment in our coffee from French Press?,"I'm new to French Press coming from instant coffee drinker.

I am doing the Hoffmann's French Press technique and I found this results in way lesser sediment present in my coffee compared to while I use the traditional-plunge-all-the-way-down method, but it's still not 100% silt free as there are still some at the bottom of my cup.

Is this normal that no matter what technique, French Press will always have some sediments or I'm just not brewing with French Press correctly/perfectly? 

Any tips and guidance are greatly welcomed as I'm a beginner on this subject matter",1611678478
Coffee,Thommer11,l5hgtu,Upgraded to this today (from Nespresso) - any must know tips/tricks?,,1611678403
Coffee,ame519,l5gtg5,Tired of making my roommates flash brew,"I've been making flash brew daily for almost a year. My roommates and I love it, but it's a bit too time consuming to make 3-4 cups of it every day.

Decided to start making cold brew to have in the house. I bought the [Primula Burke](https://www.amazon.com/Primula-Burke-Cold-Coffee-Maker/dp/B0711WZ7S7/?th=1) (Wired's [recommendation](https://www.wired.com/story/best-cold-brew-coffee-makers/)) and a bit confused on where to start.  


* **Ratios?** I see as low as 4:1 and high as 8:1. Does cold brew require *that much* more coffee than a typical \~16:1 for pour-over? 
* **Concentrate?** Some people reference the resulting product as concentrate, others as ready-to-drink. What is the deciding factor here – ratio or preference? Not a fan of adding water to taste to my brew.
* **Pro tips?** Any and all appreciated!",1611676597
Coffee,Fair-Abbreviations36,l5gpkb,Coffee recommendations?,"Recently got a French press!  Looking for some coffee beans (whole) that’s a step up from maxwells and Folgers lol 

But still easy to find and nothing to expensive.",1611676276
Coffee,marcotto94,l5gpjw,"What difficulties do you usually encounter when searching, learning about and buying specialty coffee online?","In recent months I have bought specialty coffees online from different roasters and tried to discover new brands and coffees. Sometimes this process was not easy and took a lot of time. What do you think? When you searched and bought specialty coffee online, what dissatisfactions did you have? What would you have wanted different? I would like to know what the community thinks about this. Thank you!",1611676275
Coffee,Vela102,l5gkzl,Gaggia classic leaking in these spots. What's the problem? Just bought it second hand..,,1611675898
Coffee,harpua_dog,l5ghqd,Bonavita drip woes,"Greetings sub, I’m not a regular coffee subreddit guy so my apologies if this belongs in the Daily Thread.

I’ve had a Bonavita BV-1800-TH for 6 years now and it’s a great machine - usually. Every 2-4 months or so it decides to overflow and make coffee all over my kitchen. Over the years, I’ve discovered many “solutions” to this issue: less water, less coffee, carefully filling the basket ensuring no grounds get under the filter cone, different brands of coffee, different grinds (currently 22 on the Baratza Encore grinder)... my theory is the coffee is blooming up in the basket and floating up and over the paper filter then clogging the basket hole. Thinking it was the excessive bloom of freshly ground coffee, I’ve taken to pre-grinding a week or so of coffee and storing that in an airtight container. This appeared to work for a while, but, like all my solutions, it always ends in a counter full of coffee and grounds.

The only foolproof safe method for me is to stop the machine about halfway through its cycle, wait a few minutes, then continue. Of course, I am very lazy and would prefer not to babysit the machine every brew.

Is this a known issue with this machine? Are there other quality drip machines that deal with bloom better? This machine makes great coffee and I still like it despite the bi-monthly coffee floods, but I’m willing to spend more money now to fix the issue if there are alternatives. Thanks for any recommendations on preventing overflow and/or other machines.",1611675638
Coffee,Florielora,l5g3j2,Vietnamese coffee kit for multiple cups?,"LF recommendations for a Vietnamese phin &amp; carafe set that can be ordered online and shipped to Canada for making at least 700mL of coffee? I want something pleasing to the eye to keep on the counter for daily use.  I found a matching set that was unfortunately sold out (link below) 

[Vietnamese Coffee Kit](https://www.caphecoffeehouse.com/vietnamese-coffee-kits/p/vietnamese-coffee-kits-03)",1611674480
Coffee,ikari-san,l5f5bm,Question regarding Delonghi Dedica EC 685.bk - temperature is to low?,"I recently bought this starting machine for my home ussage and i was impressed at 1st a lot. At first we used it mostly to make cappucino/white coffee so using hot milk masked the problem. But now i started to go for americano and i was concerned about temp. of the coffee itself. I just ""slightly"" hot.

I used electronic food temp. to check the temp of the brew and : after warming up the mug with very warm/boiling water, using machine 3-4 times to make it warm and setting up internal temp to highest my brew is 65-66 C.

I know that temp of water should be around 90 and also know that it will be temp in the internal boiler but still i think the temp is to low. Should send it to repair or that style of machines ""home style"" produce such temps.",1611671560
Coffee,Nizzzlle,l5eqsz,Absolute mood today,,1611670248
Coffee,NameIdeas,l5e4ja,Morning Coffee Routines...what does it look like for us?,"Happy Morning r/coffee!  I've been thinking of modifying my coffee brewing, and I also know there are some limitations to my system.  I have two small children.  Our normal routine is waking up around 5:45/6:00.  We wake up the boys and help them get ready (they are 6 and 2) around 6:30.  Between managing a six year old who occasionally does not wish to brush his teeth and wrangling clothes on the 2 year old, while my wife does make-up in the morning, I have little time for coffee.

Typically, I grind up our beans (buy them from a local roaster) and put them in our Keurig.  I grind about two scoops per 10 cups of water.  

I see several folks who seem to have a more definitive, full routine.  I'd like to add some coffee enjoyment to my weekend (when I have more time) and perhaps brew in a different way to see if the flavor changes and I get more out of my coffee.

I'd love to hear your morning brew routine.  Get as detailed as you'd like.",1611668224
Coffee,SuperSmudge90,l5e0so,DeLonghi Ecam ?Leak?,"Hi, 

Sorry if this shouldn't be posted here. 

I have a DeLonghi ECAM 23.42x. I keep.finding a small amount of water on the counter underneath the machine, possibly coming from underneath the small red condenser tray behind the drip tray. 

I assume this shouldn't happen? Any ideas or advice.

Thanks",1611667863
Coffee,MsDragonFruit,l5dplz,Best Pour-Over recipe?,"I've been struggling to pick a pour-over recipe, there are so many on the internet, and I've tried a couple but I'm still learning and not entirely sure I'm doing it right!

I guess I was wondering if there was a sort of baseline method that I could use to at least understand what the coffee is supposed to taste like, and then I could move into more advanced brewing methods.

&amp;#x200B;

Also kind of off tangent, do any of you avid coffee drinkers have the gene that means you can't taste bitter foods/drinks? I also struggle knowing if I made my coffee right because I can't really taste if it's bitter, but when I give it to my boyfriend he says it's SUPER bitter.",1611666717
Coffee,tastedeadkiller,l5d04n,French Press Technique Recommendations,"Hey everybody, I recently started making french press coffee and tried  James Hoffman's recipe. Even though it tasted well, I wonder how do you make your coffee with a french press. I am open to any suggestions, thanks in advance :)",1611664063
Coffee,teyyaredenkahve,l5co4r,Espresso Pressure Profiling with Cafelat Robot - Any advice?,"I recently try cafelat robot barista and working on pressure profiling. 

My typical parameters are:

* 16 grams coffee
* 36-40 grams of espresso

my method is as follows:

* Pre-infusion at \~2 bar  , 10-15 sec
* Ramp up to 8 bar 
* Keep there (as much as possible)
* Finish

Please see pressure vs time plot below. It is almost correct. There may be small up and downs for sure.

For those who are familiar with espresso and pressure profiling, do you recommend any change in my method? 

&amp;#x200B;

https://preview.redd.it/kfl7giky2od61.jpg?width=1304&amp;format=pjpg&amp;auto=webp&amp;s=8d5cb9dcbbdf9fbd863fa921b7c1ba0eddb6e05a",1611662707
Coffee,menschmaschine5,l5brz3,[MOD] The Daily Question Thread," 

Welcome to the daily [/r/Coffee](https://www.reddit.com/r/Coffee) question thread!

There are no stupid questions here, ask a question and get an answer! We all have to start somewhere and sometimes it is hard to figure out just what you are doing right or doing wrong. Luckily, the [/r/Coffee](https://www.reddit.com/r/Coffee) community loves to help out.

Do you have a question about how to use a specific piece of gear? Want to know how much coffee you should use or how you should grind it? Not sure about how much water you should use or how hot it should be? Wondering about your coffee's shelf life?

Don't forget to use the resources in our [wiki](http://www.reddit.com/r/Coffee/wiki)! We have some great starter guides on our [wiki ""Guides"" page](https://www.reddit.com/r/Coffee/wiki/guides) and [here is the wiki ""Gear By Price"" page](http://www.reddit.com/r/Coffee/wiki/gear#wiki_coffee_gear_suggestions) if you'd like to see coffee gear that [/r/Coffee](https://www.reddit.com/r/Coffee) members recommend.

As always, be nice!",1611658813
Coffee,nealius,l5bjue,Hoffman's French Press technique not working for me...,"I'm normally a V60 guy but I'm trying to revisit French Press for those days where I'm running on brain stem power and don't want to deal with the intricacies of a pourover.

I'm following Hoffman's directions to the letter--just omitting the ""scoop the foam/floaty bits"" part--and it's just not working for me:

1. Silt. He claims to get a ""silt free cup."" 
2. I'm losing an average of 40g of coffee (e.g. 200ml in, 160ml out)
3. Hardly any flavor from either dark or light roasts
4. After pouring the first 100ml or so, the grinds back up against the filter and I have to plunge it all the way down to get the rest out; defeating the purpose of his technique of keeping the filter at the top (the silt also tends to come out in the first 100ml)

His video was quite lacking in detail compared to his V60 video, and leaves me a bit confused on some parts. Are there any other tips for getting a good French Press brew?",1611657774
Coffee,Secret_Client,l5b9ig,Coffee makes you awake and fresh,,1611656380
Coffee,StillPackage4369,l5a2qr,Tasty coffee,"I am a coffee noob. How do I make coffee with caffeine but without the standard coffee taste (not sour, awful tasting)?",1611651135
Coffee,elephantsky,l59c4e,Dissolving Coffee,"Hi! Is there a way to dissolve grounded coffee like that of instant coffee? I'm currently in the business of selling whole and ground coffee but I've received a handful of inquiries of my coffee could be easily dissolved in water like those instant 3-in-1 packs. I don't know if that's even possible so for the mean time, I came up with releasing X Drip Bags so make brewing a little bit easier and faster for customers.",1611647926
Coffee,ArcticSnow87,l588p4,For anyone that owns a single serve coffee maker..,"Mine has been acting extremely weird as I try to brew a cup of coffee, and nowhere in the instructions can I find anything to help troubleshoot the issue.

I own a basic Farberware Single Serve maker that is versatile in the fact that it can make either ground coffee or K cups

Thing is, every time I try brewing now, the machine doesn’t seem like it pumps water out the way it’s supposed to, and it ends up steaming really badly without pouring anything. It’s bad to the point I worry sometimes that it is a fire hazard.

So for anyone more adept into the world of coffee than I am (I’ve only had my own personal coffee maker for a month), any and all advice on solving the problem is welcome. Thanks in advance, I appreciate your time.",1611643258
Coffee,DrSteveBrule___,l56bmg,Strongest brand of coffee?,,1611635879
Coffee,number-3-pencil,l5565p,where to fine Comandante c40 in U.S?,been wanting to upgrade my grinder and the comandante seems perfect but its sold out everywhere except a sketchy website called my coffee tools with a suspicious payment process. theyre a verified seller on comandante website but its weird how they work. any response appreciated,1611631881
Coffee,pokaipokai,l554ys,Fellow Ode bought this week - stalling/clogging with Kalita Wave,"I just received my fellow ode from Prima Coffee this week. Set the dial to 3-4 range and tried my usual brewing method. Noticed tons of stalling during extraction and the brews come out pretty ""bitter"". Even at 6-7 range, the bitterness is less noticeable but feels overextracted. Not entirely sure about the reports of grind size being too coarse. 

Noticed a similar thread but this one is about V60. 

[https://www.reddit.com/r/Coffee/comments/kivafd/fellow\_odev60\_brew\_seems\_like\_its\_always\_choking/](https://www.reddit.com/r/Coffee/comments/kivafd/fellow_odev60_brew_seems_like_its_always_choking/)

\---

I've done 12 grams:200 ml at 95-98C. add 30 g--&gt;  70 g  --&gt; 60 g --&gt; 60 g. Each step done in 30 second increment. Using Fellow EKG Stagg EKG kettle. Kalita 185 steel with Wave white filters bought from Japan. Water is Arrowhead Spring water. 

Beans I tried so far:   
• Heart Stereo blend (yeah , I know it's  better for espresso)  
• Verve Ethiopia Worka single origin. 

Both roasted in the past three weeks.

Questions:   
\- Is this a lemon and worth returning?   
\- Has anyone experienced this? 

Thanks.",1611631769
Coffee,raygun631,l5519k,Do k cups have additives besides coffee?,"They brew fast, and are flavorful - but a buddy of mine (a French press guy) says there are additives in the k cups for longer shelf life and flavor.  Is there any truth to that?

FYI - not looking for rants or opinions, if you don't know that is ok, I am just curious.",1611631407
Coffee,MeagerZombi,l54yty,The bare minimum espresso machine?,"Exactly the title, Im looking for the cheapest possible espresso machine that can still make good espresso. I tried searching myself but answers seem to vary greatly. Some people say 200 usd is enough, some 350, and other say 500+. I want something that will make something enjoyable but I don't want to go all out on my first machine.",1611631179
