subreddit,author,id,title,selftext,created_utc
Coffee,HiTek_142857,l4p7tk,Brewing coffee with the teabag method?,"I've read that you can brew coffee by taking a filter, filling it with coffee grounds, then closing it and using it as a teabag. That sounds rather inefficient, has anyone of you tried it? I am experimenting with brewing beans lately out of boredom but sometimes I ended up just making plain awful coffee and wasting beans and idk if this is one worthy method.",1611585963
Coffee,Soflysohigh_,l4oz36,I had the opportunity of visiting my aunt who lives a coffee estate. It was surreal.,,1611585165
Coffee,GuyLeDoucheTV,l4o65a,Breville Barista Express - Dual wall basket - pucks won't come out,"Hey guys,

I just got a BBE and am enjoying it so far. I started with the non-pressurized basket to explore a bit, but after doing what I thought was exactly the same thing twice, and having two drastically different shots come out, I decided to go to the pressurized basket and see the difference. I'm liking it, it irons out all of my flaws and it seemingly doesn't matter what I do... They all taste pretty good.

The one issue I have with the pressurized basket is that the puck is so stuck in there I can't bang it out and have to use a spoon to get it out. This never happened with the shots I used the non-pressurized basket on. I tried putting a lot less ground coffee in to the basket, thinking this might be the problem, but no, its just a much wetter puck that is still super stuck in there. Is this a common thing with pressurized baskets, and what can I do to fix this? Or should I just get used to spooning it out of the basket?

Thanks",1611582465
Coffee,JSmurfington,l4nr25,How much coffee do you typically waste dialing in a bag for espresso?,"It pains me how much I waste trying to dial in. Sometimes I'm lucky and it only takes a cup or two wasted. Other times, it's 3-4 cups. Plus now I upgraded to an electric grinder from a manual grinder and apparently I'm only supposed to adjust the grind finer while it's running. So that can be another cup or so wasted.

Burning through 25% of the ($15) bag just to get it right kills me! I usually end up drinking the ""close"" shots anyway just to prolong the bag. I'm curious how much everyone else here typically goes through for an average bag?",1611580959
