subreddit,author,id,title,selftext,created_utc
tea,shawnclown,ky5l75,This tea is so yummy I ordered a 4 oz. In It but is kinda hard to drink with my messed up tooth,,1610749804
tea,puerh_lover,ky5l5g,If you've got your kettle on right now and you want to join us for tea we are having a live tea invterview with Oolong Owl. It's gonna be a lot of fun! &lt;3,You can join us here right now: https://youtu.be/fQfx2jL9hWc,1610749801
tea,citykitty1729,ky57w6,Proper Usage of Vintage Teapot?,"I have a vintage teapot and some vintage (presumably collector's / decorative) fine teacups from my grandmother. I've kept them safe for many years, but unfortunately, I never really learned how to use them properly.

I could see if any of the individual cups / saucers might be worth reselling, but I'd much rather enjoy using them. Even though I wasn't allowed to touch them as a child, I think my grandmother would smile to see me enjoying tea in her teapot and teacups. :)

Before I just pour hot water and tea leaves or tea bags into potentially fine china, are there precautions I should take? I've seen suggestions for a ""warm rise"", not that I have any idea what that means, sadly. I have a modern stovetop tea kettle that whistles when the water boils - but I'm guessing that temperature would be too hot to pour into fragile, vintage bone china. (I'm not sure about the teapot, but at least one cup / saucer set is labeled ""bone china"".)

Any resources or advice you can offer a novice to the world of vintage teapots / tea sets? TIA! &lt;3 (My Google search terms are yielding mostly unrelated links...)",1610748687
tea,Nakedkill,ky56q2,Newbie with questions about oolong,"I bought some oolong tea, wanted to try something new from my genmaicha. I got some loose leaf that is fairly dark green and coiled. I prepared it in a simple way and could not get any flavor or taste.

I youtubed some gongfu tutorials and brewed it several time. I was able to get a bit of aroma, but tasted basically like water.

Does oolong when prepared correctly and of decently quality usually have flavor? Maybe I bought poor quality?

I'm definitely not very experienced in preparing tea but I would think I would have found a decent improvement. Or is oolong a very bland tea?",1610748585
tea,gxace,ky4h8m,Love the contrast of Gua Pian in this Kyusu.,,1610746529
tea,LeoSpringfield,ky4d6u,"清水焼の天目! A dream come true! I'm now a proud owner of a tenmoku chawan :) I'm a sucker for this shape, and somehow I just love the tenmoku chawan more than a tenmoku teacup. It sits perfectly in my palm. A bit small, but quite delicate.",,1610746205
tea,MikeyMalibu,ky4awu,Free Shipping?,"Hello,

I am looking for suppliers that offer free shipping right now, I have been trying different teas lately and this helps me with my options as I find out what I enjoy.

Been interested in white teas and Japanese greens lately if this helps but any site that offers free shipping would be helpful right now. Any recommendations?",1610746016
tea,smkscrn,ky44mw,Fictional books that feature tea,Can anyone recommend a work of fiction that heavily featured tea? Bonus points for multiple types of tea. Any genre.,1610745515
tea,recipesh365,ky3myb,"Natural Tea for Bronchitis acuta,traheobronchitis acuta that helps 100%",,1610744136
tea,Efflux,ky3lgt,Let's see whats in the first ever DAVIDsTEA subscription box.,,1610744026
tea,mydadjokereligion,ky2s6c,I want advice on getting more immersed into tea and tea culture,"I have been drinking specialty tea for about a little over a year now and it has changed my life. I found specialty tea through the youtube channel Alex French Guy Cooking when he did an episode with Don from Meileaf. The only tea I had experienced up to that point was tea bags and although I loved them I would only drink it for the light caffeine pick me up. This video started my new hobby / borderline obsession with tea.

When the pandemic began I coped through tea, it helped me feel connected to the world by learning how it was produced and the attention and care that went into it. My college used to offer a course on tea and tea culture but unfortunately it does not anymore and I was wondering if there were any online courses that I could take that could give me a detailed, unbiased education on tea (I absolutely love meileaf videos but at the end of the day they are still trying to sell me a product) 

Any suggestions would be greatly appreciated, including books and podcasts as well! This is my first post in this community even though I've been lurking for quite some time now so I hope I'm not breaking any rules. 

(Also if anyone would like to share how they got introduced to tea I would love to hear it!)",1610741645
tea,rosehamler,ky1nze,Electric kettle recommendation?,"I am looking for an electric kettle that will keep the whole pot warm for a couple hours. I also need it to be tea friendly and not just able to heat water. 

I am getting out of bed way too often to heat up cups of tea in the microwave and waking everyone up lol.",1610738440
tea,smileyzz5,ky0wpo,I got my first ever tea set for Christmas this year,,1610736282
tea,MMinthemirror,ky0qax,"Just after Google got cute audio and graphics for ""tea"" timers, it started naming my tea timers ""t"" and it's all gone",,1610735789
tea,roythunder1996,ky05qo,What is this tea called I got it from China and it’s came in a black box with a giant building on it,,1610734186
tea,cirousitea,kxzyd9,Matcha Kit,"hi all, 

any recommendations on matcha starter kits? i know davidstea and harney &amp; sons have some but was wondering if there were other, potentially better (and more aesthetically pleasing) versions out there. 

thanks in advance!",1610733628
tea,dota2nub,kxzvji,Tea from Ali Express,"Does anybody have a quick guide to buying tea on Ali Express? There's cheap stuff there so obviously there's gonna be bad tea, but I'm sure there's some reputable sellers on there. Can anybody help me out? 

I'm looking for Chinese teas, green, white, and black.

The good stuff. You guys know what I'm talking about.",1610733413
tea,Justaberry,kxzq6q,Decaf Smoked Tea?,"Hi y’all! I was wondering if anyone knew of any decaf smoked teas? I’ve been trying to find some but with no luck. I’d also be open to trying to smoke my own, but I’m having a hard time finding resources for how to do it. Anyone have any tips on either? Thanks!",1610732989
tea,totehure,kxyylz,just had a red tea called red almond but i cant find any info on it,"it was from a random coffee place, i don't know much about tea so sorry if this is dump, i just really liked it and want to find more info on it so i can get more.

&amp;#x200B;

it was red and had a rich almond taste, (it wasn't milk tea or anything like that )",1610730913
tea,[deleted],kxyu5a,A cup of Winter Chai from Tea forte in a comfy animal mug to celebrate a surprise day off!,[deleted],1610730564
tea,Azuriahm,kxyq25,My first order with whispering pines. Everything looks great!!,,1610730246
tea,LSACmakinmecrazy,kxy19x,Shout out to great vendors,"I don’t know if this is against the rules (if so, please delete and accept my apologies). I just wanted to give a huge shoutout to vendors who go above and beyond to be helpful and fair during what must be a difficult time in their businesses.

I placed an order late November that the postal service in China kept sending back for security reasons. I had been in touch with the vendor and told them I understood the challenges and was willing to wait. Another month went by and the package still kept circling back around. Finally realized it just wasn’t meant to be and emailed last night. Received a refund within 12 hours and agreed that if the tea ever showed up I would send payment. Will definitely attempt to do business with this person again. 

Then I come to this subreddit and see a business helping a new aficionado with helpful brewing tips on an order. 

Just gives me the warm and fuzzies.

Edited to add...I didn’t say the name of the vendor I worked with in case it was against rules. If it’s ok to share, I will.",1610728297
tea,Secret_Client,kxx3lk,No Diet Needed,,1610725577
tea,Syth0n,kxwxrq,Question about brewing,What method of brewing leaves a few tea leafs in the cup? I normally use a tea strainer but I'm curious as to what method is normally used that leaves behind a few leafs,1610725086
tea,loveyoulog,kxwd90,Teaware?,Where do I find the good affordable teaware for purchase online?,1610723349
tea,Lowcrawling_Kat,kxvnz7,Drinking some 2019 Love is all you need,,1610721176
tea,Lowcrawling_Kat,kxvnwb,Drinking some 2019 Love is all you need,,1610721171
tea,shadowcat20,kxuycp,Best brand of loose leaf tea?,"I’ve been getting more and more into drinking tea, all kinds for different benefits. I was wondering what is the best brand of loose leaf tea I could purchase online ?",1610718847
tea,life_reactor,kxuhoe,Where can I get good tea in the Netherlands (Ordering is preference),"Hello,

I drink Simon Levelt currently, but I know they are not the best. I would like to try some other teas. Sadly due to brexit I cannot order anymore from where I did order before. Since taxes will hit me now.... 

I especially like green tea but also want to exerpiment with pu erh teas and such. Importing from China might be a possiblity as it will be okay as long as I stay under 22 euro's. But ussually that is no problem since they have cheap shipping. With UK orders ussually the shipping already hammers the price into above 22 euro's. 

If there is good places in the Netherlands I would like to know as well.

Thanks :)",1610717216
tea,TgaDalo9,kxufjp,4 Types of Indian Tea,"Just like in other countries, Tea is a significant and very popular beverage in India. In fact, India is probably one of the most leading countries that produce Tea today. They also have a wide variety of different teas that originate from their country that they export and supply globally. The bustling tea business is both big and small, as Tea is something you can find everywhere locally in India, and globally buy Tea from India. But what exactly are Indian teas? Keep reading if you want to find out!


1. Chai Tea


2. Darjeeling Tea


3. Assam Tea


4. Nilgiri Tea


Source : You can see more detail in [this article](https://www.ihighfive.com/lifestyle/4-types-of-indian-tea/)


Did you try any of them before? and if you can share your experience here",1610716991
tea,MacaroniBee,kxu391,Anybody know when Den's tea is bringing back their Sakura Sencha?,I got a tin of it last year and just looooved it. Just wondering if anybody knows when they'll offer it again? 😏,1610715723
tea,rmoody23456,kxtvoz,Pittsburgh Breakfast Tea is really good. I received it during a Christmas gift swap in my FB tea group. This black tea has a delightful flavor note that I can’t determine. Definitely going to find out where it was purchased to buy more.,,1610714920
tea,parakeetweet,kxtks4,How to start drinking pu-er?,"Hi everyone!

I'm a long time connoisseur of regular black &amp; green teas, mostly black, both plain leaf and blends. I want to start refining my palate so-to-speak and try pu-er's out, but I'm not exactly sure where to begin, since there are *so many*, and I don't want to risk buying a huge round block if I don't know I'll like it. Do y'all have any suggestions on where to start?",1610713635
tea,Hmremix,kxtfp2,Seeing Green: Your Guide to the Best Green Tea,,1610713045
tea,AutoModerator,kxt6bl,"What's in your cup? Daily discussion, questions and stories - January 15, 2021","What are you drinking today?  What questions have been on your mind?  Any stories to share?  And don't worry, no one will make fun of you for what you drink or the questions you ask. 

You can also talk about anything else on your mind, from your specific routine while making tea, or how you've been on an oolong kick lately. Feel free to link to pictures in here, as well.  You can even talk about non-tea related topics; maybe you want advice on a guy/gal, or just to talk about life in general.",1610712021
tea,Worth_Opportunity317,kxr392,Tea and Shred,[removed],1610702566
tea,DerMitDemLangenNamen,kxqyar,What do you guys think about coffee (doesn't matter if if you drink it pure or with milk/sugar/honey/etc.)?,"

[View Poll](https://www.reddit.com/poll/kxqyar)",1610701914
tea,Praelior0,kxqttx,Joining the club!,,1610701360
tea,Astro_Alphard,kxp5ib,Assembled my first tea set!,,1610693549
tea,Astro_Alphard,kxowdb,Made my first tea set out of pieces I liked,,1610692457
tea,CustomACT,kxov14,Help me find this tea set?,"I know just providing a picture makes this a longshot, but I figured I'd give it a try. Any help would be greatly appreciated!

https://preview.redd.it/v4evftthxfb61.jpg?width=4032&amp;format=pjpg&amp;auto=webp&amp;s=7b929e5bf0ee7add09bd33348e03f30047042c92",1610692301
tea,tanukihimself13,kxomts,Best (duck) shit?,"In 2017 I bought my first bag of YS king of duck shit, and I fell in love with it. 2018, same thing, it was just amazing, I dont need to give tasting notes, but yall know it's good. In 2019 I ordered around 100 grams of it because I liked it that much and I had the money to splurge, and it was very lackluster, i was stunned.  Just flat, and no real life to the tea, almost as if I had purchased a knockoff dan cong. I didnt order any last year as I was working thru the 2019 batch, but I'm wondering if anyone else had the same experience?

Mainly, I'd like to ask for suggestions on what other vendor has some good duck shit oolong. I cant pay outrageous prices, but I know it's not cheap, but give me a couple of places that has some good stuff to check out please. And thanks.",1610691342
tea,lixght-,kxohle,Suggestions for melatonin teas?,"I’ve been having insomnia for the past few months and I can’t seem to relax, I feel so restless. Nothing has helped me fall asleep. I’m exhausted everyday and barely get 3/4 hours of sleep..I’ve tried Celestial Seasonings’ Sleepytime, but that has only helped me nap for 30 minutes then I’m up till 4 or 5AM until I pass out from exhaustion. Waking up has been terrible too because I am just so drained. 

Do you guys have any tea suggestions that may help me relax or sleep? It would be greatly appreciated!",1610690749
tea,freemongus,kxn5hc,My new tea cup,,1610685566
tea,dontknowwhattoput23,kxmm4e,"Some nice Sideritis, tastes like home!",,1610683615
tea,historically_nerdy_,kxmhle,Is it too much to ask for a non rusting tea kettle?,"So I've been looking for a small kettle, something like 1.6 quarts and under, but most ones I've looked into say they rust after about a month. :/ 

I don't want to break the bank, looking to spend no more than $35. Is this too much to ask for?",1610683186
tea,astronautry,kxmfzo,Tea recommendations?,"Hi there. I’m a tea noob and I want to branch out. 

I can appreciate the quality in things I eat and drink, so... what do y’all recommend? I quite enjoy a good green tea from the asian market, and I’ve had just about every tea from Twinings that’s on the shelf at my grocer (I’m sure this sub would consider that to be acutely pedestrian). I have a simple gaiwan that I use for loose leaf stuff, but no other special equipment. 

Hit me",1610683029
tea,GuidonBedon,kxm34r,How do I filter tap water?,"I just read that the tea will taste as good as the water you used to brew it. Is that true? If it is, how can I easily filter tap water so that it is good to use to brew my tea. Thank you",1610681755
tea,gwackr,kxly02,My wife's tea nook,,1610681254
tea,Drdunk91,kxlu4b,I’ve been a loose leaf green tea drinker for years. I buy from companies in Japan. I recently found out that i am allergic to caffeine and that is the cause of my headaches. Guess I’m moving to herbal tea. What is you favorite herbal tea? Not picky with flavor.,,1610680879
tea,ImmediateDafuq,kxlpu3,"Impressed by the beautiful packaging from a small tea factory in Darjeeling District, India. Darjeeling as you all know make one of the finest green tea in the world.",,1610680467
tea,Angeltea,kxll4h,Select the teas with machine and then you can see different grade teas.,,1610680013
tea,Space-90,kxkggs,Angry pot,"So, when I boil water in the pot for tea and I empty the water into my cup and put the pot back down, empty, on the burner, it makes a really angry noise, like a creaking ship. Does anyone else notice this?",1610676101
tea,DestructionDragon,kxkf77,Friend helps with tea,,1610676000
tea,AuntieInTraining,kxk0c5,"Just arrived! Excited to steep this Tumeric Ginger Tisane from VAHDAM, Climate Pledge Friendly product from India ❤",,1610674585
tea,EksXxx,kxk06h,Iced oolong tea latte!! So fresh! Finally I can do layers after several attempts. LOL,,1610674572
tea,mike10522,kxjh1i,My tea keeps turning out very watered down.,"By chance the other day I came across a TAZO chai classic tea bag.  I brewed, tried it, learned I really liked it (this exact tea flavor had a bite to it that I didn't like).

&amp;#x200B;

I went to a local shop called the lancaster spice exchange, looked around a little, asked some questions, and left, 4 different blends to try.

&amp;#x200B;

I had this blend, Mint-Chilla Chai-Nilla Tea, I followed instructions to the letter,

&amp;#x200B;

Steep 1 tablespoon in 8 oz of 212 degree water for 5 mins.

&amp;#x200B;

The tea had flavor (smelled REALLY GOOD) but when I tried it was very watered downed.  

&amp;#x200B;

I tried to steep it longer, I tried adding more tea (went as far as adding 2 and 1/4 tablespoons of leaves to 8 oz) and the tea was really watered downed.

&amp;#x200B;

&amp;#x200B;

Since I ran out of that I tried another sample baggie I got,  Lemon drop mate tea, but 2 attempts laters i'm having the same issues.

&amp;#x200B;

&amp;#x200B;

Please can anyone give me some advice, went through the FAQ and a few youtube videos with no luck yet.",1610672767
tea,scarlettewing,kxjde7,"I don’t have a tea problem, honest!",,1610672434
tea,VerdantAquarist,kxj732,Who else does this apply to?,,1610671865
tea,rachachy,kxiyjz,"Hello tea lovers, I am looking for some advice as a newbie.","I recently have been trying to decrease my alcohol intake and have read a lot about how tea can easily become my new nightly ritual. I have been drinking tea bags occasionally to help calm down after work or sometimes on late saturday mornings but I would like to up my game and get into some loose leaf tea! 

I need some recommendations on what types of tea to get (I like herbal teas most days but occasionally could go for a caffeinated green or white tea). I’m not scared of a strong flavor but I do like more earthy flavors over sweet. 

Which brands do you suggest? And what kind of device should I buy to brew? Thanks in advance!",1610671061
tea,VerdantAquarist,kxiwl0,Who else does the apply to??,,1610670879
tea,YoshimiLikesTheDead,kxhfp4,Rest in pieces to my teapot.,,1610666102
tea,Lolo_UK,kxhfdw,Loving this mug warmer. Good bye to cold tea,"After reading a lot of reviews and getting a lot of useful feedback from everyone.

I’ve finally purchased the Cosori mug warmer (including mug), and I highly recommend it to all the tea drinkers out there that get easily distracted like me and end up with cold tea. 

I’ve been using it for the last 3 days and I am pleasantly surprised how effective it is.

Anyone that’s used a hotpot machine or familiar with an induction hob can expect these mug warmers to get pretty hot. I’ve had my cup on the provided stainless steel cup for like nearly 3hrs straight and it kept my tea perfectly warm at the desired temperature (70c for me) But can be adjusted  anywhere from min 25c to max 110c . It heats up pretty quickly. It just heats up even without anything placed on top.

Also be aware the heat does go through to the bottom of the device and I've noticed my desk getting slightly warm, so I've placed some heat proof mats just incase it damages my desk. 

As the provided cup is metal, if you kept it heated for too long it does make it too hot for the lip, so just need to be careful and turn it down abit if its scorching. 

I’ve tried using my own ceramic mugs that is not flat base and it works. It can keep the tea warm but you really have to turn it up to make up for the heat its losing, if you have a lid it helps. 

Overall I highly recommend it. 

[Mug warmer from Cosori](https://preview.redd.it/lx4jz1m7mdb61.jpg?width=2268&amp;format=pjpg&amp;auto=webp&amp;s=407341e55e509c07c41dde1c6a0b9c724086109c)",1610666073
tea,D74hruN,kxhahj,Cast Iron Teapot - leaching?,"I have a modest cast iron Back-Handle Teapot that I have been using for years.   
Recently, if brewed tea (green or oolong) is left in the pot, after cooling it seems to be color it black. I haven't changed my brewing habits.   
Wondering if anyone has experience with this and can identify what might be happening here.",1610665686
tea,3rdbluemoon,kxgt1t,When you have to work for your tea,,1610664302
tea,AnorexicOctopus,kxf67t,I just bought this super cute tea dispenser! It also matches the cup!!!,,1610659517
tea,MellifluousPenguin,kxefpd,Can someone help identifying those teas ? Thanks !,,1610657356
tea,Hmremix,kxe4a0,Tea makes work a little more bearable!,,1610656399
tea,hedgehog35,kxcgy6,Lavender buttercream makes for a very relaxing time &lt;3,,1610651640
tea,BringYourOwnBear,kxcaoc,Today's find,,1610651141
tea,Astonishing1928,kx9brn,First cup of ceremonial organic matcha,,1610642683
tea,CafeRacer6,kx91bo,Any suggestions for different tea blends?,"I like getting some loose leaf, usually Assam’s Choice, and blending it with other ingredients. The last one I did was with a bit of licorice root, which was the most interesting flavor profile I’ve had in a while. Anybody else mess around with their teas to explore flavors? Have any suggestions on what blends well?",1610641835
tea,Hmremix,kx8w7l,Green tea comparison: Chinese Long Jing Dragonwell vs Japanese Gabalong. Which is the winner?,[removed],1610641413
tea,5Firefly5,kx8hsb,Roasted Green tea from Japan. Advice on how to make it?,,1610640226
tea,[deleted],kx8ga1,Roasted Grean tea from Japan,[deleted],1610640101
tea,chippedreed,kx8doa,Where to buy a sturdy Ruyao gaiwan?,"I know it’s very specific, but I’m wondering where I can get a gaiwan for oolongs and pu-erh that can retain heat really well, not a thin gaiwan. What are some good places to look at? Celadon is good too",1610639906
tea,crazeone1,kx6cf3,Switched from coffee to Matcha but it’s making me anxious and nauseous,"So I’m a hard core coffee drinker. Nitros and espresso shots throughout the day. I wanted to switch to something healthier.

I started with a teaspoon of matcha in hot water and it makes me feel horrible. I had it on an empty stomach I’m aware of tannins but I also drink nitros and black coffee on an empty stomach with no issues.

I’m stumped and I really want to make this work. Does anyone have the same issues?",1610633492
tea,geoff_plywood,kx5ol3,What is the origin of the brew temperatures?,"Thank you for the useful brewing guide and FAQ.  I wonder where the guide figures for the brew water temperatures come from; is there an 'official' authority on brew temperatures for the various tea types, please?",1610631115
tea,AutoModerator,kx4bk6,"What's in your cup? Daily discussion, questions and stories - January 14, 2021","What are you drinking today?  What questions have been on your mind?  Any stories to share?  And don't worry, no one will make fun of you for what you drink or the questions you ask. 

You can also talk about anything else on your mind, from your specific routine while making tea, or how you've been on an oolong kick lately. Feel free to link to pictures in here, as well.  You can even talk about non-tea related topics; maybe you want advice on a guy/gal, or just to talk about life in general.",1610625612
tea,lo261,kx1w1v,Surely jasmine tea doesn’t have calories..?!? Can anyone help? I’m fasting at the moment and if this is breaking my fast I might as well eat!,,1610613967
tea,Danoga_Poe,kx1hiw,Looking for loose leaf tea recommendations,"Hey everyone, I'm looking to branch into loose tea. I normally drink twinnings english breakfast and lipton green tea. 

I was browsing Amazon for loose tea and there's so many different brands and tea choices I didn't know what to get. 
I was looking at vadham and harvey&amp;sons

I was hoping I could get some recommendations on good brands for different kinds of loose teas as well as a good tea infuser or tea steeper. 

Besides green tea and English breakfast I'm looking to try 
Irish breakfast, Chai tea, white tea, ginger, peppermint and earl grey tea.",1610611936
tea,QuestionablyInnocent,kx0msb,I’ve made a blend for the valerian root powder I picked up a few weeks ago to help with my sleep disorder.,,1610607889
tea,scootsMKL,kwyf0q,Alishan Oolong. Is this look right? I've read some Alishan Oolongs are coated in Ginseng and I'd like to avoid that.,,1610598890
tea,Hopeful_Honey,kwvwr7,Question about Oil /extract,"I have a tea from a local shop that has “almond oil” listed as an ingredient.

As someone who mixes their own tea, I’m curious how I could use oils/extracts to infuse dried earl grey .

I typically mix teas in big batches. So I am wondering if I could coat my earl grey in vanilla extract and let it dry, then steep later? 

Or is that a terrible idea lol",1610590274
tea,MisterBowTies,kwutra,I need a better 50ml teapot,,1610586583
