subreddit,author,id,title,selftext,created_utc
tea,tenariosm9,kwrwcq,Should I get a temperature controlled kettle?,"I’ve been drinking tea more regularly for a couple months now. So far my favorite is jasmine green tea from yunnansourcing. I’ve also tried tie guan yin, a dan cong, a heavily roasted oolong, and I have some greens on the way from them right now that I’m very excited about. Anyway, I’ve been using a kettle that just boils water and I’m considering upgrading to a Bonavita temperature controlled one. Is being able to control the temperature that important? Is it worth the upgrade? Thanks!",1610577650
tea,H_Digi_Arts,kwrauz,surprised by cheap tea?,are there any teas that were cheap or cheapish that surprised you by how good they tasted?,1610575899
tea,alisonrumak,kwquc8,Thoughts on higher end Harney teas?,"I was gifted a nice gift card to Harney and am thinking about spending it on something usually out of my price range. They have such a wide array but I'd love to treat myself to something in the $60/lb and up range.

What do you think? Are there any Harney teas you love at the higher price point or should I wait and save it to restock my every day favorites (Russian Country, All India, Ginger Liquorice)?

Thanks in advance!",1610574596
tea,BobertFlay153,kwqc2p,A Relaxing Cup Of Cinnamon Almond Tea,,1610573151
tea,chaqintaza,kwqboy,Charcoal stove and kettle?,"Hi, does anyone have recommendations for charcoal stove and kettle combos (sold together or that are of similar dimensions) for gong fu purposes?

There's a pic of a nice set in this blog post: [https://deathbytea.blogspot.com/2015/07/i-shaved-my-face-for-this.html](https://deathbytea.blogspot.com/2015/07/i-shaved-my-face-for-this.html)

I am not talking about samovars, but rather relatively compact stoves that work with similar-sized kettles. Thanks!",1610573121
tea,Tea-Cats,kwq3f6,"Just came in, my new travel set. It's not very high quality but really cute and handy. Cat themed, two tea cups of different size and japanese style/shiboridashi tea pot. It has nice travel bag and a small towel. Fits really nice in hands, has a good water flow. I can't wait to try it out. 🥰🍃🍵",,1610572472
tea,Jkolinski32,kwpxkh,Tea similar to Teavanna Winterberry,"The only hot tea I’ve ever really enjoyed way the Teavanna winterberry. Since that’s not really accessible any more, does anyone have any suggestions on something very similar. I’m also open to suggestions for kinds that are a little different but still close. Thanks in advance!",1610572016
tea,Evo411,kwplg5,Still waiting for my brewing mug but I'm excited to start my journey!,,1610571072
tea,redspextr,kwpkl8,A nice glass of Ti Kuan Yin to celebrate a negative test result.,,1610571000
tea,ShadowSeal,kwpfqd,Even nature has a share in your cup of tea.,,1610570609
tea,ebracho,kwpaf0,First time brewing loose leaf tea 🍵,,1610570195
tea,[deleted],kwp65o,First time brewing looseleaf tea 😍,[deleted],1610569868
tea,Zen_Hobo,kwoya4,"A Japanese Oolong, of which I got a sample for Christmas. I haven't been so confused with a tea's taste since my first Pu'Erh...",,1610569240
tea,pavchen,kwomra,My mom’s tea cup collection,,1610568351
tea,RosaWingfieldkv,kwnwpc,Prix des appartements à Istanbul 2021 | Citoyenneté Turque,,1610566280
