subreddit,author,id,title,selftext,created_utc
tea,Willis13j,l4ph2z,Does anyone know what brand this is or if they've seen this before?,,1611586768
tea,kristinworks,l4oy69,A sight for sore eyes on this Monday morning,,1611585087
tea,TINSTY,l4nwko,Cup of Knowledge - An immersive theatre piece about tea leaf reading,"My writer friend and I made a series of recipes for feelings and tea cups to go with them that have become an online tea reading experience.

&amp;#x200B;

*Processing img zq95fwhndhd61...*",1611581513
tea,Alpex_Ceylon_Tea5634,l4n64e,"Greetings from Sri Lanka. We can supply Black tea, Green tea,White tea, Herbal tea and Red tea, premium speciality teas. We are Alpex Ceylon Tea Pvt Ltd a leading Exporter of high quality Ceylon Teas. Do you interested in Purchasing Teas From Us? http://www.alpextea.com👈 click to know more about us",,1611578740
tea,joaojurca,l4n0mr,Opinions on King Tea Mall?,"Have you guys ever bought there? I was thinking about buying some sheng and perhaps a yixing teapot there, are they good quality?",1611578105
tea,Affectionate_Cost_65,l4myhu,"Fantastic mug, bought for a present and can’t wait to give it to my husband. Bit jealous though",,1611577856
tea,Dina_nyad,l4mj1d,"I ordered my first TEA box from Dear Tea, will keep you updated :)",[removed],1611576119
tea,Stunning-Catch5716,l4mirg,Gyokuro Oku no Tsuyu Shincha of Sazen tea," Gyokuro Oku no Tsuyu tea, a shincha,  did not disappoint. At first infusion, on 50 degrees Celsius water,  it has a sweetness taste to it, and a lot of umami. Second infusion there are a little bit of bitterness and the umami is still there. fouth to fifth infusion, I used 75 degrees Celsius water and 100 degree as the taste slowly fades. I like this tea a lot. Moreover, Sazen is pretty fast in delivering my tea haul. 

https://preview.redd.it/xo6ghptywgd61.jpg?width=960&amp;format=pjpg&amp;auto=webp&amp;s=8395bdf12ca737a2904e1256ab8d6bbddc43f298

https://preview.redd.it/gaqppptywgd61.jpg?width=960&amp;format=pjpg&amp;auto=webp&amp;s=3d45b6cd38c805c7422793c1231f0c7dea8d260c",1611576087
tea,AutoModerator,l4mi1o,"What's in your cup? Daily discussion, questions and stories - January 25, 2021","What are you drinking today?  What questions have been on your mind?  Any stories to share?  And don't worry, no one will make fun of you for what you drink or the questions you ask. 

You can also talk about anything else on your mind, from your specific routine while making tea, or how you've been on an oolong kick lately. Feel free to link to pictures in here, as well.  You can even talk about non-tea related topics; maybe you want advice on a guy/gal, or just to talk about life in general.",1611576017
tea,5um11,l4m67z,My hand is numb from this tea,,1611574549
tea,Kormoraan,l4ls4w,My casual tea set and Shui Xian are perfect match for work :),,1611572773
tea,YouFourKingsHits,l4l6q9,Storing tea with a valved bag,I have read that coffee must be stored in a bag with a valve to allow gases to escape. Is this necessary with tea (black/herbal/other)?,1611570227
tea,212134,l4l452,Traditional Chai In The Morning In Traditional Cup... Refreshing! :D,,1611569917
tea,sprlte,l4ky4f,What things do I need to start brewing cold black tea w/ sugar?,I've had enough of buying tea bottles and I wanted to save money. Any good products for a beginner?,1611569209
tea,Die_Schnitzel,l4jc0u,My green tea tasted like fish or seaweed.,"Hi people, first time poster here. 

I tried to follow a guide made by a tea taster that briefly consisted of using water from a purified source (Brita filtering water bottle), bringing it to the desired temperature, and then pouring it on the teabag. 

The taste wasn't quite what I expected. It tasted like seaweed and I was quite surprised. 

The tea is Sir Winston's green tea and I use a ceramic pot if that helps.",1611562261
tea,cabbagecakeandtea,l4iuk2,"Will be trying matcha soon for the first time, I do not have any of those fancy equipments, just the powder, any tips?","Also please share your recipes for variations of the same 

It's ceremonial grade matcha and I do not mind a slight bitter taste",1611560267
tea,Sky_King73,l4ioqp,Japanese Vending Machine Green Tea PET Bottles,,1611559632
tea,Flyguylycan25,l4gxci,Tazo calm chamomile A- definitely recommend if you want aromatic but soothing night drink. It really does get rid of head aches or maybe that’s the placebo. Look at my cactus !,,1611552634
tea,hiku1919,l4goyg,"John Daub's made an interesting and informative video on Japanese green tea, its varieties, and how it's grown in a city at the base of Mt. Fuji. Perhaps this will be of interest to some of you?",,1611551722
tea,Hxcmetal724,l4fcg7,Lime honey pairings,"Hello there!

Does anyone have experience with using lime flavoring in tea? I got a huge jar of honey infused with key lime and I'm not sure how to pair this with tea. Looking for some suggestions! 

Thanks all",1611546865
tea,plant_novice,l4f8rn,Sun tea questions,I love making sun tea (it’s nearly 90deg F) everyday where I live. I also like to add small limes. Is it best to add them as slices and middle them in my pitcher before adding water + tea and brewing? Or should I brew just the water + tea and then later add the juice of limes.,1611546491
tea,moonkid_,l4ez45,Recommended online source to purchase Jin Xuan?,Preferably something that doesn’t break the bank and ships to the US. Cheers!,1611545549
tea,ggardner_art,l4dshc,I couldn't help my self!😁 Advance apologies if you take offense.❤🙏❤ I do not mean to do that.🐰😁🐰,,1611541591
tea,thegoatfreak,l4cxk6,"Does anyone know what type of tea this is? I recently discovered it and am absolutely in love with it, but I can’t tell what type it is. All I know about it is that it’s really strong, and goes very well with milk and sugar.",,1611538769
tea,c0rpsey,l4c5tk,Traditional teapot,,1611536235
tea,GotToWorkOnIt,l4c41v,Another day of tea,,1611536064
tea,TheEndOfLevelBoss,l4b816,Alternative to teapac?,"Hi!

I used to order Teapac boxes from Amazon but now the brand is unavailable there and Teabox charges $17 for shipping on a $20 item. So not an option.

Is there any alternative for nice, kinda unique and flavorful teabags?

Thank you",1611533178
tea,ShannyPhantom,l4b4if,"Thinking about getting into matcha, any recommendations or tips?","Despite the amount of tea I consume and collect, I really cultivated my taste based on what I could find at stores or online, due to not living anywhere near a tea shop. I don't have particular leaning towards any type, though I drink an earl grey several times a day like coffee, something floral to hang out with in the afternoon, or strong oolong  or jasmine in the evening. Matcha hasn't been something I really have tried, it just never crossed my mind I guess, but I had it prepared for me and I think I could get into! I like really intense flavors, and don't shy away from things that are bitter or overwhelming to some. Any recommendations on what brands to start with, and what equipment I'd need?",1611532869
tea,Terrarosa81,l4a2m3,"Mei Leaf Superior Iron Goddess~ In my favorite Harlow bone china tea cup. Found an old sample while digging through the collection. Haha left me a bit flushed. Very light jasmine, heavier butter notes, and a tingly green apple finish. Always a pleasant surprise finding ""lost"" samples 😋",,1611529608
tea,mdk1_mdk1,l49uem,Looking for information about this teapot,,1611528896
tea,succysloth,l49f48,Bangkok by Harney &amp; Sons,,1611527596
tea,ArtificalSynthesis,l48asl,Does milk curdle in earl grey?,Do people usually put milk in earl grey tea? Does it curdle or not?,1611524321
tea,Pluriel0,l48514,My humble but lovable teaware.,,1611523841
tea,mtw206,l47wdi,Chai,"I am looking for what brand Mercury's Coffee Co in WA uses for their chai lattes!!! If anyone knows, please let me know! I know that it is a powder.",1611523145
tea,Worth_Opportunity317,l47lx2,Stolen Tea ep. 2!,,1611522332
tea,Substantial_Bee_4992,l46vhy,my tea collection (pic in comments) + some questions,[removed],1611519990
tea,MrFartMuncher,l46mtm,How do you prepare loose leaf tea when traveling?,"How are people bringing their looseleaf tea when they travel? 

I like to backpack and want to bring looseleaf tea on my trips. I read that looseleaf tea reusable bags would be the move, any tips or material ?",1611519351
tea,demsideburns,l46kdf,The Making of a Traditional Tea Pot,,1611518987
tea,Jkpage2013,l46iz4,Generic name?,"Does anyone know a generic name for this kind of teapot?  
I love using it at work because its small, simple and self contained.  
The one i have is the Kamjove brand. I know Mei leaf has a similar teapot called the Connoisseur Brewer.  


My sister is wanting to start getting into tea, I gave her mine to borrow because i can't seem to find any available anywhere, especially one that is gongfu size. Any ideas?",1611518750
tea,Tea-Cats,l4662p,When You and Your friend like different kind of tea. (And husband prefers coffee...) 🍵🍃,,1611517414
tea,Senrika_,l45bdi,Ingredients - 4 ceylon tea bags - 2 sticks of cinnamon - 1 tbl spoon of ginger - 2 star anise - 4 cloves - 4 cardamom - 1/2 tea spoon tumeric - 1/2 tea spoon black pepper - 1/2 cup milk to boil - 4 cups of water to boil - add sugar to taste Makes 4 cups masala chai💜,,1611514416
tea,BagelCo,l453st,"The ""microwave method"" let me love tea","I'm an outsider to the world of tea, up until this point making tea the ""proper way"" resulted in nauseous mornings/afternoons, no matter what type or additions I add in... even though I liked the taste and wished to try more I always ended up sick. It was only just recently I discovered the microwave method (microwave small amount of water and teabag for a short burst, let steep for a minute, fill the mug up with the rest of the water and microwave to desired temp) and discovered this way made the tea much easier on my stomach. Now I love to drink it and can't stop!  

I know I'm probably losing *something* by doing this but if it lets me enjoy tea without nausea I'm going to keep doing it and keep trying different teas. Does anyone else do this or is it considered sacrilegious...?",1611513466
tea,axetobe_ML,l44qjw,Help me make a database for tea,"Hi guys,

I made a [google spreadsheet](https://docs.google.com/spreadsheets/d/1ani8yD-7DAld25ro-Pl1cDZLcoDvufBbX0_FP0d-keE/edit?usp=sharing) where you can add your recommendations. If you want a public resource to find new tea recommendations.

The list is **very** short for now. Because I only drink a few flavours right now. Which maybe some of your recommendations should help fix.

This spreadsheet can help if you just want a long list of suggestions you want to try.

Or a nice place to check on a regular basis for new tea suggestions.

&amp;#x200B;

As the list is public, tons of people can add their suggestions. And the spreadsheet is regularly updated for people like you.

If you want to save the spreadsheet for personal use you can do so. This should be another way that users of this subreddit. Share their tea suggestions.

&amp;#x200B;

From there you can take the suggestions from the list. And try them out for yourself.

This should be a quick way to add your recommendations. To the public.

Also, this can be a place where you can point your friends for new teas to try out.

&amp;#x200B;

Add your recommendation [here](https://docs.google.com/spreadsheets/d/1ani8yD-7DAld25ro-Pl1cDZLcoDvufBbX0_FP0d-keE/edit?usp=sharing) to the google sheet.

&amp;#x200B;

Also feel free, to suggest any ideas or columns add to the spreadsheet. In the comment section of this post.",1611512424
tea,msb45,l44gsz,Learning to Gong Fu for the first time while watering my orchids,,1611511670
tea,ahdbusks,l42kkq,Best infuser mug uk,Looking for a decent sized infuser mug that can be bought on the UK preferably online,1611505811
tea,Kaths1,l40rmm,Two flavor profiles- do you like earl grey,"So after reading this sub for awhile, as well as lot of my friends who like tea, I have decided there are two types of flavor profiles- based on whether you like earl grey. 

If you like earl grey: you also like matcha and other japanese green tea, and you like lavender flavor in your tea. 

If you hate earl grey, you like english/irish breakfast,  prefer fruit and spice flavors in tea, and prefer non-Japanese green teas. 

So, what do you all think- am I right about you?",1611499742
tea,SymFloNy,l3zyfq,Is my teapot dangerous for my health? I have it since 2013.,,1611496822
tea,April_Maple,l3zduc,Someone asked for tea bag organizer pics,,1611494711
tea,bprice409,l3z2kb,What specific tea (brand and make) has the MOST caffeine?,"This is surprisingly hard to research online. I know that Black tea contains more caffeine than other types of tea, but I’m hoping for specifics on where I can find the strongest (highest caffeine content) tea out there. I am recently switching from coffee to tea so I am in need of all your expertise. Thank you!",1611493477
tea,mimi_moo,l3z203,"tea isn't really big where i'm from, so i'm always happy to see new shops selling them - this set is called ""tea o'clock"" with 10 samplers and an infuser 😍",,1611493413
tea,Gullywump,l3yvq2,So I accidentally got 'tea drunk'.,"I had no idea this was a thing.

Last night I decided to try some oolong that I got from my local Asian import supermarket last year. It was just a generic unbranded one - the only thing it said was 'oolong'.

About an hour after drinking it I felt like I was buzzed and as sensation akin to levitating or floating. I felt all warm and fuzzy and peaceful. But being someone who never gets high or drunk I was worried about what was happening as I'd never heard of tea having this effect. So after extensively racking my brain and googling I came across the term tea drunk, and it seemed to describe what I was feeling.

Has anyone else experienced this? I'm sort of paranoid about it, because like I said I hardly drink and I've never been properly high in my life haha.

Though it was very peaceful and I had a great night's sleep for the first time in a long time (I'm an insomniac), this morning I'm still sort of feeling it. Maybe because I haven't drunk or eaten anything since that pot of tea? Definitely going to get myself some breakfast now...

I'm really interested to learn more about this though, but I'm going to be saving that oolong only for special occasions.",1611492726
tea,katiekatie7785,l3xvw4,My teas!,"I’m enjoying looking at all the tea cupboard posts (or tea spaces). I’m getting to the stage where I’m able to see where the teas come from by their names/packets. 

I’m lucky that my husband lets me have a whole tea cupboard in the kitchen! (Although he jokes that it would happened anyway). I have no loyalty to any particular brand. I like what I like and am a fan of exploring. Although my favourite brand of tea I can’t get in the UK. 

The purple pen labels are black tea, green is green tea, light blue is fruity and purple is herbal.",1611488188
tea,PasjaKing,l3wvk6,Is this kettle still usable with the corrosion?,,1611483262
tea,AlyssaXIII,l3wupd,"All my tea tastes like hot water, what am I doing wrong? Please help!!","Hello! 


So I'm very new to tea, and as the title says I'm doing something wrong I just don't know what. 



I used bottled water, check. 



Water at around 200-215 degrees, check. 



Steep for tea appropriate amount of time (4-7 minutes depending on tea), check. 



At the end it just tastes like hot water, occasionally with a hint of...something. Of course, if I add things to the tea (almond milk, sugar, honey, etc) it tastes like hot water + insert. 




It always smell delicious! But I just cannot get the complex flavors everyone is always talking about, or any flavor at all!! 




Advice, tips, help etc is so so greatly appreciated.",1611483149
tea,PasjaKing,l3vtxa,"This is my tea kettle, but the inside looks a bit worn out. Could I still use it or shouldn’t I? Thank you in advance!",,1611477790
tea,John-Kingtea,l3ulmr,Reliable and professional Chinese tea &amp; teaware seller. by KingTea,,1611471679
tea,juju__eyeball,l3ukqa,Celestial Bengal Spice in the Philippines?,"I was hoping if there are any members here from the Philippines who has extra bengal spice I could buy or knows a shop where I could get it from. I looked online, and while Celestial is widely available, there’s no Bengal Spice variety.

I took boxes of this when I came back from the states, and I finished them all up two weeks ago so I’m having withdrawals that not even matcha could make me feel happy again. I work from home, and this usually gets me started with my day so I’m getting desperate!

Boxes of bengal spice were supposed to arrive this month, but somehow my order still hasn’t arrived... and that was shipped last October!",1611471581
tea,tttony2x,l3u8e5,Am I a degenerate?,"Thanks to some Christmas gifts and like $25 spent on ohioteaco.com, I've been trying out tea. I steep loose leaf in a pot of just-boiling water for the designated time, pour into a double walled water bottle, add milk and sugar to taste, and enjoy.

This sub seems reaaaal finicky when it comes to temperature, instruments, et cetera, and I feel like I'm out of my depth when looking here.",1611469981
tea,Ok_Measurement_4175,l3u1jg,First yunnan sourcing order! Any tips on brewing Western style?,,1611469126
tea,PlaneElectronic8354,l3t71p,National Hot Tea Month 2021,,1611465522
tea,Yakassa,l3t1uv,My Tiny Tea Tower.,,1611464932
tea,MarketLittle625,l3sw2f,Minimalist gong fu brewing?,"So I'm the only one in my family who enjoys tea on a daily basis and loose leaf even, and i want to get into gong fu brew brewing but don't have a lot of space and honestly don't want to shell out for a nice set right now when I'll be the only one using it. Also considering the potential of doing sessions on the go as well and wondering if there are any devices which help enable that.",1611464341
tea,l4fashion,l3sdjv,Does brewing gong-fu cause you to ingest more caffeine? Any way around it?,"So I'm a bit caffeine intolerant (just a bit). Like 1 whole cup of coffee is my upper limit.

I have done green tea in teabags before and i do fine with it.

However I'm going down a rabbit hole of teas/brewing. I was gifted a [teapot infuser](https://www.amazon.com/Workshop-Japanese-Tetsubin-Stainless-Interior%EF%BC%8CBlack/dp/B08DFHQCLJ/ref=sr_1_4?crid=1OAEGKJOBC2LY&amp;dchild=1&amp;keywords=teapot+infuser&amp;qid=1611462014&amp;sprefix=teapot+infu%2Caps%2C178&amp;sr=8-4) and I just don't see how to make it work, since it's so large, and I'm usually only going to be brewing a single cup for myself, and I don't want to waste tea cause holy shit [good tea is expensive](https://www.adagio.com/green/dragon_pearl.html).

Anyways. I find gong-fu brewing. Seems cool, but it also seems that doing 10ish small cups of tea with more leaf will net a pretty damn high caffeine content? So I guess I can see only two ways around it:

* Find a smaller gaiwan, and only use 2-3g of tea to fill the gaiwan and brew 10 super small cups of tea. I can't seem to find a small gaiwan anywhere...

* Just stick to western method? I guess I can just do this, but I feel like i'll be missing out on some alternatives to discover more tea flavors...

Anyways, what are your though? Any way around this? Any other ideas?",1611462285
tea,rmoody23456,l3rr10,I tried 2 teas today from the International Virtual Tea Festival. Minty Cookies &amp; Cream was a good minty black tea. No cookie flavor. Carrot Cake Rooibos had lovely flavor notes that tasted like carrot cake. Label/company info in 3rd picture.,,1611459896
tea,koavf,l3r6uz,The International Tempest Over the World’s Most Famous Teapot | The Walrus,,1611457824
tea,lameinternetuser,l3qz1c,Anyone has any recipes for tea blend with these components?,"Hi everyone, I'm new to this sub, so I don't know if this is the right place to ask this question. I'm very new to this tea blend wizardry and currently don't know how to mix my dried ingredients. Can anyone share recipes or knowledge on how to mix these ingredients?

Currently I have
-rooibos
-peach blossom
-jasmine blossom
-purple amaranth
-snow chrysanthemum
-chrysanthemum baby buds
-safflower buds
-horsetail stems
-swallow nest
-yarrow leaves
-honey suckle
-calendula flowers
-chamomile flowers
-lavender flowers
-rose flowers
-fig fruits
-forget me not flowers
-rosella flowers
-butterfly pea flower

Thank you :)",1611457082
tea,mmmmmmmmnope,l3qf90,What’s your solution to the “tea floaters” issue?,"I’ve recently began to get very very into tea- but as I’ve been learning, I’ve also discovered an unfortunate issue. I’m hoping that you all have some good solutions, and I think you probably do! 

I’ve recently learned about the microplastics issue with teabags- that when a lot of brands of tea are heated up, they release millions of tiny microplastics. Definitely not what I want to be drinking. 

Because of this issue, I’ve been cutting open my tea bags and dumping them into various tea strainers- and I have some loose leaf teas that I’ve always done this with. 

When I use metal strainers with my tea, I get little floaters in the top of my cup. They get in my mouth and it just ruins my experience. I’ve had this issue even with extremely fine metal strainers, unfortunately. 

I can get a pretty smooth experience by using cheesecloth, but it’s specialty, and a little expensive where I live. I’m also reading that the best tea needs to have space to breathe when the water expands the leaves, and most tea bags don’t allow for that. 

So what do you all do? Should I just bite the bullet and get cheesecloth in bulk? Teach me your ways! 🙏☕️",1611455070
tea,Sorry_Im_a_4,l3qdti,"Saw people sharing their collection, so here’s my tea drawer!",,1611454930
tea,frecklestwin,l3qd8y,On behalf of my sister - What kind of tea is this? This was a gift from a coworker from China.,,1611454871
tea,Automatic-Bid-6030,l3qbuy,Recommendations? Buying tea in mainland China,[removed],1611454730
tea,mcsmith24,l3p4wx,What are your white2tea favorites?,"I'm trying to figure out what to put in my next order. Do you have any favorites? I have been working on some snoozefest, demon slayer, waffles, and lumberslut from my last haul. I've also really been enjoying some of the mini cakes because they are just so darn convenient. What do you consider a must try?",1611450524
tea,blinkallthetime,l3oacc,oolong; sometimes the big pot is the best pot,,1611447659
tea,glacialwind,l3o0yn,Some of my favorites,,1611446814
tea,Sky_King73,l3mvby,"Japanese Green Tea, The Perfect Cup",,1611443168
tea,irrelevant_ranting,l3moc6,I love seeing all your tea stations! I figured I should add mine.,,1611442592
tea,mriv1,l3kcup,Please follow my Instagram,[removed],1611435442
tea,Dina_nyad,l3k253,Someone can recommend teas in Belgium? I am a loose leaf tea addict and looking for new tastes :),[removed],1611434559
tea,99minds,l3jvry,Show me your tea bag organizer!,[removed],1611434047
tea,MarketLittle625,l3izqw,Wanting to get into matcha again,So I drank a lot of culinary grade matcha as a latte a couple years ago and want to bring that back into my life. So whats a good place to order quality matcha from? Culinary and ceremonial grades. Also after opening them how long until it goes bad?,1611431351
tea,Mismishmash,l3igb3,Someone loves to buy tea in bulk like me? Miam 🍃,,1611429750
tea,salviaaaa,l3i4qt,Can you smoke tea after you drank it?,I have a cannabis green-tea and was curious if I can smoke the residue haha,1611428715
tea,okshara,l3hznw,Earthy mushroom tea,[removed],1611428333
tea,cateahouse,l3hnwn,Is Chinese Tea safe during the Coronavirus pandemic?,,1611427102
tea,cateahouse,l3gr7d,Tea for Dogs?,,1611423972
tea,jazzboys,l3gli9,Need recommendation - Looking for something earthy/strong,"Don't know much about teas beyond the usual stuff you can find at the grocery store. I like herbals like peppermint but I'm getting sick of mints/spices/sweet flavors. I want something earthy, rooty, dirty, to drink in the afternoon or evenings. No caffeine. Anyone have any recs, can point me to a good online source to order?",1611423482
tea,matchaseeker,l3fy2x,Looking For Bulk Matcha in Canada,[removed],1611421531
tea,renlynnx,l3fn2l,Tea haul 🥰,,1611420612
tea,GotToWorkOnIt,l3fm84,MY pillow,,1611420540
tea,Eco-Cha,l3fa0u,Waiting for the harvest . . .,,1611419518
tea,Stunning-Catch5716,l3e6gr,"Finally, I brewed the 2007 Nanqiao Qiao Mu King. It is really good, and has a decent cha qi too. The tea lasted for 20+ (I think) Thank you everyone for identifying this sheng!",,1611416118
tea,SellaTheChair_,l3e2ju,Matcha allergy?,"I love drinking black tea and have earl grey almost daily, but I also like the taste of green teas and matcha. I find every time I drink matcha it causes a weird sensation in my throat like drinking water with little bits of sand or rough pieces of something in it. Then my throat has a sort of full feeling or lump in it for a while that makes me feel like I need to swallow.

I never experience this with any other teas (even other green teas). When I eat matcha flavored foods (chocolate, ice cream, etc.) I also have this problem, but I can't find anything about this online.

Does anyone else have a similar experience?",1611415763
tea,Evo411,l3dhgh,Recent tea haul. If you haven't tried it Jasmine Phoenix Pearls are my new favorite green tea,,1611413839
tea,x11235813213455x,l3d6nj,2009 Hai Lang Hao Yiwu Zheng Shan. Morning session.,,1611412761
tea,thankyoufairy,l3d10b,"Today I drank Golden Monkey! As you can see, I am having trouble using the gaiwan without dropping a lot of tea... Any tips?",,1611412171
