subreddit,author,id,title,selftext,created_utc
tea,ianthus,l3civh,Teaware similar to Shelley's ?,"Hello everyone.

I've recently discover the Shelley antique teacups, and especially the Wileman series. I love the particular shapes they have (cf Dainty or queen Anne sets for example). However, being antiques, they can be hard to find and/or expensive.
Would you happen to know of any other brand that has produced or produces today teaware with such special shapes?",1611410290
tea,ChemicalCracker,l3cfw4,I'm a bit obsessed,,1611409957
tea,Chainsmoker88,l3br8f,Can you grandpa blacks?,"I've been having a lot of tea grandpa style lately, mostly out of laziness. But I actually like this method, it provides a unique experience that gong fu just can't.

Anyway, what I'd like to know is, is it advisable to grandpa black teas? I would imagine no as they'd become much stronger much quicker. But if anyone has tried it and would like to provide some insight that'd be great.",1611407135
tea,Farisa_TheLadyKnight,l3bcp4,Quince Tea,"Hello all.
I recently tried out a sample of Tea Forte's ""Darjeerling Quince"" and they're out of stock. I tried to look for an equivalent on Adagio, but haven't found anything. Also, I've checked on the web and can't find teas with Quince in them. 

If anyone knows Quince tea blends, please comment below. I am in love with the scent and flavor of this wonderful fruit! Below is the product link. 

https://www.teaforte.com/store/gourmet-tea/black-tea/darjeeling-quince-tea/#anchor",1611405364
tea,drainingenergy,l3b44h,Had the nicest white peach tea at Yatsudoki 🤍🍑,,1611404261
tea,AutoModerator,l3avrh,"What's in your cup? Daily discussion, questions and stories - January 23, 2021","What are you drinking today?  What questions have been on your mind?  Any stories to share?  And don't worry, no one will make fun of you for what you drink or the questions you ask. 

You can also talk about anything else on your mind, from your specific routine while making tea, or how you've been on an oolong kick lately. Feel free to link to pictures in here, as well.  You can even talk about non-tea related topics; maybe you want advice on a guy/gal, or just to talk about life in general.",1611403217
